username;date;retweets;text;hashtags;id
whseeds;2016-04-15 21:31;0;"Have you ever struggled with Downy Mildew in your #garden ? Here's some ways to prevent this #plant disease http:// ow.ly/10kyEb";#garden #plant;"721058358355169283"
viviannastevens;2016-04-15 15:49;0;"Downy mildew on my basil http:// ift.tt/1W3o1U8 #Gardening";#Gardening;"720972348644593664"
gardeningguru;2016-04-15 15:37;0;"Downy mildew on my basil: http:// imgur.com/Ki5J5rk After doing some quick researching, I believe ... http:// tinyurl.com/j2xmsmx #redditboost";#redditboost;"720969362010542081"
gentoogroup;2016-04-15 13:00;0;"Watch out for downy mildew and blackspot on winter pansies #NationalGardeningWeek";#NationalGardeningWeek;"720929699753369600"
rob_choudhury;2016-04-13 20:53;0;"Spinach downy mildew in the Salinas Valley pic.twitter.com/3xTwUdDkyQ";;"720323946873102338"
toastradio;2016-04-13 13:53;0;"A Borrowed Chant by Downy Mildew #nowplaying on http:// toastradio.com";#nowplaying;"720218371527041025"
ProtectingCrops;2016-04-13 07:19;0;"Check out the new VA mag #sprays p18 #downy #mildew p30 #GreenPeachAphid p32 #nematodes p43 http:// ausveg.com.au/publications/V A/VA-MarApr2016.pdf … pic.twitter.com/Qye7x2Ds3E";#sprays #downy #mildew #GreenPeachAphid #nematodes;"720119293808144386"
RootedHope;2016-04-10 14:34;0;"My #basil Eleanora is coming along nicely. Variety is resistant to downy mildew . #gardenchat #gardening #foodie pic.twitter.com/XijCj7b6wS";#basil #gardenchat #gardening #foodie;"719141586139918338"
gastehowe;2016-04-10 01:34;0;"dress my shoulders in downy mildew , you apple scab. mix me a drink called rust on hollyhock. goodbye, pocked and round, fallen at the center";;"718945209925689344"
meteostationsb;2016-04-09 23:13;0;"AVVISO METEO : downy mildew conditions have been reached";;"718909666206552064"
cel_delmas;2016-04-08 09:24;18;"Big expe of experimental evolution going on! Downy mildew adaptation to resistant grapevine #apache @Inra_BdxAqui pic.twitter.com/0NHcKardCz";#apache;"718338664082837504"
dallaspiscopo;2016-04-08 00:24;0;"@HobbyHydro @nicolecotroneo @brightfarms #hydrospinach strikes me as viable alternative to supplement demand when downy mildew is unstopable";#hydrospinach;"718202938116583424"
dallaspiscopo;2016-04-08 00:15;0;"@HowGrow @nicolecotroneo @HobbyHydro @brightfarms Downy mildew HUGE problem for organic spinach farmers...hydro-spinach looks less stressful";;"718200523661254656"
dallaspiscopo;2016-04-07 23:58;0;"@HowGrow @nicolecotroneo @HobbyHydro @brightfarms Great video! Pythium was explained well but do they have any issues with downy mildew ?";;"718196213019910145"
pamilakagamida;2016-04-06 22:00;0;"Avoid Downy Mildew In Your Garden http:// fb.me/2c808a1k6";;"717804183202762752"
VGN_News;2016-04-06 20:27;0;"RANMAN registered for downy mildew control: http:// bit.ly/1VxtfHo";;"717780773068218368"
GoAnimalNSave;2016-04-06 18:01;0;"#prnewswire RANMAN Registered For Downy Mildew Control In Bulb Vegetables. http:// goo.gl/zjKf6R";#prnewswire;"717744101874073601"
Nick_Leone;2016-04-06 17:29;0;"Fungicide Receives Registration In Bulb Vegetables To Control Downy Mildew http:// ift.tt/1ROp6KL";;"717736028195405824"
environmentguru;2016-04-06 16:46;0;"RANMAN Registered For Downy Mildew Control In Bulb Vegetables. http:// goo.gl/fb/2pmyqX";;"717725205775400960"
SummitAgroUSA;2016-04-06 16:40;0;"Protect your onions from Downy mildew with Ranman. pic.twitter.com/7mBrupOxyV";;"717723589492011008"
OmniSovereign;2016-04-06 14:21;0;"RANMAN Registered For Downy Mildew Control In Bulb Vegetables. #sovereignmind https:// sovereignmind.net/news/ranman-re gistered-for-downy-mildew-control-in-bulb-vegetables/?utm_campaign=twitter&utm_medium=twitter&utm_source=twitter …";#sovereignmind;"717688752223727616"
garden_answers;2016-04-06 04:14;0;"New blog post from http:// GardenAnswers.com about Classic Downy Mildew On Cucumber - http://www. gardenanswers.com/plant-pests/cl assic-downy-mildew-on-cucumber/ … pic.twitter.com/4j41uAzitF";;"717535998079594497"
FarmsNews;2016-04-05 14:51;4;"Outbreaks Of Downy Mildew Of Wheat Read More... http://www. farms.com/commentaries/o utbreaks-of-downy-mildew-of-wheat-105752.aspx … pic.twitter.com/G3ZsCsvZMT";;"717333835881418752"
eVineyard_app;2016-04-04 18:50;0;"How downy mildew overwinters and infects the vines? http:// ow.ly/101T9S #pests #fungus #vineyard #grapevines pic.twitter.com/7m1t4AzI8N";#pests #fungus #vineyard #grapevines;"717031640531386368"
eViti_en;2016-04-04 18:50;0;"How downy mildew overwinters and infects the vines? http:// ow.ly/101T9S #pests #fungus #vineyard #grapevines pic.twitter.com/F1ON6w7VhG";#pests #fungus #vineyard #grapevines;"717031637465346048"
eViti_es;2016-04-04 18:50;0;"How downy mildew overwinters and infects the vines? http:// ow.ly/101T9S #pests #fungus #vineyard #grapevines pic.twitter.com/HGz8wVqqVf";#pests #fungus #vineyard #grapevines;"717031636123168770"
JimBradeen;2016-04-02 18:11;1;"Hops challenges: #1 diseases (many); downy mildew big problem (Prof Orshinsky) #CWQ16 #thankaplantpathologist pic.twitter.com/G0EAL4ypna";#1 #CWQ16 #thankaplantpathologist;"716297099772502016"
JimBradeen;2016-04-02 17:37;1;""Hops downy mildew is related to the Irish Potato Famine (late blight)" Prof Orshinsky #CWQ16 pic.twitter.com/kLsUQce8vh";#CWQ16;"716288494381846529"
JimBradeen;2016-04-02 17:36;4;""'We want beer!' Prohibition, downy mildew disease decimated Midwest #hops in early 1900s" Prof Orshinsky #CWQ16 pic.twitter.com/wcoWcxQg2n";#hops #CWQ16;"716288137463345157"
GreatLakesHops;2016-04-02 14:12;0;"Grower note #2 on Downy mildew control for yards with a history of DM: On a March 24 timeline post we suggested... http:// fb.me/2yJ7XKMfI";#2;"716236981575888896"
rob_choudhury;2016-03-31 19:05;1;"A nice day for rating downy mildew in King City pic.twitter.com/Jg0iNT92nG";;"715585936168325121"
RhondaJones_;2016-03-31 16:09;0;"Impatiens Downy Mildew https://www. provenwinners.com/learn/planting /sky-falling-impatiens-downy-mildew#.Vv0uoiU1hO0.twitter … via @Proven_Winners Any good news for impatiens this yr?";#;"715541573598109696"
RhondaJones_;2016-03-31 16:03;0;"I've been a victim of downy mildew impatiens flowers for the past couple of yrs...hoping they are healthy this year. #Iloveflowers";#Iloveflowers;"715540090467053569"
wallace_ec;2016-03-31 15:15;1;"New Race Of Downy Mildew In Spinach Named Pfs: 16 http://www. growingproduce.com/vegetables/new -race-of-downy-mildew-in-spinach-named-pfs-16/ …";;"715527948175024128"
vignevinfrance;2016-03-31 14:34;7;"Adaptation of a pathogen to partial host resistance: selection for greater aggressiveness in grapevine downy mildew http:// onlinelibrary.wiley.com/doi/10.1111/ev a.12368/epdf …";;"715517530014490624"
GrowingProduce;2016-03-30 16:06;1;"New Race Of Downy Mildew In Spinach Named Pfs: 16 http://www. growingproduce.com/vegetables/new -race-of-downy-mildew-in-spinach-named-pfs-16/ … #CropProtection";#CropProtection;"715178372763107328"
Nick_Leone;2016-03-30 02:22;0;"New Race of Downy Mildew in Spinach Named Pfs: 16 http:// ift.tt/22ZAA5d";;"714971043333586944"
kraken_syllabub;2016-03-26 22:50;0;"@thelionmachine @zer0jack ugh. If it is mildew ( downy mildew is brown iirc?) it can cause horrible resp issues, but not neuro stuff at least";;"713845601218256897"
amiran_kenya;2016-03-26 19:05;0;"@AlexBosire It's Downy Mildew . Spray either Victory or Sphinx Extra each 50g/20ltrs";;"713788887286616064"
TIMBERPROUK;2016-03-26 08:35;0;"Busy Lizzies make a comeback after downy mildew outbreak http:// swft.so/03nNtGWy #DIY #Home pic.twitter.com/F6pQO47uJt";#DIY #Home;"713630356159668225"
CoryW0ng;2016-03-26 07:55;0;"Busy Lizzies make a comeback after downy mildew outbreak - Bedding Busy Lizzies are making a comeback – just ye... http:// ow.ly/3cQX7n";;"713620377285574657"
IsaacT0dd;2016-03-26 07:54;0;"Busy Lizzies make a comeback after downy mildew outbreak - Bedding Busy Lizzies are making a comeback – just ye... http:// ow.ly/3cQX59";;"713620137312649216"
BeatriceCraig0;2016-03-26 07:52;0;"Busy Lizzies make a comeback after downy mildew outbreak - Bedding Busy Lizzies are making a comeback – just ye... http:// ow.ly/3cQWXe";;"713619634386284546"
MarcusD0uglas;2016-03-26 07:49;0;"Busy Lizzies make a comeback after downy mildew outbreak - Bedding Busy Lizzies are making a comeback – just ye... http:// ow.ly/3cQWJ1";;"713618881810661376"
Juli0Mitchell;2016-03-26 07:46;0;"Busy Lizzies make a comeback after downy mildew outbreak - Bedding Busy Lizzies are making a comeback – just ye... http:// ow.ly/3cQWsD";;"713618189167562753"
VickiJimen3z;2016-03-26 07:46;0;"Busy Lizzies make a comeback after downy mildew outbreak - Bedding Busy Lizzies are making a comeback – just ye... http:// ow.ly/3cQWqJ";;"713618116476026880"
Michael_Luna0;2016-03-26 07:35;0;"Busy Lizzies make a comeback after downy mildew outbreak - Bedding Busy Lizzies are making a comeback – just ye... http:// ow.ly/3cQW6L";;"713615293445251072"
Jacquelin3Bush;2016-03-26 07:32;0;"Busy Lizzies make a comeback after downy mildew outbreak - Bedding Busy Lizzies are making a comeback – just ye... http:// ow.ly/3cQVQa";;"713614620813078532"
GeoffreyB0one;2016-03-26 07:32;0;"Busy Lizzies make a comeback after downy mildew outbreak - Bedding Busy Lizzies are making a comeback – just ye... http:// ow.ly/3cQVPB";;"713614605214425088"
ClaudeWilliamsn;2016-03-26 07:31;0;"Busy Lizzies make a comeback after downy mildew outbreak - Bedding Busy Lizzies are making a comeback – just ye... http:// ow.ly/3cQVEl";;"713614454546685952"
LorenzoZim1;2016-03-26 07:31;0;"Busy Lizzies make a comeback after downy mildew outbreak - Bedding Busy Lizzies are making a comeback – just ye... http:// ow.ly/3cQVAV";;"713614412976955393"
AndyHamilt0n;2016-03-26 07:21;0;"Busy Lizzies make a comeback after downy mildew outbreak - Bedding Busy Lizzies are making a comeback – just ye... http:// ow.ly/3cQVab";;"713611925142310912"
SallyBryan0;2016-03-26 07:21;0;"Busy Lizzies make a comeback after downy mildew outbreak - Bedding Busy Lizzies are making a comeback – just ye... http:// ow.ly/3cQV8Q";;"713611891017433088"
LelaIngram0;2016-03-26 07:19;0;"Busy Lizzies make a comeback after downy mildew outbreak - Bedding Busy Lizzies are making a comeback – just ye... http:// ow.ly/3cQUVB";;"713611190950371328"
EllisAllis0n;2016-03-26 07:16;0;"Busy Lizzies make a comeback after downy mildew outbreak - Bedding Busy Lizzies are making a comeback – just ye... http:// ow.ly/3cQUx5";;"713610554196275201"
KirkDay0;2016-03-26 07:07;0;"Busy Lizzies make a comeback after downy mildew outbreak - Bedding Busy Lizzies are making a comeback – just ye... http:// ow.ly/3cQUfM";;"713608335241641985"
DanaMcc0rmick;2016-03-26 07:06;1;"Busy Lizzies make a comeback after downy mildew outbreak - Bedding Busy Lizzies are making a comeback – just ye... http:// ow.ly/3cQUdY";;"713608086473338881"
TrevorMckenzi3;2016-03-26 07:04;0;"Busy Lizzies make a comeback after downy mildew outbreak - Bedding Busy Lizzies are making a comeback – just ye... http:// ow.ly/3cQU8z";;"713607628497285120"
ChristieFl0res;2016-03-26 07:03;0;"Busy Lizzies make a comeback after downy mildew outbreak - Bedding Busy Lizzies are making a comeback – just ye... http:// ow.ly/3cQTXL";;"713607216293683200"
MarciaBecker0;2016-03-26 07:01;0;"Busy Lizzies make a comeback after downy mildew outbreak - Bedding Busy Lizzies are making a comeback – just ye... http:// ow.ly/3cQTFp";;"713606795001012225"
Immunol_papers;2016-03-25 19:20;0;"#In #Phytopathology Callose Synthase Family Genes Involved in the Grapevine Defense Response to Downy Mildew … http:// dlvr.it/KtVf31";#In #Phytopathology;"713430273392660481"
GreatLakesHops;2016-03-24 23:18;0;"Grower Notes: In hop yards with a previous history of downy mildew we recommend a early season application heavy... http:// fb.me/54nuCmBIX";;"713127972648038400"
ashparri;2016-03-24 19:19;0;"New race of downy mildew identified";;"713067730115698688"
SeedKeeperCo;2016-03-24 14:53;7;"Sowed 200 Begonias seeds a month ago. Alternative to impatiens plagued by Downy Mildew in recent yrs #gardenchat pic.twitter.com/u7gkpzgKM3";#gardenchat;"713000709617094656"
_TylerChandler;2016-03-24 00:46;0;"@adamklinger great info on #downy mildew. There are MUCH better products available today than in 2014 tho https:// twitter.com/amnurseryman/s tatus/712786517949743105 …";#downy;"712787623748567040"
AmNurseryman;2016-03-24 00:42;1;"Downy mildew can be a devastating disease of #roses : http:// goo.gl/iFlIgr pic.twitter.com/XIQAkJFPpj";#roses;"712786517949743105"
calveggies;2016-03-23 03:11;2;"Downy mildew of ice plants. An invasive fungus spreading on an invasive (now ornamental) plant in California. http:// ucanr.edu/blogs/blogcore /postdetail.cfm?postnum=20558 …";;"712461837908881408"
meteostationsb;2016-03-23 02:30;0;"AVVISO METEO : downy mildew conditions have been reached";;"712451308079484928"
BatsRLong;2016-03-22 21:41;0;"Downy mildew , an unusual visitor on alfalfa in winter periods. http:// ucanr.edu/blogs/Alfalfa/";;"712378616324034560"
PestGeekPodcast;2016-03-22 17:16;0;"Reporting downy mildew of ice plants in California - Healthy red apple ice plant, Aptenia cordifolia. Photo by ... http:// ow.ly/3cIORY";;"712311949892014080"
KathryneEverts;2016-03-22 13:38;1;"Downy Mildew Taking Bite Out Of South Florida Lettuce Crop http://www. growingproduce.com/crop-protectio n/disease-control/downy-mildew-taking-bite-out-of-south-florida-lettuce-crop/ …";;"712257097258418176"
ELICITRACTU;2016-03-21 16:29;0;"Use of plant defences inducers against powdery mildew on melon and downy mildew on lettuce. - CAB D... | @scoopit http:// sco.lt/6vzfDl";;"711937812002635776"
wpstubs;2016-03-21 15:46;0;"Someone created a Wikipedia article about " Downy Mildew (band)". Help expand it! #Rockmusic http:// en.wikipedia.org/wiki/Downy_Mil dew_(band)?src=wpstubs&tour=firstedit …";#Rockmusic;"711927051062812673"
patstokes;2016-03-20 02:07;0;"@matthewtbeard Yeah downy mildew wiped out all my cucumber and zucchini plants this summer. Kids are a breeze by comparison...";;"711358362693148677"
plantgenome;2016-03-18 20:44;0;"Transcriptome & small RNAome dynamics during a resistant & susceptible interaction between #cucumber & downy mildew https:// goo.gl/6TEbSU";#cucumber;"710914682257674240"
Yass_Weather;2016-03-18 14:00;0;"WEATHER WARNING : downy mildew conditions have been reached";;"710813006070882304"
LeafTree99;2016-03-18 05:14;0;"Science Into Practice - Downy mildew on impatiens http:// ift.tt/1prQIxA";;"710680794533072896"
ylapalumares;2016-03-18 05:06;0;"Downy Mildew";;"710678697355845632"
SwsWoodland;2016-03-18 05:02;0;"Science Into Practice - Downy mildew on impatiens http:// sws.click/1nSZIuA #horticulture";#horticulture;"710677640890474496"
Yass_Weather;2016-03-17 23:45;0;"WEATHER WARNING : downy mildew conditions have been reached";;"710597838837669889"
QuesadaLabNCSU;2016-03-17 16:38;2;"Basil downy mildew detected in Florida, report observations at http:// buff.ly/1WtlFMz #downymildew";#downymildew;"710490525451821056"
QuesadaLabNCSU;2016-03-17 16:31;1;"Cucurbit downy mildew detected in Florida - CDM IPM Pipe - http:// buff.ly/1pqnvD1 #downymildew";#downymildew;"710488657958977537"
UTPlantDoc;2016-03-17 02:56;3;"Basil downy mildew is active on the Gulf Coast. https://www. facebook.com/AAES.OHRC/?fre f=ts … pic.twitter.com/Lh6HbYawBi";;"710283753860403200"
TommyTonsberg;2016-03-16 10:59;0;"@zinniagd Oh no. I have heard about the downy mildew , hope it is not that!";;"710042782040244224"
zinniagd;2016-03-16 08:51;0;"@TommyTonsberg I had a border devoted to them - sadly now look as though they may have downy mildew virus. New leaves are pale and weedy :(";;"710010482346872833"
UCIPM;2016-03-15 17:28;1;"UCCE Steve Koike identifies a new race 16 of downy mildew in spinach at http:// ucanr.edu/b/~GK5 #AgIPM pic.twitter.com/QSeBJ1QHdF";#AgIPM;"709778384222457856"
hortidaily;2016-03-15 17:00;3;"Basil Downy Mildew Workshop videos available http://www. hortidaily.com/article/24802/ Basil-Downy-Mildew-Workshop-videos-available … pic.twitter.com/r7j3PbW0uD";;"709771220779081728"
EurekaMag;2016-03-15 14:16;0;"#EurekaMag Histology and physiology of compatibility and incompatibility between lettuce and the downy mildew … http:// dlvr.it/Kncd4x";#EurekaMag;"709729946579566592"
GHWeather;2016-03-11 23:07;0;"WEATHER WARNING : downy mildew conditions have been reached";;"708414048312827904"
ColeGardens;2016-03-11 15:56;1;"This is downy mildew on a basil leaf Plant & enjoy basil early in the summer A later crop may get effected with D.M. pic.twitter.com/nP61Ap7mX3";;"708305679010947072"
Yass_Weather;2016-03-11 03:12;0;"WEATHER WARNING : downy mildew conditions have been reached";;"708113214249132032"
hiasilrdne;2016-03-11 02:29;0;"#EurekaMag Downy mildew of cucurbits (Pseudoperonospora cubensis): the fungus and its hosts, distribution,… http:// dlvr.it/KlSRbr";#EurekaMag;"708102538797588480"
EurekaMag;2016-03-11 01:52;10;"#EurekaMag Downy mildew of cucurbits (Pseudoperonospora cubensis): the fungus and its hosts, distribution,… http:// dlvr.it/KlRlJH";#EurekaMag;"708093122719264768"
greenhousecan;2016-03-10 16:04;1;"e-GRO Alert: Coleus Downy Mildew Update http:// bit.ly/1Twnj23";;"707945222907568128"
greenhousecan;2016-03-10 16:00;0;"e-GRO Alert: #Coleus Downy Mildew Update https:// shar.es/1CBVyO via @greenhousecan #garden";#Coleus #garden;"707944241872371712"
Crop_Protection;2016-03-09 15:54;0;"Research: Susceptibility of Hop Cultivars to Downy Mildew : Associations with Chemical Characteristics and Region... http:// bit.ly/1SznCrO";;"707580420427124736"
HarperWellsShop;2016-03-09 14:29;0;"#NowPlaying Offering by Downy Mildew ♫ http:// spoti.fi/1QGDSG6";#NowPlaying;"707558846219358208"
bluedogagCQ;2016-03-09 05:42;3;"US friends have clearfield, downy mildew & sulfentrazone resistant hybrid options. Jealous @sunflowerfarmer #ASGC16 pic.twitter.com/d3wBvQdkkY";#ASGC16;"707426433631723520"
bluesintrinity;2016-03-09 03:48;0;"♬ Downy Mildew / Release - Slow Sky #downymildew #nowplaying";#downymildew #nowplaying;"707397592091533312"
Sally_AnnJDodd;2016-03-09 00:49;0;"SA Rain, drizzle since 4.30 am warm overnight temp 20 + overcast light Southerly breeze lots cooler than yesterday. Downy mildew anyone !";;"707352516048998400"
purduehortindy;2016-03-08 22:33;0;"Impatiens walleriana is prone to downy mildew . Here are possible replacement flowers for areas with some shade. http:// ow.ly/Zegke";;"707318470300540929"
KathryneEverts;2016-03-08 13:11;0;"Videos are available from the 2015 Basil Downy Mildew Workshop https://www. youtube.com/playlist?list= PLKx8NLAujm_nZxEsuheCIIR2T1CO2scge … via @YouTube";;"707176923672109056"
nemopeeters;2016-03-08 10:54;0;"Seminar #lipm Yann Pecrix #sunflower downy mildew pic.twitter.com/lEtlQIp3S1";#lipm #sunflower;"707142558774910977"
SyngentaUS;2016-03-07 22:40;1;"Defend #cucurbits against downy mildew : http:// bit.ly/1YaVFHb #Agronomy";#cucurbits #Agronomy;"706957771355377664"
AgAnnex;2016-03-07 14:45;0;"Attn Hop Producers: Hop rhizomes needed for @UofGResearch project. Is downy mildew present? -> http:// ow.ly/Z9QPy Via @ONspecialtycrop";;"706838061875863552"
FarmsNews;2016-03-07 14:15;0;"Downy Mildew - An Unusual Visitor This Winter Read more.. http://www. farms.com/news/downy-mil dew-an-unusual-visitor-this-winter-104590.aspx … pic.twitter.com/9hFEqVDPmt";;"706830643850649600"
CHIRPPlaylist;2016-03-07 03:06;0;"#np Downy Mildew - A Liar Need A Good Memory";#np;"706662154544386049"
Dankoli_;2016-03-06 22:27;0;"Downy mildew";;"706592135177445376"
GHWeather;2016-03-06 11:41;0;"WEATHER WARNING : downy mildew conditions have been reached";;"706429422857924608"
cranimal1;2016-03-06 03:15;0;"It's been so hot and humid here even the oak trees have downy mildew pic.twitter.com/N0NDgpQMBc";;"706302131599339520"
laplap10;2016-03-05 20:27;1;"I've never seen before a sporangiophore of Arabidopsis downy mildew on such poorly developed hyphae. Will to live! pic.twitter.com/6IldrYjH85";;"706199465850507264"
FarmBoyFarms;2016-03-05 20:05;0;"Talking plant management strategies to prevent & address Downy Mildew . #QualityHops #sahc2016 pic.twitter.com/ZKElFFks0x";#QualityHops #sahc2016;"706193978715197441"
JeanineNCSU;2016-03-05 20:05;3;"Lina Quesada giving one of the most important talks at the conference on controlling downy mildew on hops. #sahc2016 pic.twitter.com/AlFfQhkhXh";#sahc2016;"706193926093463552"
KellieHinkle123;2016-03-05 13:11;2;"Best quote-Day 1 #Hop Conference-"I don't know what downy mildew is, but it better not get in my beer" @HopsVa @Shep8186";#Hop;"706089862517149696"
MED_COMPLEX;2016-03-05 12:01;0;"Correction: A Downy Mildew Effector Attenuates Salicylic Acid-Triggered Immunity in Arabidopsis by Interacting with… http:// dlvr.it/Khdwzv";;"706072033562525697"
Life_Sciences_;2016-03-05 10:56;0;"#EurekaMag Epidemiology of sorghum downy mildew II. Circadian and seasonal periodicities in conidia and oospores http:// dlvr.it/KhcmFM";#EurekaMag;"706055702603702273"
hiasilrdne;2016-03-05 10:56;0;"#EurekaMag Epidemiology of sorghum downy mildew II. Circadian and seasonal periodicities in conidia and oospores http:// dlvr.it/Khcm1l";#EurekaMag;"706055696878424065"
EurekaMag;2016-03-05 10:49;8;"#EurekaMag Epidemiology of sorghum downy mildew II. Circadian and seasonal periodicities in conidia and oospores http:// dlvr.it/Khcgns";#EurekaMag;"706053931307110400"
jacquet_chris;2016-03-04 19:14;0;"Effector Polymorphisms of the Sunflower Downy Mildew Pathogen Plasmopara halstedii and Their Use ... | @scoopit http:// sco.lt/5JR6fZ";;"705818625735843841"
GilGullickson;2016-03-04 14:35;0;"#DuPont announces #Lumisena sunflower/soybean fungicide seed treatment at @ComClassic .To help farmers manage downy mildew and Phytophthora.";#DuPont #Lumisena;"705748467877068801"
APS_CLARE;2016-03-01 01:59;1;"A new downy mildew caused by a Peronospora sp. on Agastache sp. in the United States http:// apsjournals.apsnet.org/doi/full/10.10 94/PDIS-10-15-1119-PDN …";;"704471206074798080"