username;date;retweets;text;hashtags;id
cmossperennials;2016-05-28 19:56;1;"Does anyone know if aquilegia downy mildew is in any country other than England?";;"736617137381515264"
Does_Maria;2016-05-28 14:35;0;"http:// About.com :Garden: Downy Mildew - a Problem for Impatiens Plants http:// ow.ly/BVEV500M7hB";;"736536254515417088"
ustourist;2016-05-27 19:39;0;"@sergi_jennifer cinnamon is a fungicide and tea tree oil kills a host of things. I was reading that downy mildew isn't a true fungi";;"736250600036438018"
cmossperennials;2016-05-27 18:33;0;"Information about aquilegia downy mildew here http://www. touchwoodplants.co.uk/aquilegiaseed. htm … @Green_Gould";;"736233949891026944"
sergi_jennifer;2016-05-27 17:32;0;"@ustourist this year w basil mint n cabbage w downy mildew ..I never thought to look at cornells updates before I got new basils.";;"736218600969756672"
ustourist;2016-05-27 07:05;0;"@sergi_jennifer do they say how they think your plants got the downy mildew ? that seems odd for inside plants.";;"736060661797523456"
sabrosiavit;2016-05-26 12:49;0;"Reinhard Töpfer New Cvs wkshp: impressive wines ex Powdery& Downy Mildew resistant vines Regent, Calandro, Felicia, Calandro blanc #ICCWS2016";#ICCWS2016;"735785020032352256"
DAF_WA;2016-05-26 04:55;4;"Downy mildew reported in canola crops in Dalwallinu and Wyalkatchem #PestFax http:// bit.ly/1TL3Aeg pic.twitter.com/8qglYmeNLK";#PestFax;"735665708189818881"
ALIPMCOMM;2016-05-25 16:08;1;"Impatiens downy mildew (IDM): https:// sites.aces.edu/group/commhort /blog/Lists/Posts/Post.aspx?ID=319#.V0Wxzy_RjTg.twitter …";#;"735472568157777920"
joyce_van_dijk;2016-05-25 15:10;0;"Dealing with disease resistance to control impatiens downy mildew https:// lnkd.in/dEimuKT";;"735458088828964864"
WakullaExt;2016-05-25 14:00;0;"Cucurbit downy mildew is attacking the yellow crooked-neck squash in the UF/IFAS Wakulla Master Gardener... http:// fb.me/Hq4Tfuz7";;"735440286780915712"
AHDB_Hort;2016-05-25 12:01;2;"Information poster: Dealing with disease resistance to control impatiens downy mildew http:// horticulture.ahdb.org.uk/publication/de aling-disease-resistance-control-impatiens-downy-mildew … pic.twitter.com/9yyFafuI0F";;"735410498322239488"
Cropnuts_agron;2016-05-25 11:57;10;"First signs of Downy Mildew on Spring Beans @pgroresearch pic.twitter.com/XCYOubIIeQ";;"735409484785422336"
LittleRedAussie;2016-05-25 03:45;0;"@LittleRedAussie blight and downy mildew . goodbye im not ever buying grapes from common stores again. im not paying to eat mildewy fruit";;"735285624081502208"
Team_Thomma;2016-05-24 15:06;2;"Sporangia of the downy mildew Bremia on lettuce seedlings pic.twitter.com/EHL2Zl5lB8";;"735094661077950464"
Inra_Intl;2016-05-24 13:50;1;"Vigilance in the #vines : can #grapevine downy mildew adapt to resistant grape varieties? http:// url.inra.fr/1Tu8Qo9 #RP_Inra";#vines #grapevine #RP_Inra;"735075544178544640"
BOULLETP;2016-05-23 05:14;0;"WEATHER WARNING : downy mildew conditions have been reached pic.twitter.com/TdKjZOsx3J";;"734583208386408450"
BOULLETP;2016-05-23 01:35;0;"WEATHER WARNING : downy mildew conditions have been reached pic.twitter.com/T9PTuvPVv6";;"734528074340028416"
JimGandyWLTX;2016-05-21 16:40;3;"I use a copper fungicide in #GandysGarden to control Downy Mildew . Follow directions. #News19 pic.twitter.com/LIfhekpYeh";#GandysGarden #News19;"734031219348938756"
ucipmurban;2016-05-21 01:53;7;"Downy mildew disease found on ice plants in Southern California. Please share widely. http:// bit.ly/22izQr6 pic.twitter.com/Xgs8GmiGdy";;"733808013513883649"
meteostationsb;2016-05-21 00:00;0;"AVVISO METEO : downy mildew conditions have been reached";;"733779373560582144"
TavistockHopCo;2016-05-20 14:42;2;"#rakau #onthops #craftbeer plants look great, minimal downy mildew scouted. pic.twitter.com/iS8mFM24QQ";#rakau #onthops #craftbeer;"733638992483221505"
SFSHAMOUN;2016-05-19 19:02;0;"downy blight pathogen reveals it is a Phytophthora species with downy mildew -like characteristics http:// sco.lt/84ih1N via @scoopit";;"733342041732730880"
alejorojas2;2016-05-19 15:18;7;"Seq of the litchi downy blight pathogen reveals it is a Phytophthora species with downy mildew -like | @scoopit http:// sco.lt/7hVR2X";;"733285776713224192"
every_download;2016-05-19 13:31;0;"You wouldn't download a downy mildew";;"733258812879208449"
phy_papers;2016-05-19 03:09;1;"Sequencing of the litchi downy blight pathogen reveals it is a Phytophthora species with downy mildew -like… http:// dlvr.it/LLXR68";;"733102257986666496"
FloralDaily;2016-05-18 23:59;1;"US: Key findings of downy mildew research revealed @American_Hort http://www. floraldaily.com/article/5144/U S-Key-findings-of-downy-mildew-research-revealed … pic.twitter.com/1fcn8F6euv";;"733054324293558272"
CompBiolPapers;2016-05-18 21:46;0;"Sequencing of the litchi downy blight pathogen reveals it is a Phytophthora species with downy mildew -like… http:// dlvr.it/LLRp2P";;"733020871900549121"
kildea1;2016-05-18 21:18;0;"@JohnDun17520249 sample of beans yesterday. Plenty of downy mildew but root issue biggest issue -rhizoctonia likely pic.twitter.com/afyeJgBv8y";;"733014032194625537"
ajanegevens;2016-05-18 20:23;2;"look alike hop downy mildew symptoms, test your knowledge! http:// fb.me/7URJC1Fq7";;"732999947587575808"
txplantclinic;2016-05-17 23:52;0;"Interesting information to read. Enjoy -KO Downy mildew research findings released - Greenhouse Management http://www. greenhousemag.com/article/downy- mildew-research-findings-released/ …";;"732690206495670273"
Produce_Grower;2016-05-17 19:33;1;"Downy mildew research findings released http:// bit.ly/1OCB6CW pic.twitter.com/Yis6y2o5IP";;"732625164349870080"
APS_CLARE;2016-05-17 18:24;1;"Nocturnal fanning suppresses downy mildew epidemics in sweet basil http:// journals.plos.org/plosone/articl e?id=10.1371/journal.pone.0155330 …";;"732607791706202112"
thegardenlady;2016-05-17 17:00;3;"#yardandgarden #tipoftheday Troubled by sick basil? ( Downy Mildew ) plant African Blue Basil, Lemon and Spicy Globe: disease resistant";#yardandgarden #tipoftheday;"732586482729390080"
rudebotanical;2016-05-17 16:32;0;"@fossilplants @Haggewoods Spot the Woodruff with downy mildew ! EasyPeasy. pic.twitter.com/XNuKWObOP1";;"732579426437849088"
sunday_gardener;2016-05-17 15:34;0;"How to Get Rid of Downy Mildew http://www. sundaygardener.net/how-to-get-rid -of-downy-mildew/ … #gardening , #garden";#gardening #garden;"732564859200626688"
MarcKovach;2016-05-17 14:26;0;"With the clouds and rain I am thinking downy mildew ? Anyone know? #HopPlants pic.twitter.com/y6HRveYDBW";#HopPlants;"732547880628719617"
plantdisease;2016-05-17 02:05;5;"Downy mildew research findings released http:// ow.ly/Yed2300fBfY pic.twitter.com/gT7KnkNFiU";;"732361278312853504"
ijser_research;2016-05-17 01:51;0;"Biochemical changes in treated cucumber plants with some elicitors against downy mildew disease in protected ... http:// bit.ly/258ha2x";;"732357935762808832"
ajanegevens;2016-05-16 16:02;1;"UWEX Veg Crop Updates #7: late blight, cucurbit downy mildew , potato rhizoctonia management updates - and new... http:// fb.me/7ZR0p1x3R";#7;"732209707998445568"
dripworksusa;2016-05-15 04:24;0;"Michigan Researcher Leads $2.3-Million Grant To Combat Downy Mildew In Vegetables via @GrowingProduce http://www. growingproduce.com/vegetables/mic higan-researcher-leads-2-3-million-grant-to-combat-downy-mildew-in-vegetables/ …";;"731671687691960320"
MandyCanUDigIt;2016-05-14 19:29;0;"Downy mildew , powdery mildew & grey mould - how to prevent & cure. #gardening http:// bit.ly/1PxLBGO pic.twitter.com/Dynt6Y56XI";#gardening;"731536815925006337"
suzu_mishra;2016-05-13 11:10;1;"Appearance of Downy mildew (Pseudopernospora cubensis) in the basal leaf of Momordica charantia (Bitter Gourd ) pic.twitter.com/IP3eIWSaDN";;"731048871715999744"
AHDB_Hort;2016-05-13 10:53;0;"Science Into Practice - Controlling downy mildew via @hortweek feat AHDB project PO 011b http://www. hortweek.com/article/1392740 http:// horticulture.ahdb.org.uk/project/monito ring-metalaxyl-m-sensitivity-downy-mildew-infection-impatiens …";;"731044760551624704"
ProtectingCrops;2016-05-13 01:38;0;"AU: Spinach growers urged to use IDM against Downy Mildew : http://www. freshplaza.com/article/157482 /AU-Spinach-growers-urged-to-use-IDM-against-Downy-Mildew#.VzUT2f5Fa8E.twitter …";#;"730904994468126724"
meteostationsb;2016-05-12 19:20;0;"AVVISO METEO : downy mildew conditions have been reached";;"730809765107015680"
DiploMix;2016-05-12 18:57;0;"#businessfrance @BF_agrofoodeq : Michigan Researcher Leads $2.3-Million Grant To Combat Downy Mildew In Vegetables https:// goo.gl/rnDZjb";#businessfrance;"730804006184833024"
GreenhouseMag;2016-05-12 18:11;0;"Researchers release downy mildew findings http:// bit.ly/1T8IBhE via @American_Hort pic.twitter.com/r4q4FcLKUY";;"730792411849461760"
BF_agrofoodeq;2016-05-12 17:55;0;"Michigan Researcher Leads $2.3-Million Grant To Combat Downy Mildew In Vegetables";;"730788563919511552"
meminem11;2016-05-12 17:50;7;"Downy mildew loves Brewer's Gold hop plants Such sporulation! #plantpathhaiku pic.twitter.com/JhyMXyCoKI";#plantpathhaiku;"730787138451734528"
rob_choudhury;2016-05-12 17:21;1;"A neuroptera and beet downy mildew too! This beet's friend and foe. #plantpathhaiku pic.twitter.com/nRwBy21aWo";#plantpathhaiku;"730779936080859136"
NCSU_PDIC;2016-05-12 17:08;1;"Downy mildew (left) and Septoria leaf spot (right) on Rudbeckia from the NCSU campus http:// fb.me/2wYgn3ND9";;"730776728663007233"
UMassGardenClip;2016-05-12 15:50;1;"Grow your own basil from clean seed to lessen the chance of basil downy mildew disease infection. Sun sets 7:59; rises tomorrow 5:28.";;"730757074544672768"
naughtynerdy;2016-05-12 03:37;0;"I woke up and most of my plants were dead. Seems since I watered them a few days ago they all got downy mildew ! T.T boooooo!";;"730572560341946368"
TreasureCabinet;2016-05-11 22:44;0;"1896 Plant Pathogen Grapevine Downy Mildew by CabinetOfTreasures http:// etsy.me/1X1SeDt via @Etsy";;"730498830991540224"
ohiomary;2016-05-11 22:13;0;"MSU researcher leads $2.3-million grant to combat downy mildew in vegetables http:// msutoday.msu.edu/news/2016/msu- researcher-leads-23-million-grant-to-combat-downy-mildew-in-vegetables/?utm_source=weekly-newsletter&utm_medium=email&utm_campaign=standard-promo&utm_content=more#.VzOSWwqnCEo.twitter … pic.twitter.com/VtvkBL8uMb";#;"730491095885348864"
crsimp01;2016-05-10 22:53;0;"Controlling downy mildew on hop | MSU Extension http:// msue.anr.msu.edu/news/controlli ng_downy_mildew_on_hop …";;"730138787305668612"
GreatLakesHops;2016-05-10 19:18;3;"MSU's published some info on downy mildew . Nice pic of what it can do if not treated. Realize this is a pic of a... http:// fb.me/5gpBcs7nT";;"730084606150512640"
HortiBiz;2016-05-10 04:15;0;"$2.3M grant to combat downy mildew in vegs http:// dlvr.it/LGg1nz pic.twitter.com/5etWrkagRf";;"729857264991903744"
landisj;2016-05-10 01:30;0;"MSUE's Hausbeck on biggest challenge for growing hops: downy mildew http:// bit.ly/1rLBiFv http:// ow.ly/i/jdEvC";;"729815830029074432"
thehopproject;2016-05-09 22:58;0;"Look out for downy mildew in your hop yard! pic.twitter.com/lqy5jgYE8J";;"729777553309900800"
BASFAgro;2016-05-09 12:58;3;"#USDA funds researchers with $2.3 mil to fight downy mildew in vegetables http:// on.basf.com/1Ok0Y14 #ag #research pic.twitter.com/LjECnFL4x0";#USDA #ag #research;"729626514380230656"
carmeloruiz;2016-05-09 03:37;0;"DOWNY MILDEW TRADING JEWELS1991{YT} https:// youtu.be/t3YE730uUso via @YouTube";;"729485374481817600"
amsterdampittme;2016-05-09 03:01;0;"The Sky is Falling - Impatiens Downy Mildew | Proven Winners https://www. provenwinners.com/learn/planting /sky-falling-impatiens-downy-mildew#.Vy_hTbUw2IY.twitter …";#;"729476386801344512"
ArtsNursery;2016-05-08 22:40;0;"We get asked for common impatiens every day. Some of you may have heard of the Downy Mildew fungus that has... http:// fb.me/7XqWw446m";;"729410641128095744"
agriculture_dp;2016-05-08 12:31;0;"MSU will lead downy mildew research #msu http:// dragplus.com/post/id/351363 07 …";#msu;"729257305892597760"
Yass_Weather;2016-05-08 07:39;0;"WEATHER WARNING : downy mildew conditions have been reached";;"729183805940998144"
gaia_surf;2016-05-08 04:43;0;"@juliawb Not downy mildew or powdery mildew?";;"729139644386791424"
SeminisSeeds;2016-05-08 00:40;1;"Gummy stem blight, powdery mildew & downy mildew are common watermelon diseases. See how to combat them: http:// semin.is/1WhbtL0";;"729078381820715009"
toastradio;2016-05-07 22:20;0;"Them That Dream by Downy Mildew #nowplaying Listen live: http:// toastradio.com/np/FB11E557780 F29D8 …";#nowplaying;"729043353795330048"
farmerfred;2016-05-07 22:18;0;"@ciceroCVI check the disease links at this site, especially downy mildew . http://www. ipm.ucdavis.edu/PMG/GARDEN/VEG ES/onions.html …";;"729042863577702400"
PastelBio_prot;2016-05-07 14:30;0;"Grapevine Downy Mildew Plasmopara viticola Infection Elicits the Expression of Allergenic… http:// dlvr.it/LFdCpR pic.twitter.com/3913XIWQuY";;"728924992268738560"
GreatLakesHops;2016-05-07 00:39;2;"Butt-chewing grower post of the week: :) Hops that emerge with heavy springtime downy mildew infections as... http:// fb.me/4Gw15wyk9";;"728715952104177664"
AgProfessional;2016-05-06 22:40;1;"$2.3-million grant to combat downy mildew in vegetables. http://www. agprofessional.com/news/23-millio n-grant-combat-downy-mildew-vegetables …";;"728685825924325376"
rob_choudhury;2016-05-06 22:28;2;"warm and humid nights in susceptible vineyards? grape downy mildew ! http://www. apsnet.org/edcenter/intro pp/lessons/fungi/Oomycetes/Pages/DownyMildewGrape.aspx … #plantpathhaiku";#plantpathhaiku;"728682989098405888"
brownfield;2016-05-06 22:13;2;"MSU will lead downy mildew research - http:// bfnews.co/24CfKd0 @CANRatMSU @MSUAgBio @MSUExtension @MHausbeck";;"728679065721409538"
SeedWorldMag;2016-05-06 21:25;0;"Researchers Combating Downy Mildew in Vegetables http:// ow.ly/4nvSiQ";;"728667043654971394"
connie_fisk;2016-05-06 20:20;0;"Susceptibility of Hop Cultivars to Downy Mildew : Associations with Chemical Characteristics and Region of Origin https://www. plantmanagementnetwork.org/sub/php/volume 17/number1/PHP-RS-15-0044.pdf …";;"728650746997006336"
FVPTeamFreedom;2016-05-06 19:37;0;"$2.3-million grant to combat downy mildew in vegetables - http:// agprofessional.com : agprofessio... http:// bit.ly/1UFdChF #vegetables";#vegetables;"728639910773579776"
DFKendra;2016-05-06 13:29;0;"Researchers Combating Downy Mildew in Vegetables http:// seedworld.com/researchers-co mbating-downy-mildew-in-vegetables/ …";;"728547293889171457"
SNP_papers;2016-05-06 13:13;0;"QTL mapping for downy mildew resistance in cucumber inbred line WI7120 (PI 330628). http:// dlvr.it/LFBPWj";;"728543110968397825"
FreshPlaza_com;2016-05-06 04:00;9;"Spinach growers urged to use IDM against Downy Mildew #AU http://www. freshplaza.com/article/157482 /AU-Spinach-growers-urged-to-use-IDM-against-Downy-Mildew … pic.twitter.com/IQ47YNV61i";#AU;"728403977444827136"
rob_choudhury;2016-05-05 20:39;0;"Lawns of green spinach taken by downy mildew how can we stop it? #plantpathhaiku pic.twitter.com/gutD6Thcvn";#plantpathhaiku;"728292976137379841"
MSUDayLab;2016-05-05 19:42;2;"MSU researcher leads $2.3-million grant to combat downy mildew in vegetables http:// msutoday.msu.edu/news/2016/msu- researcher-leads-23-million-grant-to-combat-downy-mildew-in-vegetables/#.VyuF8E7BeNE.twitter …";#;"728278638005719040"
AVG_Magazine;2016-05-05 17:48;0;"Michigan Researcher Leads $2.3-Million Grant To Combat Downy Mildew In Vegetables http:// ift.tt/1TppDm3";;"728250108802912256"
Nick_Leone;2016-05-05 17:28;0;"Michigan Researcher Leads $2.3-Million Grant To Combat Downy Mildew In Vegetables http:// ift.tt/1TLq7pK";;"728244869165142018"
rob_choudhury;2016-05-05 16:19;0;"Overcast day in the southern Salinas Valley, some spinach downy mildew visible pic.twitter.com/aWJUh8uX7r";;"728227507846021120"
sciencemi;2016-05-05 15:13;0;"MSU researcher leads $2.3-million grant to combat downy mildew in vegetables | AgBioResearch http:// agbioresearch.msu.edu/news/msu_resea rcher_leads_2.3_million_grant_to_combat_downy_mildew_in_vegetables …";;"728211073271107584"
CANRatMSU;2016-05-05 14:26;1;"CANR researcher Mary Hausbeck is heading up a new team dedicated to protecting our vegetables from downy mildew ,... http:// fb.me/16Jj5mc26";;"728199236148445184"
FoodPrepping;2016-05-05 13:54;0;"AU: Spinach growers urged to use IDM against Downy Mildew http://www. freshplaza.com/news_detail.as p?id=157482 …";;"728191171961425920"
flplantdr;2016-05-04 19:58;0;"Fighting downy mildew in your cucurbits? New fact sheet for Florida: http:// edis.ifas.ufl.edu/pp325 . http:// fb.me/4KqOf4su2";;"727920305818112000"
MSUnews;2016-05-04 17:31;1;". @michiganstateu researcher leads $2.3-million grant to combat downy mildew in vegetables. http:// go.msu.edu/rsB pic.twitter.com/3sud3uB3gE";;"727883389076942849"
Alan_Gocha;2016-05-04 16:21;0;"MSU researcher leads $2.3-million grant to combat downy mildew in vegetables http:// ift.tt/1Y8dia8 #michiganstate #spartans #eastlansing";#michiganstate #spartans #eastlansing;"727865841069506562"
MSU_NatSci;2016-05-04 16:10;0;"MSU researcher leads $2.3-million grant to combat downy mildew in vegetables http:// msutoday.msu.edu/news/2016/msu- researcher-leads-23-million-grant-to-combat-downy-mildew-in-vegetables/#.VyoCubtWNMQ.twitter …";#;"727862878699663360"
MSUAgBio;2016-05-04 15:03;5;"Mary Hausbeck of @CANRatMSU leads new effort to fight resurgent veggie disease downy mildew http:// agbioresearch.msu.edu/news/msu_resea rcher_leads_2.3_million_grant_to_combat_downy_mildew_in_vegetables … pic.twitter.com/f2eB2hXmhA";;"727846100212830208"
AGFoodSS;2016-05-03 17:55;2;"New Race Of Downy Mildew In Spinach http:// drg.io/23mhEM5";;"727526937069940736"
AHDB_Hort;2016-05-03 11:07;1;"Science Into Practice - Controlling downy mildew via @hortweek http://www. hortweek.com/article/1392740";;"727424392813248513"
ajanegevens;2016-05-02 16:10;2;"UWEX Vegetable Crop Updates Newsletter #5: late blight updates, cucurbit downy mildew symptoms info - critical... http:// fb.me/5o82GQggR";#5;"727138178730172416"
TommyTonsberg;2016-05-01 19:25;0;"@bharddawg Impatiens used to be THE flower in all public flower displays here, until Impatiens downy mildew . :-/";;"726824779559374849"
bharddawg;2016-05-01 19:20;1;"BUYER BEWARE ALERT: Impatients infested with impatients downy mildew ! Note sporulation (white) on underside of leaf pic.twitter.com/J9iHxAdrmI";;"726823554470285312"
MandyCanUDigIt;2016-05-01 18:22;0;"Difference between powdery & downy mildew - how to treat it. #gardening http:// bit.ly/1PxLBGO pic.twitter.com/AHkdRm87v0";#gardening;"726808925509545985"
TavistockHopCo;2016-05-01 17:03;0;"Prime weather for downy mildew . Spraying fungicide today to protect plants. #ontag #onthops 8 deg c 93% humidity pic.twitter.com/NNoGiJNO0M";#ontag #onthops;"726789055225155585"
EurekaMag;2016-04-30 20:56;0;"#EurekaMag Inheritance of downy mildew resistance at cotyledon and adult-plant stages in 'Couve Algarvia' (Brassica… http:// dlvr.it/LBk81C";#EurekaMag;"726485294963265536"
AgronomyDavid;2016-04-30 16:47;0;"@meminem11 Michelle! I had to leave because the downy mildew on hops was starting to show up!";;"726422666454802432"
AOTPRadio;2016-04-30 14:46;0;"Now on AOTP: Downy Mildew - Elevator http:// aotpradio.com";;"726392373568278529"
SwsWoodland;2016-04-29 02:34;0;"Science Into Practice - Controlling downy mildew http:// sws.click/26yP5Q5 #horticulture";#horticulture;"725845655499984896"
LeafTree99;2016-04-29 02:32;0;"Science Into Practice - Controlling downy mildew http:// ift.tt/1NYrtJa";;"725845094859943936"
GrahamPorter4;2016-04-28 14:05;0;"@BotanicN is it prone to downy mildew ?";;"725657067323842560"
EuropePMC;2016-04-27 05:53;0;"Coupling Spore Traps and Quantitative PCR Assays for Detection of the Downy Mildew Pathogens o... http:// bit.ly/241EK0f @FWFOpenAccess";;"725170929546862592"
QuesadaLabNCSU;2016-04-26 21:34;6;"Downy mildew reported on Coleus in NC! see alert by Inga Meadows: http:// buff.ly/1SIfvYi #downymildew";#downymildew;"725045421245079558"
eViti_es;2016-04-26 17:31;0;"How downy mildew overwinters and infects the vines? http:// ow.ly/101T9S #pests #fungus #vineyard #grapevines";#pests #fungus #vineyard #grapevines;"724984285581742080"
eViti_en;2016-04-26 17:31;1;"How downy mildew overwinters and infects the vines? http:// ow.ly/101T9S #pests #fungus #vineyard #grapevines";#pests #fungus #vineyard #grapevines;"724984283446796288"
eVineyard_app;2016-04-26 17:31;0;"How downy mildew overwinters and infects the vines? http:// ow.ly/101T9S #pests #fungus #vineyard #grapevines";#pests #fungus #vineyard #grapevines;"724984283375538176"
rob_choudhury;2016-04-25 21:31;0;"Downy mildew on my salad spinach at lunch pic.twitter.com/TVS7O8NJ97";;"724682284545138688"
PestGeekPodcast;2016-04-25 21:17;0;"Downy Mildew on Coleus: Update - Coleus downy mildew (Peronospora sp.) has been detected in a greenhouse in Nor... http:// ow.ly/8JLYbc";;"724678682992906241"
UTPlantDoc;2016-04-25 20:58;0;"@ucipmurban Rarely see this disease on rose in TN. Our biggies are rose rosette, black spot, cercospora ls, powdery mildew, downy mildew";;"724674046198202368"
LJtheGrape;2016-04-25 20:13;0;"@hanswp I'll show pictures of black rot and downy mildew when I wanna shock growers into realizing we have it easy fungal control wise in CA";;"724662661191897089"
Nick_Leone;2016-04-25 16:43;0;"Ranman Fungicide Registered For Downy Mildew Control In Bulb Vegetables http:// ift.tt/1T9axRO";;"724609661475893248"
AVG_Magazine;2016-04-25 16:33;0;"Ranman Fungicide Registered For Downy Mildew Control In Bulb Vegetables http:// ift.tt/1T9axRO";;"724607301060050944"
LeafTree99;2016-04-25 13:19;0;"Alert: downy mildew in winter beans http:// ift.tt/1ru2hWs";;"724558403557830658"
SwsWoodland;2016-04-25 12:39;0;"Alert: downy mildew in winter beans http:// sws.click/1SZiXLj #horticulture";#horticulture;"724548371306938368"
cherylreads;2016-04-25 06:03;0;"As if aphids & downy mildew wasn't enough, now we're having a freak out-of-nowhere hail storm. Poor ! What next, a volcano? #GardenChat";#GardenChat;"724448682263728128"
viviannastevens;2016-04-24 21:53;0;"Downy mildew ? http:// ift.tt/1SY3Wcy #Gardening";#Gardening;"724325494011887616"
GreatLakesHops;2016-04-24 19:32;1;"Three days of rain coming at West Michigan . . . perfect for downy mildew to make its appearance. We highly... http:// fb.me/4xNeBPRqo";;"724289973143277568"
meteostationsb;2016-04-24 18:10;0;"AVVISO METEO : downy mildew conditions have been reached";;"724269168883830784"
meteohr;2016-04-22 19:38;0;"WEATHER WARNING : downy mildew conditions have been reached";;"723566603737137152"
WisCropMan;2016-04-22 18:11;0;"Considerations for Downy Mildew Control in Wisconsin Hop Production, 2016 - http:// tinyurl.com/jhne5c3";;"723544879582695425"
cherylreads;2016-04-22 03:11;1;"@growingnorth #growingnorth Quick, mine first! Please! Any cure for downy mildew on grapes except trash the vine??";#growingnorth;"723318347991945217"
EMS_A2;2016-04-22 02:49;0;"@cherylreads @growingnorth Not powdery mildew see pic. Maybe downy mildew ? White fuzzy underside of leaf? Google it. pic.twitter.com/MKR3C07Rc4";;"723312715905650688"
toastradio;2016-04-22 01:56;0;"Them That Dream by Downy Mildew #nowplaying http:// toastradio.com/np/FB11E557780 F29D8 …";#nowplaying;"723299425477492738"
ajanegevens;2016-04-21 20:26;1;"Hop downy mildew symptoms and signs (Photos courtesy of UW-Madison Plant Pathology graduate student, Michelle Marks).";;"723216231348748288"
ajanegevens;2016-04-21 20:12;4;"Downy mildew has been confirmed in hops in Pepin County WI on 4/20/2016. Early emerging spikes were seen with... http:// fb.me/4wKwjfq0n";;"723212870578802688"
ajanegevens;2016-04-21 19:59;1;"Presidio fungicide does not have a special use registration for hop downy mildew control in WI at this time. http:// fb.me/5pNbF2bYM";;"723209500187090944"
meminem11;2016-04-21 16:27;4;"Downy mildew spikes found in Wisconsin! Keep an eye out! pic.twitter.com/anoRnSwR33";;"723156303602917376"
QuesadaLabNCSU;2016-04-20 23:12;5;"Basil downy mildew is being reported in NC, scout your basil and check this fact sheet: http:// buff.ly/1Qo3XoG pic.twitter.com/E0E2v3UbzC";;"722895648228413442"
KayvanSamavati;2016-04-20 23:07;0;"I added a video to a @YouTube playlist http:// youtu.be/180JiG51UXs?a Identifying and Treating Downy Mildew on Squash, Zucchini and";;"722894491619692544"
alamgir1825;2016-04-20 16:17;0;"Dr. Quesada presenting Downy Mildew research at Pickle Packers International meeting this morning pic.twitter.com/1hr8AJg30j – bei Hilton North Raleigh";;"722791235946221568"
hoosiergardener;2016-04-20 14:57;0;"Inspect basil plants carefully. Better yet, sow your own seed. Downy mildew attacks basil | Hoosier Gardener https:// shar.es/1jOHBU";;"722771053844430850"
host_microbe;2016-04-19 13:01;0;"Toward the Identification of Two Glycoproteins Involved in the Stomatal Deregulation of Downy Mildew -Infected… http:// dlvr.it/L5XBNK";;"722379612412465154"
custom_ms;2016-04-19 12:05;0;"Genome Sequence and Architecture of the Tobacco Downy Mildew Pathogen Peronospora tabacina. http:// dlvr.it/L5W5w4";;"722365412508217344"
AGFoodSS;2016-04-18 21:45;0;"Ranman 400 SC fungicide is now registered for control of downy mildew in bulb vegetables. http:// bit.ly/20QgNDJ";;"722148981837418497"
WDCGardener;2016-04-18 18:04;0;"Garden tip of the day: To combat downy mildew in basil select varieties that are less susceptible to it like Thai and Lemon Basil. #gardendc";#gardendc;"722093426490150912"
