username;date;retweets;text;hashtags;id
CherylTrueman;2016-06-29 01:13;0;"@Pasztor79 @ManningFarms @Vegetables_Inc can't c whole conversation but if talking abt downy mildew none confirmed in ON so far in '16";;"747930892857974784"
best4hedging;2016-06-28 23:07;0;"A new gardening plague? A look at aquilegia downy mildew - http:// bit.ly/28ImUdC ? pic.twitter.com/kDkCPfzbWQ";;"747899128554754048"
thesavvyage;2016-06-28 19:35;0;"Downy Mildew Continues To Infect Impatiens and Vegetables - The Savvy Age http:// ow.ly/usfd301IMQb";;"747845841264730112"
FarmersWeekly;2016-06-28 13:50;5;"Warning of high levels of chocolate spot in winter beans, with downy mildew evident in spring pulses #clubhectare http:// bit.ly/28ZZijG";#clubhectare;"747758957301760000"
EasyGrowGarden;2016-06-27 22:28;0;"PLATEAU GARDENING: Managing impatiens downy mildew http:// bit.ly/291CC2g";;"747527141131116544"
crossvillenews;2016-06-27 20:48;0;"PLATEAU GARDENING: Managing impatiens downy mildew http:// fb.me/7TsJq8tNJ";;"747501958613766148"
UTPlantDoc;2016-06-27 17:14;0;"@rob_choudhury Thank you! That's very helpful. Epazote downy mildew here from a local hydroponic greenhouse spec in herbs for fresh market";;"747447961693609984"
rob_choudhury;2016-06-27 17:06;0;"@UTPlantDoc Steve Klosterman was working on epazote downy mildew here in CA, but I dont think they speciated it https://www. usc.edu/CSSF/History/2 014/Projects/S0526.pdf …";;"747446081303117824"
_TylerChandler;2016-06-27 16:52;0;"Mmmm... downy mildew . - Homer Simpson https:// twitter.com/utplantdoc/sta tus/747419601743405057 …";;"747442497379500036"
rob_choudhury;2016-06-27 16:50;0;"@UTPlantDoc Looks like a Peronospora species, Basil downy mildew ?";;"747442067186417665"
meteostationsb;2016-06-27 16:49;0;"AVVISO METEO : downy mildew conditions have been reached";;"747441638092464128"
UTPlantDoc;2016-06-27 15:21;5;"Each time I see a downy mildew , my mind wanders. Surely, I'm not the only one. pic.twitter.com/53QOPFXoqd";;"747419601743405057"
JanineLunn;2016-06-27 15:20;0;"@CorwhinHerbs my guess is downy mildew . Common in flowers. Not sure about a fix but air circulation and space between plants may help";;"747419270452219904"
whippadam1;2016-06-27 12:09;0;"Downy mildew or black leg? @scottburger00 @AlleenaBurger @srobertson001 @jono_fenwick ? pic.twitter.com/jokiPFeFQT";;"747371227178643456"
UTPlantDoc;2016-06-25 19:00;8;"Downy mildew isn't the only threat to garden impatiens. Rhizoctonia stem rot causes a stem rot. @UTIAg pic.twitter.com/DBWGRQf6OF";;"746750023531003905"
LinesDavid;2016-06-25 17:12;1;"@CCCAgronomy @InteragroUK also finding bean rust and downy mildew coming in with the blighty weather pic.twitter.com/MbZJomraJK";;"746722644993675264"
Hartleybotanic;2016-06-25 12:01;3;"A new Gardening Plague: Aquilegia Downy Mildew . What is it and how can it be stopped? #Gardening #Tips pic.twitter.com/M4NlPYUwsE";#Gardening #Tips;"746644397815631872"
3vil3ddie666;2016-06-25 02:43;0;"@NicolleDWallace @jimmygill I miss my impatiens. Damn Downy Mildew !";;"746504113337163776"
EastGeorgiaAg;2016-06-23 23:54;0;"Downy Mildew Disease | Georgia FACES | UGA http:// apps.caes.uga.edu/gafaces/index. cfm?public=viewStory&PK_ID=5847&utm_source=&utm_medium=&utm_campaign=#.V2xaitTLc-4.twitter …";#;"746099116942442497"
SyngentaCropsUK;2016-06-23 20:01;1;"Some more Downy #Mildew , this time infecting beans in Wiltshire. pic.twitter.com/yOYW0yYcs5";#Mildew;"746040432199622656"
eastsus7;2016-06-23 19:36;0;"WEATHER ALERT : downy mildew conditions have been reached";;"746034089539436546"
OhioVeggieDoc;2016-06-23 17:32;3;"No reports of cucurbit downy mildew in the Great Lakes region yet in 2016. https:// twitter.com/QuesadaLabNCSU /status/745963858943184896 …";;"746002926200512512"
eastsus7;2016-06-23 15:16;0;"WEATHER ALERT : downy mildew conditions have been reached";;"745968878065422336"
eastsus7;2016-06-23 12:52;0;"WEATHER ALERT : downy mildew conditions have been reached";;"745932650561572864"
eastsus7;2016-06-23 00:52;0;"WEATHER ALERT : downy mildew conditions have been reached";;"745751435300704257"
ForTraders;2016-06-22 21:20;0;"University of Georgia College of Agricultural : Downy Mildew Disease http://www. 4-traders.com/news/Universit y-of-Georgia-College-of-Agricultural-Downy-Mildew-Disease--22562690/ …";;"745697892577456129"
SallyGray31;2016-06-22 20:15;0;"@ianholmes20 Yes I've been finding some downy mildew too - need some dry weather";;"745681513757433856"
ianholmes20;2016-06-22 18:06;0;"@SallyGray31 ours drilled 23 April looking good now. Loads of bees in them 2day. Touch of downy mildew too tho pic.twitter.com/LFKn2MxLmi";;"745649185165279232"
TreesPayne;2016-06-22 17:54;0;"@papaver love love love blousy trailing ones Not so keen on little 'carpet' bedding ones-not as lovely as Busy Lizzies (pre downy mildew )";;"745646206303494144"
PioneerNebr;2016-06-22 16:00;1;"#Grow16 #soybeans have yellow spots on the leaves? Could be downy mildew - not yield limiting http:// phbn.ws/6012BQOHy pic.twitter.com/acdZTkycgU";#Grow16 #soybeans;"745617342554603520"
ryanwallis23;2016-06-22 11:17;1;"Downy mildew on gunyah peas under very conducive conditions @Pulse_Australia pic.twitter.com/nICfwb0MNF";;"745546123675209728"
Blackthorncox;2016-06-22 11:14;1;"Downy mildew in onion sets, blight in potatoes, its all kicking off now";;"745545506344964096"
FrontPlantSci;2016-06-22 07:39;0;"De novo Transcriptome Sequencing to Dissect Candidate Genes Associated with Pearl Millet- Downy Mildew (Sclero... http:// bit.ly/28OHLJV";;"745491475463446528"
BOULLETP;2016-06-21 06:07;0;"WEATHER WARNING : downy mildew conditions have been reached pic.twitter.com/yeKb4WnDNA";;"745105884217389056"
BOULLETP;2016-06-21 05:55;0;"WEATHER WARNING : downy mildew conditions have been reached pic.twitter.com/p4Egh9S46P";;"745102694612795393"
BOULLETP;2016-06-21 00:00;0;"WEATHER WARNING : downy mildew conditions have been reached pic.twitter.com/kM1bOWTOnI";;"745013494962061312"
BOULLETP;2016-06-20 16:00;0;"WEATHER WARNING : downy mildew conditions have been reached pic.twitter.com/kzT7pW5ck9";;"744892716291592192"
Jacksonsfencing;2016-06-20 12:15;2;"A new #gardening plague: aquilegia downy mildew | via @TeleGardening http://www. telegraph.co.uk/gardening/prob lem-solving/a-new-gardening-plague-aquilegia-downy-mildew/ …";#gardening;"744835971334701056"
mwstation;2016-06-20 09:36;0;"WEATHER ALERT : downy mildew conditions have been reached";;"744795940008001536"
SpringerJP_LS;2016-06-20 07:59;0;"First report of downy mildew of statice caused by Peronospora statices in Japan Kayo Shirai et al http:// link.springer.com/article/10.100 7/s10327-016-0657-8 …";;"744771709178306560"
rscragg;2016-06-19 23:19;0;"@aggrowconsult What would be your choice? Headline? It looks almost like downy mildew to me.";;"744640840291647488"
thesavvyage;2016-06-18 22:45;0;"Downy Mildew Fungus Continues To Infect #gardens > http:// ow.ly/BCFS300QsMv #diy #flowers #home pic.twitter.com/c17yswVvBc";#gardens #diy #flowers #home;"744269808347209728"
WoodwardDuncan;2016-06-18 00:15;0;"Seeing a lot of downy mildew breaking out in spring bean crops....and my broad beans at home! pic.twitter.com/jHKR9k1OMQ";;"743930051360620544"
PestGeekPodcast;2016-06-17 21:16;0;"Watermelon downy mildew reported in North Carolina - Downy mildew , caused by the oomycete Pseudoperonospora cub... http:// ow.ly/Wt2B501uDLS";;"743885066657476608"
QuesadaLabNCSU;2016-06-17 21:14;7;"Watermelon downy mildew reported in North Carolina, keep an eye on your watermelons! - #downymildew - http:// buff.ly/1Qc6Xez";#downymildew;"743884548044369920"
2blades;2016-06-17 20:00;0;"Struggling with downy mildew of spinach in Spain http://www. freshplaza.com/article/159429 /Spanish-spinach-production-threatened-by-mildew#.V2Q6oCilTnU.twitter …";#;"743865946427822080"
snides007;2016-06-17 16:12;0;"@RobHart14 I had similar last year. Tests come back with downy mildew and white leaf spot. Nothing can do. #stoplooking";#stoplooking;"743808661781286912"
GrowMoreHops;2016-06-17 15:38;0;"@microfungirl Have you seen any hop downy mildew in Minnesota hop yards this year?";;"743799897594335234"
GrowMoreHops;2016-06-17 15:20;0;"Midwest Hop Growers! @wisconsinhops Hop Downy Mildew has been identified in Fond du Lac County, Wisconsin by the UW. Check your hopyard!";;"743795523497299968"
HVG_GERMAN_HOPS;2016-06-17 14:43;1;"You probably have heard about Peronospora ( downy mildew ) in #hops . This is how the spores in the air look like. pic.twitter.com/W7ypusig10";#hops;"743786157419413504"
FGNews;2016-06-16 21:48;1;"Yellow spots on Michigan grape leaves not downy mildew : http:// bit.ly/1tyX4Oa";;"743530604487139330"
mwstation;2016-06-16 17:13;0;"WEATHER ALERT : downy mildew conditions have been reached";;"743461389910614016"
KamounLab;2016-06-16 15:01;8;"#OMGN16 Yann Dussert describes a pretty decent PacBio assembly of the ~80 Mbp genome of the grapevine downy mildew Plasmopara viticola";#OMGN16;"743428347720503296"
PestHelpLtdUK;2016-06-16 03:40;0;"A new gardening plague: aquilegia downy mildew pic.twitter.com/vqjtnxcstK http://www. telegraph.co.uk/gardening/prob lem-solving/a-new-gardening-plague-aquilegia-downy-mildew/ …";;"743256780592001024"
Herrenhof_News;2016-06-15 16:43;0;"Now: fighting against downy mildew in the vineyard - You will lose Mr. Mildew! You will..!! #wine #winegrowing";#wine #winegrowing;"743091595822702592"
DebraEMarvin;2016-06-15 16:41;0;"In my 'real' job, I often write about downy mildew . Except, I usually write downey mildew & have to back track pic.twitter.com/ixNkRVPeF2";;"743091030032035840"
UNHextFruit_Veg;2016-06-15 16:00;1;"Last weeks cold snap caused some damage to our most tender crop Basil! Look for bronzing on the upper side of leaves, not downy mildew !";;"743080845511172096"
richamelin;2016-06-15 14:20;4;"@QuesadaLabNCSU genomics for detection and monitoring of downy mildew pathogens #cps2016 pic.twitter.com/6uedVzhzzE";#cps2016;"743055606379085824"
growbradford;2016-06-15 14:01;0;"A new gardening plague: aquilegia downy mildew | via @TeleGardening http://www. telegraph.co.uk/gardening/prob lem-solving/a-new-gardening-plague-aquilegia-downy-mildew/?utm_source=dlvr.it&utm_medium=twitter …";;"743050674754162688"
gardeningtrials;2016-06-15 13:35;0;""A new gardening plague: aquilegia downy mildew " http:// buff.ly/1UtdBgo #gardening";#gardening;"743044134047469568"
KamounLab;2016-06-15 12:27;0;"#OMGN16 Joël Klein on downy mildew Peronospora farinose; host-specific parasite of spinach, doesn't infect other plants such as pumpkin";#OMGN16;"743027164862386176"
GardenPresEvent;2016-06-15 08:50;0;"A new gardening plague: aquilegia downy mildew http:// flip.it/FzQbu";;"742972566730641409"
LenGunGardens;2016-06-15 00:54;0;"#gardenchat A new gardening plague: aquilegia downy mildew : With a strange weather divide across the country ... http:// bit.ly/24Pmang";#gardenchat;"742852840440233985"
furriesagainst;2016-06-15 00:10;0;"Furries Against Downy Mildew";;"742841552968384513"
thymesquad;2016-06-14 22:28;0;"A new gardening plague: aquilegia downy mildew http:// bit.ly/28CrGOH #gardening";#gardening;"742815971824435201"
WeWorkLocal;2016-06-14 21:33;0;"A new gardening plague: aquilegia downy mildew : http:// bit.ly/1US2Ccb #gardening";#gardening;"742802203904118784"
imadethatmyself;2016-06-14 21:33;0;"A new gardening plague: aquilegia downy mildew : http:// bit.ly/1US2Ccb";;"742802200875782144"
urbanfarme;2016-06-14 21:28;0;"A new gardening plague: aquilegia downy mildew : With a strange weather divide across the country early this m... http:// bit.ly/28CrGOH";;"742801017746513920"
LifeStyleFix;2016-06-14 21:26;0;"A new gardening plague: aquilegia downy mildew : With a strange weather divide across the country early this m... http:// bit.ly/24OXtqV";;"742800515461828608"
skillforsurvivl;2016-06-14 21:05;0;"A new gardening plague: aquilegia downy mildew http:// bit.ly/24OXtqV http:// bit.ly/1JX8ifV";;"742795131074404352"
SurvivalPlanKit;2016-06-14 20:38;0;"A new gardening plague: aquilegia downy mildew : With a strange weather divide across the country early this m... http:// bit.ly/260G3dt";;"742788253686726656"
BillRodgers63;2016-06-14 20:38;0;"A new gardening plague: aquilegia downy mildew : With a strange weather divide across the country early this m... http:// bit.ly/1XV6VL1";;"742788251606355969"
morgan_bci;2016-06-14 20:37;1;"MSU Granted $2.3M to Combat Downy Mildew http:// hubs.ly/H03kbSS0 #LifeScience #Biotechnology #AgriculturalResearch pic.twitter.com/CDXL41w5gA";#LifeScience #Biotechnology #AgriculturalResearch;"742788005702832128"
EasyGrowGarden;2016-06-14 20:29;0;"A new gardening plague: aquilegia downy mildew http:// bit.ly/1YpkosV";;"742786053799436288"
jefferysgarden;2016-06-14 20:06;0;"A new gardening plague: aquilegia downy mildew http:// ift.tt/25W2rrO #gardening";#gardening;"742780144083931141"
juanmuriango;2016-06-14 19:48;0;"A new gardening plague: aquilegia downy mildew http:// dlvr.it/LYmw2H";;"742775687539392512"
TeleGardening;2016-06-14 19:37;19;"A new gardening plague: aquilegia downy mildew http://www. telegraph.co.uk/gardening/prob lem-solving/a-new-gardening-plague-aquilegia-downy-mildew/?utm_source=dlvr.it&utm_medium=twitter … pic.twitter.com/OvvhpsgZUY";;"742773004224978944"
jennifer_bci;2016-06-14 18:26;0;"MSU researchers will be leading a $2.3M project to develop methods to manage downy mildew http:// hubs.ly/H03k62M0 pic.twitter.com/DztXGjHu4b";;"742755148934578176"
biotechcalendar;2016-06-14 18:26;0;"MSU researchers will be leading a $2.3M project to develop methods to manage downy mildew http:// hubs.ly/H03k62K0 pic.twitter.com/xaodQzaA5R";;"742755148926226432"
PacoDelmotte;2016-06-14 08:00;6;"Yes indeed, that my picture ! @SFP_France @PhytopathologyJ ( Downy mildew on phylloxera gall, Vitis riparia) pic.twitter.com/rYq6ioEUTZ";;"742597525824233472"
SFP_France;2016-06-14 00:22;6;"Nice to see that @PhytopathologyJ has chosen a picture from @Paco_Delmotte with grape downy mildew as header photo pic.twitter.com/jIKP3ZyYaF";;"742482273375772672"
1723vineyards;2016-06-13 12:10;0;"Early morning preventative spray for botrytis an downy mildew pic.twitter.com/UHObRIUoL1";;"742297979500040192"
bodenfarming;2016-06-12 13:50;0;"@tagandbruce yes they are fairly clean quite a lot of downy mildew but have thrown a lot of fungicide at them!";;"741960869215637505"
ByronCalloway1;2016-06-11 06:17;0;"Bedding Busy Lizzies are making a comeback – just years after plants were wiped out by downy mildew . pic.twitter.com/7c9g85eTUT";;"741484397472448512"
JimAnder1979;2016-06-11 01:06;0;"Mysterious yellow spots on grape leaves are not downy mildew | MSU Extension http:// msue.anr.msu.edu/news/mysteriou s_yellow_spots_on_grape_leaves_are_not_downy_mildew …";;"741406158116818944"
apasztor82;2016-06-10 19:31;0;"@clayallover @JoelSalatin so what am I doing wrong to get wbc in my corn or downy mildew in r cucumbers?";;"741321947259142144"
pabloialvarezr;2016-06-10 18:15;0;"Control of downy mildew (Peronospora sparsa) in arctic bramble (Rubus ar.... http:// onlinelibrary.wiley.com/resolve/doi?DO I=10.1111%2Faab.12211#.V1rnpG1gsXk.twitter …";#;"741302805797994498"
usagardencare;2016-06-10 14:34;1;"Gardening Expert Issues Warning About Downy Mildew - CBS Local https:// usalandscapematerials.com/blog/gardening -expert-issues-warning-about-downy-mildew-cbs-local/?utm_source=ReviveOldPost&utm_medium=social&utm_campaign=ReviveOldPost … #washingtongardeningideas";#washingtongardeningideas;"741247067704549376"
1accessforall;2016-06-10 10:03;0;"Fellow #gardeners please look out for the symptoms of #aquilegia downy mildew ( #ADM ) to help control the spread. http://www. touchwoodplants.co.uk/aquilegia-down y-mildew.htm …";#gardeners #aquilegia #ADM;"741179086341603328"
BotanicalSeeds;2016-06-10 00:04;0;"@MysticPhoeniix yes, it is resistant to powdery mildew but they can get downy mildew in cool and wet conditions.";;"741028318988750848"
klsywd;2016-06-09 19:19;0;"Found on my run this morning: Bremia lactucae aka lettuce downy mildew ! On a weed in Davis. #downymildews pic.twitter.com/MD8nbS2T77";#downymildews;"740956490047983616"
toastradio;2016-06-09 17:46;0;"Them That Dream by Downy Mildew #nowplaying Listen live: http:// toastradio.com/np/FB11E557780 F29D8 …";#nowplaying;"740933031465082880"
1accessforall;2016-06-09 17:12;0;"Love my #garden so horrified to have been given an official diagnosis of #aquilegia downy mildew . No known cure yet. pic.twitter.com/PkLc8QtWLH";#garden #aquilegia;"740924436266770432"
Cropnuts_agron;2016-06-08 11:37;0;"Still seeing lots of Downy Mildew in spring beans. Given the trials I have planned though this isn't such bad news!";;"740477876080893952"
klsywd;2016-06-08 03:12;1;"@realscientists @tomhouslay Yes I've eaten lettuce, and even lettuce infected with downy mildew (it's not a fungus and is nontoxic :)";;"740350865505013761"
JimBradeen;2016-06-07 20:18;0;". @getallhoppedup : because downy mildew pathogen is systemic, planting non-certified materials is dangerous #NCAPS16";#NCAPS16;"740246476736040960"
JimBradeen;2016-06-07 20:13;0;". @getallhoppedup : #hops downy mildew is distinct but related to downy mildew on cucurbits, other plants #NCAPS16";#hops #NCAPS16;"740245291815817216"
JimBradeen;2016-06-07 20:12;0;". @getallhoppedup : downy mildew is biggest disease problem for MN #hops growers. Mostly managed by fungicides #NCAPS16";#hops #NCAPS16;"740245031978737664"
DYNASTEAM3;2016-06-07 17:48;0;"http:// buff.ly/1RbkXyJ ' Downy mildew research findings released'";;"740208772568715264"
GreatLakesHops;2016-06-07 16:03;0;"So really . . . can downy mildew be controlled and stopped once it has blighted a hop bine? Absolutely. Here is... http:// fb.me/2hQL5SMR7";;"740182281671737345"
meteohr;2016-06-05 19:16;0;"WEATHER WARNING : downy mildew conditions have been reached";;"739506180469477377"
HayhoeHops;2016-06-05 16:08;1;"Another fung app yesterday before some damp humid weather with high downy mildew pressure. #ontag pic.twitter.com/ghambLtJqP";#ontag;"739458910512353280"
Yass_Weather;2016-06-05 16:00;0;"WEATHER WARNING : downy mildew conditions have been reached";;"739456748847669253"
HarrietRycroft;2016-06-05 11:36;1;"@SarahReesTV :) I like your observation abt the heart. Sadly my Aquilegias are almost all dead due to the new downy mildew .";;"739390547471831040"
AqleemAbbas;2016-06-05 06:08;0;"Downy mildew symptoms on broccoli leaf. Do comment and let us know how can we get rid of this disease. Host:... http:// fb.me/1cTMgRifT";;"739307933071224832"
Yass_Weather;2016-06-05 01:58;0;"WEATHER WARNING : downy mildew conditions have been reached";;"739244863942594560"
thesavvyage;2016-06-04 19:20;0;"Downy Mildew Fungus Continues To Infect #gardens > Impatiens & Vegetables http:// ow.ly/pR8q300QrUf #diy #flowers #msu";#gardens #diy #flowers #msu;"739144766701600768"
thesavvyage;2016-06-04 16:40;1;"Downy Mildew Fungus Continues To Infect #gardens > Impatiens & Vegetables http:// ow.ly/pR8q300QrUf #diy #flowers #msu pic.twitter.com/nNFk64eFFz";#gardens #diy #flowers #msu;"739104505615294465"
SyngentaUS;2016-06-04 15:05;1;"Don’t let downy mildew knock down #sunflowers : http:// bit.ly/20VmsI3 #Agronomy";#sunflowers #Agronomy;"739080596794834944"
thesavvyage;2016-06-04 13:10;0;"Downy Mildew Fungus Continues To Infect #gardens > Impatiens and Vegetables http:// ow.ly/pR8q300QrUf #diy #flowers pic.twitter.com/ctDTdVx8XN";#gardens #diy #flowers;"739051655493263361"
MichiganHops;2016-06-04 13:00;0;"Controlling downy mildew on hop | MSU Extension http:// msue.anr.msu.edu/news/controlli ng_downy_mildew_on_hop …";;"739049219529560064"
Yass_Weather;2016-06-04 09:57;0;"WEATHER WARNING : downy mildew conditions have been reached";;"739003008978018304"
jryanmurphy81;2016-06-04 03:36;0;"@ManningFarms downy mildew gets earlier every year, they found it about 5 miles from here";;"738907193983045632"
thesavvyage;2016-06-04 02:01;0;"Downy Mildew Fungus Continues To Infect #gardens > Impatiens and Vegetables http:// ow.ly/pR8q300QrUf #diy #flowers";#gardens #diy #flowers;"738883224626171906"
FlowersQLD;2016-06-03 23:35;0;"Protecting sunflowers against downy mildew http:// fb.me/186LEaFJx";;"738846623963303937"
BBRO_research;2016-06-03 17:11;5;"First signs of downy mildew at Swaffham Prior, Cambridgeshire. Please keep us informed of signs elsewhere #sugarbeet pic.twitter.com/dlOgmkxdL0";#sugarbeet;"738749930135769090"
onhortcrops;2016-06-03 16:30;1;"2016 Downy Mildew Control Strategy for Cucumber Crops https:// onvegetables.com/2016/05/27/201 6-downy-mildew-control-strategy-for-cucumber-crops/ … #OntAg";#OntAg;"738739752334200832"
springcreekhops;2016-06-03 12:31;0;"@HoweFarms @3PopsHops A little under 200. Wish us luck. Downy mildew is a bitch. Aphids are a new thing for us this year.";;"738679574125416448"
meteostationsb;2016-06-02 16:53;0;"AVVISO METEO : downy mildew conditions have been reached";;"738382914656817152"
NCAgriculture;2016-06-02 14:50;1;"RT @QuesadaLabNCSU : Cucumber downy mildew reported in North Carolina, time to protect your cucurbits! - http:// buff.ly/1WZzWnC #downymildew";#downymildew;"738351992419045380"
PestGeekPodcast;2016-06-02 05:19;0;"Cucumber downy mildew reported in North Carolina - Downy mildew , a devastating disease on cucumbers caused by t... http:// ow.ly/GsNa500VO73";;"738208298239971328"
QuesadaLabNCSU;2016-06-02 04:40;5;"Cucumber downy mildew reported in North Carolina, time to protect your cucurbits! - http:// buff.ly/1WZzWnC #downymildew";#downymildew;"738198512958111744"
DrThomasParker1;2016-06-02 03:52;0;"@DrThomasParker1 I got my PhD study hop downy mildew and genetics....I went up to Pelican ...Stayed in a beach house...Dave Wills...";;"738186383005618176"
KAWhittlesey;2016-06-01 20:21;0;"@JuliThanki Best (?) promo item I ever got was a sealed petri dish full of mold when first Downy Mildew album came out....";;"738073107315982336"
ustourist;2016-06-01 16:25;0;"@sergi_jennifer of downy mildew in houseplants.";;"738013536962613248"
GreatLakesHops;2016-06-01 15:47;0;"Grower Notes: While our warm weather in the 80's has shut down downy mildew activity in the hopyards; be aware... http:// fb.me/5hVICsOKx";;"738003973429334016"
sergi_jennifer;2016-06-01 06:28;0;"@ustourist was downy mildew at all.YOU have been right from the beginning its a insect she said she thinks she has to do a culture but";;"737863359756926977"
BOULLETP;2016-06-01 05:53;0;"WEATHER WARNING : downy mildew conditions have been reached pic.twitter.com/SUGcYtPMG8";;"737854519078473728"
LauraVanEerd;2016-06-01 04:28;3;"Grow cucumbers? Downy mildew control options. Thx Elaine @Vegetables_Inc https:// onvegetables.com/2016/05/27/201 6-downy-mildew-control-strategy-for-cucumber-crops/ …";;"737833286081335296"
BOULLETP;2016-06-01 00:00;0;"WEATHER WARNING : downy mildew conditions have been reached pic.twitter.com/ODWyWKiRCb";;"737765656624517121"
jaf_ksa;2016-05-31 21:06;0;"@AgronomyUkraine thanks - does look like the attached of downy mildew ! pic.twitter.com/KsU5K6CA8l";;"737721997971619842"
GrainsNidera;2016-05-31 14:03;0;"@AgronomyUkraine Looks like downy mildew";;"737615569994711042"
sunflowerfarmer;2016-05-31 13:18;0;"@WillCherFarm @AgronomyUkraine Downy Mildew .. Will stunt plant for it's life making it basically non productive. We have resistant traits";;"737604096807424002"
toastradio;2016-05-31 09:07;0;"An Oncoming Train by Downy Mildew #nowplaying Listen live: http:// toastradio.com/np/FB11E557780 F29B6 …";#nowplaying;"737541098344615937"
BOULLETP;2016-05-31 05:56;0;"WEATHER WARNING : downy mildew conditions have been reached pic.twitter.com/wbETfzYXat";;"737492885906456577"
GardenDesignfan;2016-05-31 03:38;0;"Garden Variety: Protect your basil plants against downy mildew - Lawrence Journal World http:// dlvr.it/LRXtbB";;"737458105315794947"
BOULLETP;2016-05-31 01:25;0;"WEATHER WARNING : downy mildew conditions have been reached pic.twitter.com/uzgSsOXSx0";;"737424702424113152"
SupportSpartans;2016-05-31 00:01;0;"MSU researcher leads $2.3-million grant to combat downy mildew in vegetables | MSUToday | Michigan State University http:// ow.ly/vbR7300EZx4";;"737403495268110336"
eViti_es;2016-05-30 20:15;1;"Downy mildew can cause significant economic damage, if not properly treated... http:// ow.ly/3UQJ300maDV #vineyard pic.twitter.com/XubImecUj1";#vineyard;"737346720317722625"
eVineyard_app;2016-05-30 20:15;2;"Downy mildew can cause significant economic damage, if not properly treated... http:// ow.ly/3UQJ300maDV #vineyard pic.twitter.com/RnHaARhtyg";#vineyard;"737346720099635200"
eViti_en;2016-05-30 20:15;2;"Downy mildew can cause significant economic damage, if not properly treated... http:// ow.ly/3UQJ300maDV #vineyard pic.twitter.com/klSYbyPSQ6";#vineyard;"737346719877324802"
TomTsgardens;2016-05-30 11:29;0;"@ColinMoat1 @Rocky_Coles @BBCGQT try potassium bicarbonate, it's used commercially as an effective treatment for downy mildew";;"737214335588675584"
sergi_jennifer;2016-05-29 18:44;0;"@ustourist r u sure that my crazy aloe can't get the downy mildew from basil.you no my crazy aloe is a year old and I worry a lot.";;"736961393019224064"
sergi_jennifer;2016-05-29 16:26;0;"@ustourist I was so so worried that the possible basil downy mildew could affect my crazy aloe.but the hotrtacularists said it cannot.";;"736926711107997698"
gardeningtrials;2016-05-29 13:21;0;"@BBCGQT @GEFFRYE @The_RHS why no mention of aquilegia downy mildew ?";;"736880016047415296"
cmossperennials;2016-05-28 22:18;0;"But seriously, @hpscmr , how far has aquilegia downy mildew spread? Is there hope? Is it transferable by seed?";;"736652892191461377"
HPSstaffs;2016-05-28 21:53;2;"Aquilegia looking good...loosing a few to the downy mildew but not enough to spoil the show here this year.... pic.twitter.com/rYPLr3roVn";;"736646713906200576"
