username;date;retweets;text;hashtags;id;Agritweet;Category
HectorCannabis;5/21/2016 16:12;0;The Pesticide Dilemma: And those daily battles with spider mites, powdery mildew and other plant-threatening ... http:// bit.ly/1YLDoA6;;7.34024E+17;y;Awareness
custom_ms;6/28/2016 14:49;0;Evolution of the EKA family of powdery mildew avirulence-effector genes from the ORF 1 of a LINE retrotransposon. http:// dlvr.it/LgV5Dq;;7.47774E+17;y;Research
plant_biology;6/16/2016 15:04;0;The Novel Gene VpPR4-1 from Vitis pseudoreticulata Increases Powdery Mildew Resistance in Transgenic Vitis vinifera… http:// dlvr.it/LZZSYs;;7.43429E+17;y;Research
epicgardening;6/15/2016 18:19;0;did you know milk cures powdery mildew ? more here: http:// bit.ly/21li1Xh;;7.43116E+17;y;Awareness
drtreefruit;5/19/2016 19:03;0;@bphillips4149 Could very well have happened--the variety shown is GoldRush, which is magnet for powdery mildew;;7.33342E+17;y;Others
TherapyGene;5/18/2016 19:30;0;MdMLO19 Gene Knockdown in Apple Reduces Susceptibility to Powdery Mildew http:// ow.ly/zAev500q6of;;7.32987E+17;y;Research
theGRDC;4/15/2016 4:53;4;WA grower Alex Pearse on wheat powdery mildew 'going against the rule book in 2014 and 2015.' http:// bit.ly/1Q8fW9O;;7.20807E+17;y;Awareness
PlantEcologyBot;4/4/2016 19:18;0;Powdery mildew suppresses herbivore-induced plant volatiles and interferes with parasitoid attraction in... http:// bit.ly/1ovxI0g (PCE);;7.17039E+17;y;Research
hacommoditynews;3/22/2016 0:05;0;Powdery mildew resistant wheat cultivar developed - Grains market news http:// fb.me/4CwokMt1W;;7.12052E+17;y;Awareness
KansasLawns;4/18/2016 3:57;0;@ksugardenguy I have never seen so much powdery mildew fungus in JoCo.;;7.2188E+17;y;self
OrchidsToday;5/1/2016 6:13;0;Garden Control: Hairy Vetch, Powdery Mildew - Late Bloomer - Episode 87 - http:// orchidstoday.xyz/garden-control -hairy-vetch-powdery-mildew-late-bloomer-episode-87/ … #garden #flowers pic.twitter.com/fZnNCTqhD6;#garden #flowers;7.26626E+17;y;Awareness
gardeningtrials;4/22/2016 16:11;0;"Treating Powdery Mildew without chemicals"" http:// buff.ly/26ivsf9""";;7.23515E+17;y;Awareness
CannabisIndy;4/6/2016 18:26;0;The battle against powdery mildew . The victor = GreenCure - http:// ift.tt/1MSvqE0;;7.1775E+17;y;Awareness
AlongTheWayKate;6/11/2016 22:24;0;Harry just harvested our volunteer pumpkin! The plant recently was overcome by powdery mildew … https://www. instagram.com/p/BGhwor4wpwb/;;7.41728E+17;y;Others
JChlapecka;5/4/2016 18:25;1;Temps 70-80 and high humidity = perfect weather for powdery mildew . Several fungicides labeled for prevention. pic.twitter.com/nniXjKn4XP;;7.27897E+17;y;self
HuskerHort;5/3/2016 16:02;4;Turf looking a little white? Powdery mildew is a common fungal infection. Find out more in #NebExt #HortUpdate http:// hortupdate.unl.edu /;#NebExt #HortUpdate;7.27499E+17;y;Awareness
theGRDC;4/1/2016 3:31;11;Nine cases of fungicide resistance identified in Australia in 2014-15, including wheat powdery mildew : http:// bit.ly/1ZMc2KR @CCDMnews;;7.15713E+17;y;Awareness
MiketheGardener;4/8/2016 2:10;0;We are getting closer to powdery mildew season. Are you ready? http:// 104homestead.com/powdery-mildew -treatment/ … http:// fb.me/4LRtIrt5A;;7.1823E+17;y;Awareness
BS_PP;4/7/2016 13:16;9;PhD Opportunity Dublin: resistance to powdery mildew in oats. http:// jobs.sciencecareers.org/job/402115/phd -studentship-teagasc-phd-walsh-fellowship-opportunity-plant-pathology/ … #phdchat #plantpathology;#phdchat #plantpathology;7.18035E+17;y;Others
VTPPWS;4/8/2016 15:09;0;VA #wheat growers are urged to monitor crops for early signs of powdery mildew . http:// goo.gl/X9EtNy #plantpath #VAAgriculture @VCE_news;#wheat #plantpath #VAAgriculture;7.18426E+17;y;Awareness
FrontPlantSci;5/27/2016 5:47;0;The Novel Gene VpPR4-1 from Vitis pseudoreticulata Increases Powdery Mildew Resistance in Transgenic Vitis vi... http:// bit.ly/1XBa8gL;;7.36041E+17;y;Research
OkieMGs;6/17/2016 15:22;0;Trim away shoots, suckers, and small crape myrtle branches infected with powdery mildew , dispose of properly. Trim plant to allow air flow.;;7.43796E+17;y;Awareness
CoryLCowan;5/16/2016 20:17;0;@Toddbrady8 lower in the canopy in some spots, not much if any powdery mildew . Getting into the Twinline window (flag out and flopped over);;7.32274E+17;y;Others
UTPlantDoc;5/25/2016 16:36;5;Scabby lesions on sedum caused by a powdery mildew ? Yes, on sedum growing in shade. pic.twitter.com/fGOVnZ5ZUW;;7.3548E+17;y;self
BobBerkevich;5/17/2016 17:33;0;@damon_lee_smith is powdery mildew in wheat affected/slowed down by frost? Grower is contemplating fungicide.;;7.32595E+17;y;Others
ModernSauce;3/14/2016 14:43;0;"@_emily_rose BTW, that weed"" that had the powdery mildew in my yard is a germander! http:// ow.ly/ZqNMM Good to know!""";;7.09374E+17;y;Others
FS_PARTNERS;6/3/2016 19:20;1;Don't let stripe rust, FHB, powdery mildew or septoria diminish yield or quality #FSPinthefield #plantprotection #T3 pic.twitter.com/x7ZQzfCQem;#FSPinthefield #plantprotection #T3;7.38783E+17;y;Others
Nicole_WardUK;5/6/2016 0:39;0;Powdery mildew is the most prominent disease of greenhouse hemp. Our program began Phase 1 of our powdery mildew ... http:// fb.me/13WFwF6zz;;7.28353E+17;y;Awareness
DalesidePlants;6/28/2016 18:35;0;TOP TIP: Keep a look out for powdery mildew , especially if the weather is warm and dry. Spray with Bayer Fungus Fighter if required.;;7.47831E+17;y;Awareness
Scien_net;4/20/2016 0:32;0;#Scien The control of swede powdery mildew http:// tinyurl.com/he46983;#Scien;7.22553E+17;y;Awareness
RVDcrops;3/29/2016 22:59;2;Powdery mildew is prevalent in the lower leaves and stems in several of our variety plots south of Concordia. pic.twitter.com/XmikFDTHQe;;7.1492E+17;y;self
viviannastevens;3/22/2016 22:02;0;Powdery mildew .. http:// ift.tt/1WGsNW8 #Gardening;#Gardening;7.12384E+17;y;Awareness
ECGardeningLtd;5/25/2016 11:04;0;Powdery mildew ? Forget the chemicals!! Mulch appropriately and remove and dispose of damaged foliage (preferably burn it)...;;7.35396E+17;y;Awareness
MatthewMoscou;3/8/2016 12:18;6;Dodds: Sr50 was introgressed from rye (like Sr31), located at rye homologous locus of Mla (barley powdery mildew R locus) #RSfungalthreats;#RSfungalthreats;7.07164E+17;y;Others
Farm_Apprentice;6/20/2016 10:54;0;@BradenBagley were a fair way behind as far as maturity but have found a little powdery mildew in the baudin, that's a given! SFNB soon;;7.44816E+17;y;self
EmphasisProject;4/11/2016 12:05;2;Powdery #mildew of black gram http:// buff.ly/1Sb7Ch9 via @plantdisease #planthealth http:// buff.ly/1Sb7Ch9 pic.twitter.com/nJfmSr1qIf;#mildew #planthealth;7.19466E+17;y;Awareness
FarmsNews;5/5/2016 15:08;1;Winter Wheat Diseases: Powdery Mildew & Tan Spot Increasing Read more... http://www. farms.com/commentaries/w inter-wheat-diseases-powdery-mildew-tan-spot-increasing-107062.aspx … pic.twitter.com/1UamV5Vwj8;;7.2821E+17;y;Awareness
lambros_f;5/14/2016 20:44;0;Interesting paper on Powdery Mildew interaction with the Arabidopsis ADF4 http://www. plantphysiol.org/content/170/3/ 1420.abstract?etoc …;;7.31556E+17;y;Research
meiosis_papers;4/22/2016 18:34;0;Marker Assisted Transfer of Two Powdery Mildew Resistance Genes PmTb7A.1 and PmTb7A.2…|PLOS One•Singh K http:// pubmed.com/26066332;;7.2355E+17;y;Research
stevens_phil;3/28/2016 10:19;0;And I can report that potassium bicarbonate does keep the powdery mildew at bay. Amazing stuff and completely safe. #rpt;#rpt;7.14366E+17;y;Awareness
CertisUK;3/19/2016 10:05;1;Powdery mildew has been reported as being very active on protected crops #StayAlert;#StayAlert;7.11116E+17;y;Awareness
ConservationTV;6/4/2016 7:03;0;Powdery mildew relief found in your kitchen pantry! http:// zkq.me/Sa4SC;;7.38959E+17;y;Awareness
DTelenko;6/22/2016 2:09;6;First powdery mildew of the season in zucchini #plantdisease @GLVeg @CornellVeg @ccecornell pic.twitter.com/GtrDNomzHd;#plantdisease;7.45408E+17;y;self
AGaminKansas;5/3/2016 17:12;6;Stripe rust and powdery mildew on #wheattour16 pic.twitter.com/vb8LPIEPZS;#wheattour16;7.27516E+17;y;self
loyal2days;5/15/2016 20:14;0;I think my apple trees may have powdery mildew . Going to try milk as one of the natural remedies. You know, when it stops SLEETING!;;7.31911E+17;y;self
KamounLab;6/2/2016 19:29;1;Powdery Mildew Summer School, Hungary, August 2016 http:// sco.lt/9Fd70j;;7.38422E+17;y;Ad
SodoHydro;3/18/2016 21:23;0;This eliminates algae, stops powdery mildew and does away with pesticides!... http:// fb.me/4w6BdjkQe;;7.10925E+17;y;Awareness
sayitwhirly;6/28/2016 17:01;0;@ECthetwit now all the bean plants have powdery mildew . OOPS;;7.47807E+17;y;self
SNP_papers;6/16/2016 13:11;0;Haynaldia villosa NAM-V1 is linked with the powdery mildew resistance gene Pm21 and contributes to increasing grain… http:// dlvr.it/LZXKmL;;7.43401E+17;y;Research
sunshineshounen;5/26/2016 16:01;0;"the flowers were half-bloomed before it got infected by the powdery mildew …I hope the new shoots will grow up & be nice and healthy ;n;";;7.35833E+17;y;self
StackGardening;3/14/2016 3:03;0;Is powdery mildew spreading through my garden? http:// gardening.stackexchange.com/q/23495?atw=1 #vegetables;#vegetables;7.09198E+17;y;Awareness
ConservationTV;4/8/2016 8:41;0;Powdery Mildew : Kitchen Cure to Stop Cucumber and Squash Loss http:// qza.me/DIZXL;;7.18328E+17;y;Awareness
theGRDC;5/5/2016 3:20;8;Spray early in 2016 for wheat powdery mildew in susceptible areas - @DAF_WA pathologist Ciara Beard: http:// bit.ly/1ru4Asx;;7.28032E+17;y;Awareness
MyGardenTeam;6/29/2016 17:31;0;Powdery Mildew . http://www. gardenadvice.co.uk/advisor/garden ing-tips/powdery-mildew/ …;;7.48177E+17;y;Awareness
EurekaMag;3/16/2016 5:11;0;#EurekaMag Hawthorn powdery mildew : occurrence, survival and ascospore productivity of Podosphaera clandestina… http:// dlvr.it/KnwMny;#EurekaMag;7.09955E+17;y;Research
Dankbudzofmich;4/15/2016 15:03;0;How to Cure Powdery Mildew https:// youtu.be/iTtDL0DOFmk via @YouTube;;7.20961E+17;y;Awareness
acadiagarden;6/10/2016 3:40;0;@CalgaryArborist Are you seeing lots of powdery mildew on crab apples this season. Seems an issue in Acadia. #opinion please;#opinion;7.41083E+17;y;self
GardeningJoys;6/19/2016 8:13;0;Milk, A Garden Miracle Against Powdery Mildew ..one part ... - #garden #gardens #gardening http:// gardeningjoys.xyz/milk-a-garden- miracle-against-powdery-mildew-one-part-milk9-parts-water-and-spray-on-leaves-will-work-on-any-plant-spray-once-a-week/ … pic.twitter.com/rgrY4k5hMk;#garden #gardens #gardening;7.44413E+17;y;Awareness
EricaHol;6/13/2016 21:09;3;Powdery mildew starting to show up in peas. Time to start thinking about #fungicide options. #AbAg #Peas pic.twitter.com/dUp3ySWU7s;#fungicide #AbAg #Peas;7.42434E+17;y;self
idiggreenacres;3/2/2016 23:22;0;@sriram20 It doesn't look like it is dying, but it definitely has disease or a pest. The young leaves look like powdery mildew ?;;7.05156E+17;y;Others
Mama__B;6/3/2016 16:37;0;Okay #tomato experts, is this powdery mildew on my Roma tomatoes? pic.twitter.com/dK3ltpDRJm;#tomato;7.38741E+17;y;Others
GreatGardening2;5/17/2016 7:37;0;Prevent powdery mildew with this spray: 1 gallon of water ... - http:// greatgardening.xyz/prevent-powder y-mildew-with-this-spray-1-gallon-of-water-1-tablespoon-of-baking-soda-1-tablespoon-of-vegetable-oil-1-tablespoon-of-dishwashing-liquid-mix-the-ingredients-together-and-add-them-to-a-sp/ … #garden #gardening #gardens pic.twitter.com/k0u42Ofino;#garden #gardening #gardens;7.32445E+17;y;Awareness
exBasinFarm;5/29/2016 18:55;0;Planted pumpkins this morning. Hopefully they grow nice this year. Powdery mildew and late frost last year left me with not enough;;7.36964E+17;y;Others
Scien_net;3/11/2016 8:47;10;#Scien Susceptibility of five faba bean cultivars to powdery mildew disease in western Canada http:// dlvr.it/Klb93W;#Scien;7.08198E+17;y;Awareness
HandymanMag;3/29/2016 2:30;0;Get Rid Of Powdery Mildew . Get rid of this common fungus by using simple sprays & techniques http:// ow.ly/ZMzfI http:// ow.ly/i/hMRjj;;7.14611E+17;y;Awareness
EMS_A2;4/22/2016 2:49;0;@cherylreads @growingnorth Not powdery mildew see pic. Maybe downy mildew? White fuzzy underside of leaf? Google it. pic.twitter.com/MKR3C07Rc4;;7.23313E+17;y;Others
idjoly;4/13/2016 23:34;4;Interview in French - @heureacadie - on our Cannabis powdery mildew project and the @nb_innovation prize Noémi got! http://www. radio-canada.ca/emissions/L_he ure_de_pointe_acadie/2015-2016/archives.asp?date=2016%2F04%2F13&indTime=2358&idmedia=7485669 …;;7.20365E+17;y;Awareness
RecipesReport;6/26/2016 16:44;0;Gary Church: Homemade recipes that will prevent powdery mildew - New Castle News http:// dlvr.it/LfhZ7R;;7.47078E+17;y;Awareness
FarmsNews;3/18/2016 14:25;3;Early Season Considerations For Powdery Mildew On Small Grains Read more... http://www. farms.com/news/early-sea son-considerations-for-powdery-mildew-on-small-grains-105114.aspx … pic.twitter.com/iqTF7hBUzq;;7.1082E+17;y;Awareness
wheat_papers;6/22/2016 13:03;1;Powdery mildew resistance in wheat cultivar Mv Hombár is conferred by a new gene PmHo. http:// dlvr.it/Ld0ctF pic.twitter.com/kkLySdaZE2;;7.45573E+17;y;Research
HannaHameline;3/20/2016 3:40;0;When powdery mildew thinks it can take over this proud mama's baby Jade plant.... #LAUGHABLE;#LAUGHABLE;7.11382E+17;y;self
Bayer4CropsAU;6/9/2016 7:43;2;"Northern WA wheatbelt bracing for powdery mildew "" Read more in Cultivate Issue 2 pg38: http:// bayercropscience.com.au/cultivate#AusAg pic.twitter.com/PMNWP5UW9c""";#AusAg;7.40781E+17;y;Awareness
red_number_one;6/8/2016 18:35;0;Cherry Tomatoes Ripening - Powdery Mildew , Baking Soda & Milk - Balcony Garden https:// youtu.be/d6LNWXt-CcY;;7.40583E+17;y;Awareness
farmdaily;5/3/2016 1:30;0;Some #wheat fields in Neb have seen little disease, others have fungal leaf spot, powdery mildew & stripe rust. http:// ow.ly/4njXh9;#wheat;7.27279E+17;y;self
BotanicalSeeds;4/21/2016 15:51;0;Developed for resistance to powdery mildew , REBA is an acronym for “Resistant Early Bush Ac… http:// buff.ly/1MkQxPl pic.twitter.com/gGnB65KdB6;;7.23147E+17;y;Awareness
HAWAIInowApp;6/19/2016 12:50;0;http:// ift.tt/23jrLmB Tropical Gardening Helpline: Powdery mildew is unattractive, but not usually fatal #HNLnow;#HNLnow;7.44483E+17;y;Awareness
CertisUK;3/29/2016 14:10;3;#StartCleanAndStayClean could be the key to keeping on top of powdery mildew in protected crops #StayAlert pic.twitter.com/75P9LD6d7M;#StartCleanAndStayClean #StayAlert;7.14787E+17;y;Awareness
AgProfessional;3/21/2016 20:14;2;Powdery mildew resistant #wheat cultivar developed. http://www. agprofessional.com/news/powdery-m ildew-resistant-wheat-cultivar-developed …;#wheat;7.11994E+17;y;Awareness
thegardenlady;6/19/2016 17:00;1;#yardandgarden #tipoftheday Growing squash? Spray regularly with an organic fungicide to suppress powdery mildew . Stems, under leaves.;#yardandgarden #tipoftheday;7.44545E+17;y;Awareness
FlatBud;6/7/2016 19:00;1;Powdery Mildew https:// flatbud.com/disease/powder y-mildew … #powderymildew pic.twitter.com/Qvq3FJmSfu;#powderymildew;7.40227E+17;y;Awareness
knowledgegngsta;6/11/2016 22:46;0;Kill Powdery Mildew Fast With This D.I.Y. Recipe - Sustainable Gardening News http:// fb.me/7m9bZMKnL;;7.41733E+17;y;Awareness
jacquet_chris;6/15/2016 17:04;0;Opposing Functions for Plant Xanthine Dehydrogenase in Response to Powdery Mildew Infection: Produc... | @scoopit http:// sco.lt/7mIrhJ;;7.43097E+17;y;Research
BiolaRaisin;4/13/2016 21:27;2;Can you see it? After last weekend's rain, applying more dusting sulfur to protect the vines against powdery mildew . pic.twitter.com/134mflZM9I;;7.20333E+17;y;self
Jesse_N_Harding;5/3/2016 18:42;5;Pink stop 6: Mitchell co #KS slight stripe rust, powdery mildew w/some black bugs &tall stands avg 64.8 #wheattour16 pic.twitter.com/nvA9K7ti7o;#KS #wheattour16;7.27539E+17;y;self
UTPlantDoc;6/6/2016 22:14;0;@PNWNurseryIPM Just checked, all I have are aphids and spider mites on Stachys here, no powdery mildew .;;7.39913E+17;y;Others
BoisvertLyse;5/27/2016 5:07;1;#winterwheat @info_at_CLC Seeing powdery mildew & flag leaf! Thanks @JDougFehr for Acapela. Spraying tomorrow. pic.twitter.com/SdpDicON4L;#winterwheat;7.36031E+17;y;self
GardeningJoys;3/18/2016 13:55;0;Using Milk to Prevent Powdery Mildew , great for use on all ... - #garden #gardens #gardening http:// gardeningjoys.xyz/using-milk-to- prevent-powdery-mildew-great-for-use-on-all-squash-and-pumpkins-great-article-shows-you-what-to-do-and-how-it-works/ … pic.twitter.com/3Aa9LqCFKB;#garden #gardens #gardening;7.10812E+17;y;Awareness
islandVivi;4/16/2016 16:38;0;Damn this powdery mildew trying to kill my squash.. Also.. No thank you in advance for unsolicited suggestions and ideas on eradicating it.;;7.21347E+17;y;self
EurekaMag;3/7/2016 21:09;8;#EurekaMag Effects of controlled epidemics of powdery mildew on grain yield of spring barley http:// dlvr.it/KjlMnc;#EurekaMag;7.06935E+17;y;Research
FlatBud;6/25/2016 19:00;0;Powdery Mildew https:// flatbud.com/disease/powder y-mildew … #powderymildew pic.twitter.com/o19OTUKGLF;#powderymildew;7.4675E+17;y;Awareness
MarionSWCD;6/6/2016 23:50;0;how to deal with lilac powdery mildew , http:// pnwhandbooks.org/plantdisease/l ilac-syringa-spp-powdery-mildew …;;7.39938E+17;y;Awareness
SnitcoEcaterina;6/5/2016 11:39;0;#Мучнистая #роса ! #Как #бороться ! #Розы и #мучнистая #роса ! #Powdery #mildew #How to fight! #Roses and #... http:// fb.me/2VNxAdord;# # # # # # # #Powdery #mildew #How #Roses #;7.39391E+17;y;Awareness
urban_gro;6/14/2016 23:40;2;Procidic2 is labeled for #Cannabis . Prevent or eliminate powdery mildew in #commercial #grow http:// buff.ly/1Uthh0e pic.twitter.com/Pkki6crbsQ;#Cannabis #commercial #grow;7.42834E+17;y;Awareness
TXGardenerMag;4/13/2016 19:52;0;South TX: Watch vine crops for the occurrence of powdery mildew . Control with an approved fungicide or remove infected plants.;;7.20309E+17;y;Awareness
CertisUK;3/20/2016 8:25;4;There is a high risk to protected crops from powdery mildew . Make sure you identify symptoms early to limit the impact @hortweek #StayAlert;#StayAlert;7.11454E+17;y;Awareness
Susang6;3/29/2016 8:31;0;6 Ways to Prevent Powdery Mildew https:// shar.es/1YJJYh via @sharethis;;7.14701E+17;y;Awareness
APS_CLARE;5/14/2016 16:31;0;Integrated control of apple scab and powdery mildew using organic treatments http:// apsjournals.apsnet.org/doi/abs/10.109 4/PDIS-12-15-1416-RE …;;7.31492E+17;y;Research
Susang6;3/29/2016 12:07;0;2 Organic fungicides that kill Powdery Mildew , I use them in my garden, they work http:// brev.is/8DzC;;7.14756E+17;y;Awareness
dancerindc;6/26/2016 21:24;0;Despite some powdery mildew challenges, the Bee Balm is out in full force this week. Love these… https://www. instagram.com/p/BHIRumlhs96/;;7.47149E+17;y;Others
Life_Sciences_;3/7/2016 2:44;0;#EurekaMag Effects of powdery mildew disease on uptake and metabolism of nitrogen by roots of infected barley http:// dlvr.it/KjLJrd;#EurekaMag;7.06657E+17;y;Research
rnomics;5/22/2016 16:18;0;"Reprint of Sequence and phylogenetic analyses of novel totivirus-like double-stranded RNAs from field-collected powdery mildew fungi"". - P…""";;7.34388E+17;y;Research
KayvanSamavati;4/20/2016 22:58;0;I added a video to a @YouTube playlist http:// youtu.be/iTtDL0DOFmk?a How to Cure Powdery Mildew;;7.22892E+17;y;Awareness
PPT_Search;5/29/2016 6:01;0;powdery mildew anamorph Powerpoint Presentations - http://www. ppthunter.com/powdery-mildew -anamorph.htm … #powerpoint #templates #powdery #mildew #anamorph;#powerpoint #templates #powdery #mildew #anamorph;7.36769E+17;y;Others
ramana_brf;3/24/2016 0:02;0;Much lower. All the way to powdery mildew , which has bare minimum DNA to survive as a parasite. https:// twitter.com/rajreddynyc/st atus/712776185168703488 …;;7.12777E+17;y;Others
