username;date;retweets;text;hashtags;id;Agritweet;Category
GardeningLife2;6/24/2016 23:06;2;Using Milk to Prevent Powdery Mildew - #gardening #garden #diy http:// gardeninglife.xyz/using-milk-to- prevent-powdery-mildew/ … pic.twitter.com/WcLSkSlSqw;#gardening #garden #diy;7.46449E+17;y;Awareness
pptsearch365;4/14/2016 3:11;0;powdery mildew PPT Template - http://www. pptsearch365.com/powdery-mildew .html … #powdery #mildew;#powdery #mildew;7.20419E+17;y;Others
OkieMGs;6/17/2016 15:22;0;Fact sheet EPP-7617 on powdery mildew on crape myrtles and more: http:// pods.dasnr.okstate.edu/docushare/dswe … @okstate_ag;;7.43796E+17;y;Awareness
BudGardenCentre;4/2/2016 10:19;0;@BackyardLarder @papaver It is hairy... and susceptible to powdery mildew . Not the stuff of banquets!;;7.16178E+17;y;Awareness
Susang6;4/18/2016 8:22;0;6 Ways to Prevent Powdery Mildew https:// shar.es/1jy7mY via @sharethis;;7.21947E+17;y;Awareness
Susang6;5/13/2016 12:07;0;2 Organic fungicides that kill Powdery Mildew , I use them in my garden, they work http:// brev.is/8DzC;;7.31063E+17;y;Awareness
EurekaMag;3/7/2016 2:41;8;#EurekaMag Effects of powdery mildew disease on uptake and metabolism of nitrogen by roots of infected barley http:// dlvr.it/KjLGt2;#EurekaMag;7.06656E+17;y;Research
GreatGardening2;4/8/2016 19:43;0;Get Rid of Powdery Mildew on Plants - http:// greatgardening.xyz/get-rid-of-pow dery-mildew-on-plants/ … #garden #gardening #gardens pic.twitter.com/HZCfTgVAh5;#garden #gardening #gardens;7.18495E+17;y;Awareness
BrandonFKenney;5/15/2016 4:53;4;Nice read on how to use the Gubler-Thomas Powdery Mildew Index (see below) http:// bit.ly/1TbUMzq #plantpathology;#plantpathology;7.31679E+17;y;Awareness
PSILabs;3/21/2016 16:50;0;#Repost @labtech_psi ・・・ Powdery mildew , a fungus that loves the cannabis plant. Pow… http:// ift.tt/1RaB3xg pic.twitter.com/ifEdJmJPuJ;#Repost;7.11943E+17;y;Others
CHansenAg;3/28/2016 22:28;0;Found stripe rust pustules in lower leaf canopy in a plot in Osborne County Kansas. Also found powdery mildew here. pic.twitter.com/HATapwpSVf;;7.1455E+17;y;self
OkieMGs;6/17/2016 15:22;0;Powdery mildew appearing on your crape myrtle? Prevent it by planting resistant varieties, leaving space for air flow, don't over fertilize.;;7.43796E+17;y;Awareness
LiebeGroup;6/10/2016 8:19;0;@TyTekAg reports finding powdery mildew in a five leaf Bass barley crop in Wongan Hills. Read more - https://www. agric.wa.gov.au/newsletters/pe stfax/pestfax-issue-9-june-2016?page=0%2C4#smartpaging_toc_p4_s0_h2 …;#smartpaging_toc_p4_s0_h2;7.41153E+17;y;news
JubileeScape;4/19/2016 22:53;0;Last week's rainy weather made ideal conditions for plant diseases like this powdery mildew : http://www. jubileescape.com/blogs/inspecti on-report-week-of-april-11-2016/ … pic.twitter.com/nr0REOr2zO;;7.22529E+17;y;Awareness
PNWNurseryIPM;6/6/2016 20:34;0;Hi Alan. Suspect it is an early indication of the full-blown powdery mildew that plant gets. http:// oregonstate.edu/dept/nurspest/ powdery_mildew_stachys.htm … https:// twitter.com/UTPlantDoc/sta tus/739887043812134913 …;;7.39888E+17;y;self
SeaCropCA;5/7/2016 2:08;0;I liked a @YouTube video http:// youtu.be/5f8s6-ipvOc?a How to Fight Powdery Mildew in the Grow Room;;7.28738E+17;y;Awareness
ConservationTV;3/13/2016 3:35;0;Powdery mildew relief found in your kitchen pantry! http:// zkq.me/Sa4SC;;7.08844E+17;y;Awareness
FrickWinery;6/12/2016 16:20;0;Sunrise Sunday Sulfuring. An ongoing summer job. Micronized organic sulfur dust keeps powdery mildew away. http:// fb.me/6f9HTaFq2;;7.41999E+17;y;Awareness
garydyke1;5/7/2016 18:43;0;Successful day clearing weeds , love the powerstrimmer! Garden looks good. Should reduce chances of powdery mildew late summer .;;7.28989E+17;y;Others
jacquet_chris;6/17/2016 13:12;0;Synaptotagmin 1 Negatively Controls the Two Distinct Immune Secretory Pathways to Powdery Mildew Fu... | @scoopit http:// sco.lt/4pghqz;;7.43763E+17;y;Awareness
ConservationTV;5/25/2016 20:51;0;Powdery Mildew : Kitchen Cure to Stop Cucumber and Squash Loss http:// qza.me/DIZXL;;7.35544E+17;y;Awareness
thePeerJ;5/17/2016 22:00;1;Transcriptomic analysis reveals distinct #resistance to cucumber powdery #mildew https:// peerj.com/articles/1991/ pic.twitter.com/ZNb6LEG633;#resistance #mildew;7.32662E+17;y;Research
DAF_WA;6/16/2016 6:46;6;Powdery mildew reported in barley in Wongan Hills #PestFax http:// bit.ly/1txtFEb pic.twitter.com/uqQxBCCVQY;#PestFax;7.43304E+17;y;news
OkieMGs;6/14/2016 18:12;1;Fact sheet EPP-7617 on powdery mildew on crape myrtles and more: http:// pods.dasnr.okstate.edu/docushare/dswe b/Get/Document-1009/EPP-7617-2014.pdf … @okstate_ag;;7.42752E+17;y;Awareness
LittleRedAussie;5/25/2016 3:43;0;@LittleRedAussie thats called powdery mildew , most common in vine plants and we are apparently paying 4$ A POUND for moldy grapes. Wow. :);;7.35285E+17;y;Others
thingsgreen;3/15/2016 1:14;0;Easy Steps to Controlling Powdery Mildew on Roses If roses are the language of love and you can't even... http:// fb.me/4XDXD1koK;;7.09533E+17;y;Awareness
EmiruwithIoT;6/12/2016 15:14;0;"Update my blog.  Snap garden peas has powdery mildew ."" http:// emiru.sakura.ne.jp/blog/06122016 #gadenpeas #gardening pic.twitter.com/dqWlbeJEzz""";#gadenpeas #gardening;7.41982E+17;y;Awareness
ipmmooc;3/4/2016 14:36;0;patoliyabv:DUE TO HIGH LEVEL OF POWDERY MILDEW IN GRAPES;;7.05749E+17;y;Awareness
SurvivorMed;4/23/2016 19:53;1;Powdery Mildew Treatment: How To Kill Powdery Mildew Fast http:// snip.ly/y6wuj #survival #preppers #prepping #shtf;#survival #preppers #prepping #shtf;7.23933E+17;y;Awareness
CEVokins;5/25/2016 6:39;1;Roseclear for powdery mildew on vines? Client insisting. I'm not keen. Thoughts please twitter....;;7.35329E+17;y;Others
PestGeekPodcast;5/20/2016 22:16;0;Powdery mildew on watermelon found in South Carolina - Dr. Anthony Keinath, Vegetable Pathologist at Clemson Un... http:// ow.ly/CBIt500vqIV;;7.33753E+17;y;news
jaykyalo;3/2/2016 10:49;0;M-Farm · Powdery Mildew in Capsicums http:// disq.us/9aewv5;;7.04967E+17;y;Awareness
kommerell;4/4/2016 10:18;0;Wheat with Improved Powdery Mildew Resistance (University of Zurich) - socialmedia_absender | @scoopit http:// sco.lt/4iDUZN;;7.16903E+17;y;Awareness
usagardencare;6/22/2016 1:48;0;Green Cleaner, 128 Ounce (Gallon) - Spider Mite Killer & Powdery Mildew Fungicide http:// landmatus.com/shop/patio-law n-and-garden/green-cleaner-128-ounce-gallon-spider-mite-killer-powdery-mildew-fungicide/?utm_source=ReviveOldPost&utm_medium=social&utm_campaign=ReviveOldPost … #patiolawnandgarden;#patiolawnandgarden;7.45403E+17;y;Awareness
TomWhitfield10;5/23/2016 17:52;4;Easily finding powdery mildew in wheat crops this year, variety is crusoe for bread making. T2 morpholine will help. pic.twitter.com/MlKlmUsKQy;;7.34774E+17;y;self
Susang6;3/30/2016 2:45;0;5 ways to prevent powdery mildew @yard and garden secrets blog http:// pinterest.com/pin/4645745177 92350729/ …;;7.14977E+17;y;Awareness
Isaela_V;5/24/2016 19:03;1;Spraying Thrichiderma for #powdery mildew control pic.twitter.com/oYbDtadStc;#powdery;7.35154E+17;y;self
JetPenny;6/21/2016 12:25;0;#MustWeed Powdery Mildew Can Destroy Your Plants & Make You Sick http:// Fortune420.com pic.twitter.com/nGL2foE182;#MustWeed;7.45201E+17;y;Awareness
klsywd;6/26/2016 22:27;0;@klsywd microscopy actually revealed it to be powdery mildew , which is a similar looking but unrelated fungus! Oops :P;;7.47165E+17;y;self
FlatBud;6/23/2016 19:00;0;Powdery Mildew https:// flatbud.com/disease/powder y-mildew … #powderymildew pic.twitter.com/SrfWG4Doxa;#powderymildew;7.46025E+17;y;Awareness
inworldofwords;5/24/2016 21:06;0;" Powdery mildew will suck the life out of your plant"", ahí dicho sin rencor ni nada eh.""";;7.35185E+17;y;Others
UNL_CropWatch;4/22/2016 20:49;3;Powdery mildew , stripe rust among #wheat diseases noted in CW this week. http:// bit.ly/1U8XCEk @NebraskaWheat pic.twitter.com/x1b3FT89QV;#wheat;7.23585E+17;y;Awareness
GardenEffect;5/21/2016 0:58;0;After you've been fighting with powdery mildew TOO long isn't it time you try a sulfur vaporizer? #indoorgardening pic.twitter.com/cVCcLg7yGv;#indoorgardening;7.33794E+17;y;Awareness
giroudtree;6/29/2016 16:01;0;Powdery mildew is a common disease on many types of plants like Crepe Myrtles, Dogwoods and other ornamental trees. pic.twitter.com/TQYjm1Yslo;;7.48154E+17;y;Awareness
drkhaledarafat;5/3/2016 14:22;0;Application of Statistical Model for Forecasting Powdery Mildew of Grapes under Egyptian Conditions Based on Meteor http:// goo.gl/mTGMak;;7.27473E+17;y;Research
Innspub1;3/14/2016 14:12;0;Resistance To Powdery Mildew And Cercospora Leaf Spot Of Multigerm Dihaploid http://www. innspub.net/ijaar/resistan ce-to-powdery-mildew-and-cercospora-leaf-spot-of-multigerm-dihaploid-sugar-beet-lines-and-its-inheritance-in-their-hybrids/ … #deliciousTrending via @delicious;#deliciousTrending;7.09367E+17;y;Research
Hort_Consultant;4/4/2016 22:57;1;Another great article from HortiDaily. This one is regarding #UV light as a treatment for powdery mildew .... http:// fb.me/7Qv1SPzaC;#UV;7.17094E+17;y;Awareness
CameronHild;6/7/2016 0:07;1;Time to load shed with @Bayer4CropsCA Prosaro for #Winterwheat #scout16 fhb, tan spot, powdery mildew ! @DougWahl pic.twitter.com/cVsiM5T0cu;#Winterwheat #scout16;7.39942E+17;y;Others
viviannastevens;6/25/2016 22:47;0;Peony powdery mildew ? http:// ift.tt/28VuHkW #Gardening;#Gardening;7.46807E+17;y;Others
QueenKika;6/13/2016 20:00;0;My allotment veggies are doing fantastic, except my beans which immediately developed powdery mildew . Was told about milk spray, will report;;7.42416E+17;y;self
AGFoodSS;4/15/2016 20:25;0;The Problem With Powdery Mildew In Pumpkin http:// drg.io/1QclNe5;;7.21042E+17;y;Awareness
SurvivorMed;5/24/2016 12:55;3;Powdery Mildew Treatment: How To Kill Powdery Mildew Fast http:// snip.ly/y6wuj #survival #preppers #prepping #shtf;#survival #preppers #prepping #shtf;7.35062E+17;y;Awareness
MandyCanUDigIt;3/26/2016 19:26;0;Powdery mildew already on Euphorbia polychroma - v. dry here. How to tackle it. #gardening http:// bit.ly/1PxLBGO pic.twitter.com/eUeJoVkB5h;#gardening;7.13794E+17;y;Awareness
WoollyGreen;6/14/2016 11:25;0;Guard against powdery mildew – choose resistant varieties where possible, here's a bit more info http:// ow.ly/xhjj300Tcjz;;7.42649E+17;y;Awareness
kraftymax;5/19/2016 2:36;0;Rose tips #2 - Avoiding Powdery Mildew ! http:// goo.gl/0xnJPB via @jbgreenthumb;#2;7.33094E+17;y;Awareness
peuforte;3/26/2016 15:10;0;nic Control of Black Spot/ Powdery Mildew , Aphids, and Caterpillars - http:// goo.gl/I7ofdE via @NCoastGardening;;7.1373E+17;y;Awareness
rnomics;5/23/2016 19:03;0;"Reprint of Sequence and phylogenetic analyses of novel totivirus-like double-stranded RNAs from field-collected powdery mildew fungi"". - P…""";;7.34792E+17;y;Research
DonnersDirt;4/29/2016 21:53;5;13.5oz Caramba Feekes 10.5.1 Head Scab Application in wheat. If Stripe Rust & Powdery Mildew present use up to 17oz pic.twitter.com/ZWDUIOsEac;;7.26137E+17;y;Others
deltagardener;5/28/2016 17:42;0;is writing about cabbage loopers, powdery mildew and early blight. Yes, it looks like all 3 are happening in the lower mainland.;;7.36583E+17;y;self
hortidaily;4/4/2016 23:00;2;US: UV light effective treatment against powdery mildew @Hort_Consultant http://www. hortidaily.com/article/25303/ US-UV-light-effective-treatment-against-powdery-mildew … pic.twitter.com/iMEhMmf1Ty;;7.17094E+17;y;Awareness
FlatBud;5/4/2016 19:00;0;Powdery Mildew https:// flatbud.com/disease/powder y-mildew … #powderymildew pic.twitter.com/ZBg8OfUSdA;#powderymildew;7.27906E+17;y;Awareness
AR_Resistance;6/13/2016 20:18;0;@JeffGohogs tried all kinds of natural remedies for the bad insects and powdery mildew . Remembered DE for the but it was a bit late...;;7.42421E+17;y;self
WaterlooCrop;5/25/2016 16:52;2;Seeing some powdery mildew in dense wheat areas near elora #fromthefield #ontag #scout16 pic.twitter.com/pewE3zjE5r;#fromthefield #ontag #scout16;7.35484E+17;y;self
AiroClean420;6/16/2016 21:37;0;A multi-faceted prevention plan is crucial to prevent powdery mildew on cannabis plants. http:// buff.ly/25IWsGH;;7.43528E+17;y;Awareness
pptsearch365;4/14/2016 3:12;0;powdery mildew anamorph Powerpoint Templates - http://www. pptsearch365.com/powdery-mildew -anamorph.html … #powdery #mildew #anamorph;#powdery #mildew #anamorph;7.20419E+17;y;Others
viviannastevens;6/14/2016 0:43;0;Is this powdery mildew on my squash plant? http:// ift.tt/1Yoi9GG #Gardening;#Gardening;7.42488E+17;y;Others
gregroth1;4/20/2016 13:54;2;Powdery mildew on barley...most lines have none but this malting variety Maja has a lot. Variety selection matters. pic.twitter.com/boywp0jaQU;;7.22755E+17;y;self
xDOWNSOUTHx;5/8/2016 0:55;0;@JorgeCervantes Luckily I haven't ran into powdery mildew issues. But reading up on it makes for good understanding of diagnosis and treatme;;7.29082E+17;y;Others
BloomingSecrets;3/31/2016 20:00;4;Garden Checklist: Spring has flowers – and powdery mildew http:// sacb.ee/5MnQ pic.twitter.com/usewE2Bc0b;;7.156E+17;y;Awareness
wheat_papers;6/28/2016 16:06;0;PAMP-triggered immune responses in barley and susceptibility to powdery mildew . http:// dlvr.it/LgWSjL pic.twitter.com/sPxhJzlBzj;;7.47793E+17;y;Research
GlobalMilling;4/4/2016 11:44;1;Powdery Mildew Resistant Wheat Cultivar Introduced by Calyxt, Inc. - Small Grains | @scoopit via @kommerell http:// sco.lt/6zegE5;;7.16924E+17;y;Awareness
wheat_papers;4/7/2016 3:13;0;Silicon-mediated resistance of Arabidopsis against powdery mildew involves mechanisms other… http:// dlvr.it/L01tJ2 pic.twitter.com/HIc7Po47S6;;7.17883E+17;y;Research
MandyCanUDigIt;4/3/2016 21:16;0;Unbelieveable! Powdery mildew already - here's how to deal with it. #gardening http:// bit.ly/1PxLBGO pic.twitter.com/9wnLLRkauV;#gardening;7.16706E+17;y;Awareness
sshahn1;3/19/2016 2:38;0;To prevent powdery mildew you need to spray before leaves form with wettable sulphur. @Tracy_Vo @720perth;;7.11004E+17;y;Awareness
GreenFlyFlowers;4/11/2016 23:41;1;@ICCWS2016 @Hambledonwine @littlebedwyn @Alchemyxbubbles @hattingleywines @englishwine Powdery Mildew !!!!;;7.19642E+17;n;
loujnicholls;5/18/2016 6:38;0;@pollymm @BensBotanics even milk if used to treat powdery mildew needs it as used in that capacity is a chemical;;7.32793E+17;y;Others
GRDCNorth;6/21/2016 2:15;1;Sue Thompson @USQNews at #Toowoomba #GRDCUpdates on fungicide management of powdery mildew in #mungbeans . http:// bit.ly/1t2DlGm @theGRDC;#Toowoomba #GRDCUpdates #mungbeans;7.45047E+17;y;Awareness
powderymildews;4/14/2016 21:05;0;"Powdery Mildew Satellite mtg on Saturday (7/16); ISMPMI advance registration deadline 4/20 @ISMPMI";;7.2069E+17;y;Ad
K2412Na;4/3/2016 15:35;0;Nicole Reed ,Nitro Fusion ,No Fungus ,No Powdery Mildew ,No Spider Mites ,Nonnis Food Co ,Norse Dairy Systems… … http://allmer chants-allproducts.knowallforlife.com/nicole-reed-ni tro-fusion-no-fungus-no-powdery-mildew-no-spider-mites-nonnis-food-co-norse-dairy-systems-north-american-foods-north-american-hemp-company-north-american-herb-and-spice/ …;;7.1662E+17;y;Others
EurekaMag;5/18/2016 5:10;0;#EurekaMag A partial diallel study of powdery mildew resistance in six apple cultivars under three growing… http:// dlvr.it/LL6Rdv;#EurekaMag;7.3277E+17;y;Research
KrobLandscape;5/25/2016 2:45;0;#TipTuesday : Want to Get Rid of Powdery Mildew ? Here's a great organic spray made from items in your kitchen: http:// ow.ly/LF7k300j06I;#TipTuesday;7.3527E+17;y;Awareness
EurekaMag;4/16/2016 7:27;0;#EurekaMag Trehalose induces resistance to powdery mildew in wheat http:// dlvr.it/L4BkqP;#EurekaMag;7.21208E+17;y;Research
Gilesy256;6/28/2016 19:31;4;Mature powdery mildew on LG Cassidy in Cotswolds. Showing the black dots (Cleistothecia) inside the mildew colonies. pic.twitter.com/A4Bx7JR1JU;;7.47845E+17;y;self
grapepathology;6/29/2016 1:00;3;Another reminder on seasonal diseases: Photo: we have started to see powdery mildew on clusters. I hope you a... http:// bit.ly/29mjc5p;;7.47928E+17;y;Awareness
Jenny_alv1;4/28/2016 18:16;0;I liked a @YouTube video from @latebloomershow http:// youtu.be/ZxYABzrpm58?a Garden Control: Hairy Vetch, Powdery Mildew - Late Bloomer -;;7.2572E+17;y;Awareness
Life_Sciences_;3/6/2016 23:07;0;#EurekaMag Effects of soil water level on the development of adult plant resistance to powdery mildew in barley http:// dlvr.it/KjH192;#EurekaMag;7.06602E+17;y;Research
JimAnder1979;5/23/2016 2:15;0;2nd app. of Aprovia and 1/2 EBDC going on for #apple scab #powdery mildew. Good #bee activity after. @syngentacanada pic.twitter.com/RR8dulW6sa;#apple #powdery #bee;7.34538E+17;y;self
CCH_USQ;6/21/2016 2:24;0;#Mungbean powdery mildew cooler humid conditions favour the disease https:// twitter.com/Allawishus/sta tus/745047646482554880 …;#Mungbean;7.4505E+17;y;Awareness
gartenatelier;3/24/2016 5:41;0;Bakink powder against powdery mildew - the Eu allows alternative methods. Quelle: Naturimgarten.at http:// fb.me/7OJJXlvgK;;7.12862E+17;y;Awareness
PNWNurseryIPM;5/3/2016 23:59;1;Spotted: powdery mildew on Cotinus or smokebush. Time to monitor for powdery mildew . http:// oregonstate.edu/dept/nurspest/ powdery_mildew_cotinus.htm … pic.twitter.com/tIw03I4mNO;;7.27619E+17;y;Awareness
johnefrancis;6/8/2016 9:28;0;@psyoureanidiot you're developing powdery mildew . Spray leaves with dilute milk.;;7.40445E+17;y;self
WAindoor;6/21/2016 21:57;0;#86mitesandmold with #norcalnutrients 4 essential oils. All natural. Eliminates powdery mildew … https://www. instagram.com/p/BG7dfRQPSIg/;#86mitesandmold #norcalnutrients;7.45345E+17;y;Awareness
MyGardenTeam;6/11/2016 11:53;0;Powdery Mildew http://www. gardenadvice.co.uk/advisor/garden ing-tips/powdery-mildew/ …;;7.41569E+17;y;Awareness
theGRDC;4/14/2016 10:52;2;@DAF_WA pathologists on changes in virulence of powdery mildew pathogen in barley & mgmt options in 2016: http:// bit.ly/23wbHSi @CCDMnews;;7.20535E+17;y;Awareness
FlatBud;5/20/2016 19:00;0;Powdery Mildew https:// flatbud.com/disease/powder y-mildew … #powderymildew pic.twitter.com/AaCmTDJk5f;#powderymildew;7.33704E+17;y;Awareness
Vinsdeparisien;6/5/2016 23:45;0;OidiumCommon fungal disease also known as powdery mildew which attacks vine leaves, shoots and tendrils. After flowering the berries...;;7.39574E+17;y;Awareness
jessepstein;4/10/2016 18:10;0;Just sprayed my peonies w lime-sulfur to cut down powdery mildew . Good to do every few weeks tho I often forget. Give air too. #gardenchat;#gardenchat;7.19196E+17;y;self
SJVGrapes;5/21/2016 6:25;10;When #grapevine powdery mildew isn't killing berries, individual cells R killed, berries split & 2° pathogens attack pic.twitter.com/8LRLupvJjU;#grapevine;7.33876E+17;y;self
OSU_smallgrains;3/24/2016 3:34;2;@OkiefarmerBrent that is powdery mildew . I would wait and see;;7.1283E+17;y;self
Nicole_WardUK;4/14/2016 14:00;0;This week, we're preparing a #hemp powdery mildew susceptibility trial. Eighteen fiber, grain, and oil varieties... http:// fb.me/3jhEfaXZ2;#hemp;7.20582E+17;y;Others
LateBloomerShow;4/13/2016 20:08;0;Watch me get the hairy vetch cover crop and powdery mildew under control! Please share! http:// youtu.be/ZxYABzrpm58?a;;7.20313E+17;y;Awareness
baileybrissett;4/29/2016 0:11;0;Does me cleaning the powdery mildew off of my rosemary plant turn you on;;7.2581E+17;y;Others
LandscapingToda;3/23/2016 11:36;0;Milk, A Garden Miracle Against Powdery Mildew - http:// landscapingtoday.xyz/milk-a-garden- miracle-against-powdery-mildew/ … #landscaping #gardening #garden #gardens pic.twitter.com/ot0jSqr011;#landscaping #gardening #garden #gardens;7.12589E+17;y;Awareness
AiroClean420;3/8/2016 22:30;0;Many marijuana growers wonder whether it is possible to destroy powdery mildew on infused products. http:// buff.ly/1OYV981;;7.07318E+17;y;Awareness
OTCStockPicks1;6/21/2016 12:33;0;#MustWeed Powdery Mildew Can Destroy Your Plants & Make You Sick http:// dlvr.it/LcXzKn http:// Fortune420.com pic.twitter.com/uF6JKsUycL;#MustWeed;7.45203E+17;y;Awareness
CannabisIndy;6/12/2016 7:18;0;Help! White powdery mildew spots on various leaves of plants in grow tent. End of Week 8 - should we cut and harve… http:// ift.tt/21fzfFt;;7.41862E+17;y;self
DuncanBanner;4/25/2016 15:03;0;Column: Look out for powdery mildew or herbicide damage http:// fb.me/svR1hXcq;;7.24585E+17;y;Awareness
regwag2003;5/16/2016 0:38;0;@heathercorinna They are cute. Black with yellow stripes. They also eat&spread powdery mildew to cucumbers & other squash. Killed my melons!;;7.31977E+17;y;Others
FlatBud;3/1/2016 19:00;0;Powdery Mildew https:// flatbud.com/disease/powder y-mildew … #powderymildew pic.twitter.com/WqrbkooY3r;#powderymildew;7.04728E+17;y;Awareness
Farmanco;6/24/2016 11:50;16;Disease Alert: Our agronomists found powdery mildew on Calingiri wheat at Bindi Bindi yesterday;;7.46279E+17;y;news
DuarteAssociate;6/5/2016 1:00;0;Clusters with powdery mildew #grapes #productdevelopment #vine pic.twitter.com/npwpZrHoIx;#grapes #productdevelopment #vine;7.3923E+17;y;self
surnainc;3/11/2016 21:54;0;What's the easiest way to prevent mold and powdery mildew in your garden? Humidity Control: http:// buff.ly/1M4Kh8L pic.twitter.com/oHiK1esNDS;;7.08396E+17;y;Awareness
funnythat;5/29/2016 17:29;0;Garden planted! Maybe 1 of the 59000 zucchini plants won't get powdery mildew this year.;;7.36943E+17;y;self
pptsearch365;5/28/2016 1:48;0;powdery mildew PPT Slide - http://www. pptsearch365.com/powdery-mildew .html … #powerpoint #slide #powdery #mildew;#powerpoint #slide #powdery #mildew;7.36343E+17;y;Others
sherylphar;5/22/2016 19:50;0;Aspirin is the remedy for fungal plant problems, Black spot, powdery mildew , and rust are a terrible http:// pinterest.com/pin/3354478722 28184275/ …;;7.34441E+17;y;Awareness
skillforsurvivl;6/19/2016 13:10;0;Tropical Gardening Helpline: Powdery mildew is unattractive, but not usually fatal http:// bit.ly/1YAmkiG http:// bit.ly/1JX8ifV;;7.44488E+17;y;Awareness
garden_answers;3/31/2016 7:07;0;New blog post from http:// GardenAnswers.com about Powdery Mildew - http://www. gardenanswers.com/plant-diseases /powdery-mildew-5/ … pic.twitter.com/AjfYP1aEiV;;7.15405E+17;y;Awareness
GreenFlyFlowers;5/3/2016 21:57;0;@richardnyo @HampshireVines Got any tips for powdery mildew ?;;7.27588E+17;y;Others
SynWheat_Jen;3/24/2016 18:13;0;@OkiefarmerBrent @OSU_smallgrains looks like powdery mildew to me.;;7.13051E+17;y;self
wheatgen_papers;5/21/2016 12:08;0;Characterization of a New Pm2 Allele Conferring Powdery Mildew Resistance in the Wheat… http:// dlvr.it/LMZRzb pic.twitter.com/TvMqW6ifa2;;7.33963E+17;y;Research
dromius;4/5/2016 17:18;0;#SLS16 Wildermuth -controlled powdery mildew infection: conidia of same age on exactly 4.5 week old Arabidopsis leaves #infectionprecision;#SLS16 #infectionprecision;7.17371E+17;y;self
104homestead;5/12/2016 1:04;4;Has powdery mildew plagued your pumpkins? Learn how to deal with it naturally. #gardenlove http:// bit.ly/1TQnwuB pic.twitter.com/4YHbq9zLZG;#gardenlove;7.30534E+17;y;Awareness
insectimmpapers;5/6/2016 12:20;0;Molecular Cytogenetic Identification of a New Wheat-Rye 6R Chromosome Disomic Addition Line with Powdery Mildew … http:// dlvr.it/LF9RRY;;7.2853E+17;y;Research
keeleslc_sb;6/3/2016 11:33;0;A powdery mildew practical and citizen science opportunity from @SAPS_News http:// bit.ly/1t5Ln1j;;7.38665E+17;y;Others
MatthewMoscou;6/28/2016 17:31;0;#IBGS2016 Schweizer: Large scale analysis of the barley transcriptome in response to barley powdery mildew versus wheat powdery mildew;#IBGS2016;7.47815E+17;y;Research
HERBworthy;6/24/2016 16:00;4;Powdery Mildew Can #Destroy Your Plants & Make You #Sick - http:// buff.ly/28UvDab pic.twitter.com/tHixCKKAaZ;#Destroy #Sick;7.46342E+17;y;Awareness
VanWebFest;5/5/2016 21:43;0;I liked a @YouTube video from @latebloomershow http:// youtu.be/ZxYABzrpm58?a Garden Control: Hairy Vetch, Powdery Mildew - Late Bloomer -;;7.28309E+17;y;Awareness
pjderoc;6/4/2016 21:02;0;Anything to add @PratisaraB ? Powdery mildew in winter wheat. Lower canopy, crop @flag leaf & planned T3 fungicide. https:// twitter.com/CameronHild/st atus/739149565203349504 …;;7.39171E+17;y;self
UNLScottEvans;3/16/2016 16:25;1;Small patches of powdery mildew are showing up. Roller coaster weather is to blame. http:// goo.gl/cZzhAl #NebExt pic.twitter.com/TlcNirpogT;#NebExt;7.10125E+17;y;news
Ilove_marijuana;3/9/2016 23:11;2;Stop Powdery Mildew On Marijuana Plants Now! http:// buff.ly/1ORocQh pic.twitter.com/AV9xLNxnfP;;7.0769E+17;y;Awareness
AusCropDiseases;6/10/2016 8:59;0;WA: Powdery mildew impact on wheat yields and research into management strategies. http:// bit.ly/1XdnlNH @theGRDC @theCCDM;;7.41163E+17;y;Research
drtreefruit;6/2/2016 15:25;4;I received a present this morning: Rusty spot ( powdery mildew ) on immature Loring peaches #plantdiseaseweather pic.twitter.com/WnHXq8cO2p;#plantdiseaseweather;7.38361E+17;y;self
OkieMGs;6/14/2016 18:08;1;Trim away shoots, suckers, and small crape myrtle branches infected with powdery mildew , dispose of properly. Trim plant to allow air flow.;;7.42751E+17;y;Awareness
otanezm;5/31/2016 14:20;1;Powdery mildew and mold in Colorado's cannabis cultivation sector? @UFCW #cannabis @news4anthros @SocMedAnthro pic.twitter.com/IxmqAk11o8;#cannabis;7.3762E+17;y;news
duncanmvm;6/11/2016 22:25;0;@eViticulture @MSUExtension it is primary powdery mildew . See it in UK all the time.;;7.41728E+17;y;self
DIVINEMAKEOVER;4/28/2016 8:27;0;How to Get Rid of Powdery Mildew on Rose Bushes http:// homeguides.sfgate.com/rid-powdery-mi ldew-rose-bushes-31948.html …;;7.25572E+17;y;Awareness
Hutchinsons_SF;6/8/2016 11:32;2;Powdery mildew now becoming a serious issue in #strawberries Keep up a weekly spray programme to keep on top of it pic.twitter.com/ulUBiUV8dL;#strawberries;7.40476E+17;y;Awareness
