username;date;retweets;text;hashtags;id;Agritweet;Category
GlobalMilling;4/4/2016 11:43;0;Wheat with Improved Powdery Mildew Resistance (University of Zurich) - socialmedia_a... | @scoopit via @kommerell http:// sco.lt/8MWk7N;;7.16924E+17;y;Awareness
blanca_mar2004;3/6/2016 20:32;0;Growing Zucchini . Remedy for powdery mildew - got it on my squash, pumpkin and zucchini plants this http:// pinterest.com/pin/3436106465 50915729/ …;;7.06563E+17;y;Awareness
APS_CLARE;3/15/2016 7:01;3;Interaction of Basal Foliage Removal and Late-Season Fungicide Applications in Management of Hop Powdery Mildew http:// apsjournals.apsnet.org/doi/abs/10.109 4/PDIS-10-15-1232-RE …;;7.0962E+17;y;Research
VoiceofJonathan;4/25/2016 22:25;0;I come home after 5 days to find the rosebush in bloom! The fight against powdery mildew … https://www. instagram.com/p/BEovZYKie0k/;;7.24696E+17;y;Others
Matt_Ben_;4/5/2016 17:21;1;#SLS16 M. Wildermuth: powdery mildew infection promotes endoreplication in mesophyll cells - up to 32C at the site of infection;#SLS16;7.17372E+17;y;Awareness
ewlarson546;5/27/2016 16:21;0;ROSE SPRAY-helps prevent diseases such as rust, blackspot, and powdery mildew . Mix together: • http:// pinterest.com/pin/3460031838 53576362/ …;;7.36201E+17;y;Awareness
KeywanHP;6/20/2016 22:25;0;@genetics_blog It could be the powdery mildew fungus. Others @Rothamsted might know better. You can also take a sample and sequence it. :);;7.4499E+17;y;Others
RobertOConnor1;3/19/2016 1:25;0;Oli's powdery mildew survey is running again this year. Please can you help him build up a clearer picture of the... http:// fb.me/7Jvy8YbtR;;7.10986E+17;y;Others
SJVGrapes;4/15/2016 23:23;3;Already shoot thinning #wine #grapes Getting ready for warmer weather #grapevine powdery mildew management. #IPM pic.twitter.com/ZyDMOGrpry;#wine #grapes #grapevine #IPM;7.21087E+17;y;Awareness
BDCOCPA;3/10/2016 17:44;0;"We teach measurements for wineries but who knew they measured evapotranspiration, growing degree-days, powdery mildew pressure""? #STEM""";#STEM;7.0797E+17;y;Others
McKinneyTimes;6/25/2016 10:56;0;Sperry: Powdery mildew on crape myrtles will soon disappear - Times Record News http:// dlvr.it/LfFMgT pic.twitter.com/PvsSoOF7oa;;7.46628E+17;y;Awareness
lovelifeinc;5/8/2016 0:13;0;Ink spots. This rose struggled last year with black spot, rust and powdery mildew . I made some… https://www. instagram.com/p/BFH1R_jRPDa/;;7.29072E+17;y;Others
RegressedPDO;6/20/2016 23:51;0;@taranaki66 if they aren't in danger of dying from powdery mildew , that's probably a good plan;;7.45011E+17;y;Others
theGRDC;4/4/2016 7:01;7;Timing of fungicide application for powdery mildew control more important than product choice: http:// bit.ly/1RWkrMa @CCDMnews @DAF_WA;;7.16853E+17;y;Awareness
hiasilrdne;3/8/2016 22:48;0;#EurekaMag Effect of powdery mildew infection of sugar beet on the content of electron carriers in chloroplasts http:// dlvr.it/KkJWwy;#EurekaMag;7.07322E+17;y;Research
wheat_papers;4/19/2016 20:33;0;Cytological and molecular analysis of nonhost resistance in rice to wheat powdery mildew … http:// dlvr.it/L5hsHw pic.twitter.com/xEGBdmhyRt;;7.22493E+17;y;Research
idiggreenacres;3/3/2016 5:24;0;@sriram20 Try with water. You might need a fungicide. Here's a link with more info about powdery mildew : http://www. ipm.ucdavis.edu/PMG/PESTNOTES/ pn7493.html …;;7.05248E+17;y;Awareness
unfurlingnet;6/11/2016 21:00;0;@Joon123 Powdery mildew ? Have they been very dry recently?;;7.41707E+17;y;Others
HuskerHort;5/23/2016 20:02;2;Plants looking a little grayish-white? Powdery mildew could be to blame. Read #NebExt HortUpdate for more: http:// hortupdate.unl.edu/update05162016;#NebExt;7.34807E+17;y;Awareness
Elaine_Schilhab;4/29/2016 3:51;0;@growingnorth A8 Got alpine strawberry seedlings. Have them indoors under lights. Looks like they got powdery mildew . Advice? #GrowingNorth;#GrowingNorth;7.25865E+17;y;self
hiasilrdne;3/7/2016 2:44;0;#EurekaMag Effects of powdery mildew disease on uptake and metabolism of nitrogen by roots of infected barley http:// dlvr.it/KjLJb7;#EurekaMag;7.06657E+17;y;Research
nugshots;6/27/2016 20:55;0;Powdery Mildew (PM) up close. This isn't even a bad section of the infestation on this… https://www. instagram.com/p/BHKzMpzD9qq/;;7.47504E+17;y;self
msfabfinds;4/22/2016 9:51;0;I liked a @YouTube video from @latebloomershow http:// youtu.be/ZxYABzrpm58?a Garden Control: Hairy Vetch, Powdery Mildew - Late Bloomer -;;7.23419E+17;y;Awareness
BotanicalSeeds;6/10/2016 0:04;0;@MysticPhoeniix yes, it is resistant to powdery mildew but they can get downy mildew in cool and wet conditions.;;7.41028E+17;y;Others
GardeningGlitz;3/28/2016 17:39;0;Growing Zucchini . Remedy for powdery mildew - got it on ... - http:// gardeningglitz.xyz/growing-zucchi ni-remedy-for-powdery-mildew-got-it-on-my-squash-pumpkin-and-zucchini-plants-this-year-1t-baking-soda-12-t-liquid-soap-and-1-gal-water-spray-weekly-preferably-in-am-but-not-wh/ … #garden #gardens #gardening pic.twitter.com/7Fpg7Wpvwe;#garden #gardens #gardening;7.14477E+17;y;Awareness
wheat_papers;4/7/2016 0:32;0;"Natural selection causes adaptive genetic resistance in wild emmer wheat against powdery mildew at Evolution… http:// dlvr.it/KzzRsb""";;7.17843E+17;y;Research
drtreefruit;6/22/2016 23:36;2;Interesting sighting in the orchard: Apple powdery mildew (on the shoots--Rome Beauty cultivar) #plantdisease pic.twitter.com/o2FvuIR5A8;#plantdisease;7.45732E+17;y;self
Jason_Mefford;3/1/2016 14:55;1;Powdery mildew found at Norborne, MO #croptrak pic.twitter.com/9LDxBygrOl;#croptrak;7.04666E+17;y;self
hiasilrdne;3/11/2016 8:52;0;#Scien Susceptibility of five faba bean cultivars to powdery mildew disease in western Canada http:// dlvr.it/KlbDw4;#Scien;7.08199E+17;y;Awareness
PanosSarris;4/7/2016 1:58;0;Resistance responses to powdery mildew in wheat. http://www. nature.com/articles/srep2 3805 … pic.twitter.com/irtxZkRzoc;;7.17864E+17;y;Research
hawarden_hrw;4/28/2016 5:04;0;@farminHD looking pretty good so far. Yea I've been hearing of that in the county. We battled powdery mildew early. Great moisture!!!;;7.25521E+17;y;Others
MysticPhoeniix;6/7/2016 16:13;0;beautiful! is strawflower resistant to pests, powdery mildew , etc? https:// twitter.com/BotanicalSeeds /status/740179268026667008 …;;7.40185E+17;y;Others
DesignGreen_ind;3/28/2016 14:25;0;Control powdery mildew infection on plants with diluted milk spray. http:// ow.ly/ZIMtm pic.twitter.com/Spr7e7wLcr;;7.14428E+17;y;Awareness
spanky6973;6/15/2016 7:16;0;6 Ways to Cure Powdery Mildew on Cannabis Organically - Mold Resistant Strains http:// fb.me/4zLA1TWIm;;7.42949E+17;y;Awareness
CLAYCORD;5/23/2016 7:13;1;Column: The Garden Girl – Rust, Blackspot and Powdery Mildew on Ornamental Shrubs http:// tinyurl.com/glm5cnx;;7.34613E+17;y;Awareness
FRGcurtin;5/12/2016 9:26;0;Wheat powdery mildew hit the West big time in 2015. If you want to send a sample in 2016, sampling instructions here http:// ccdm.com.au/wp-content/upl oads/2016/05/Single_-Mildew_Sampling.pdf …;;7.3066E+17;y;Awareness
par_papers;4/5/2016 18:34;0;Powdery mildew suppresses herbivore-induced plant volatiles and interferes with parasitoid attraction in Brassica… http:// dlvr.it/KzPBTn;;7.1739E+17;y;Research
wheatgen_papers;6/4/2016 12:31;0;Hybridization of powdery mildew strains gives rise to pathogens on novel agricultural crop species. http:// dlvr.it/LTT7Vh;;7.39042E+17;y;Research
Jonah_Agronomy;4/5/2016 17:45;1;Early foliar #wheat_diseases (i.e. powdery mildew , rust, septoria & stagonospora) may warrant early fungicide app. http:// agcrops.osu.edu/newsletter/cor n-newsletter/mild-winter-pathogen-survival-and-early-disease-development …;#wheat_diseases;7.17378E+17;y;Awareness
Bayer4CropsUS;3/31/2016 0:30;2;Are you managing crop diseases properly? Check out these valuable tools for fighting powdery mildew : http:// bit.ly/1MbRC6x #AgTips;#AgTips;7.15305E+17;y;Awareness
SecretsGreen;6/24/2016 20:03;0;Prevent powdery mildew with this spray: 1 gallon of ... - #garden #diy #gardens #gardening http:// greensecrets.xyz/prevent-powder y-mildew-with-this-spray-1-gallon-of-water-1-tablespoon-of-baking-soda-1-tablespoon-of-vegetable-oil-1-tablespoon-of-dishwashing-liquid-mix-the-ingredients-together-and-add-them-to-a-sp/ … pic.twitter.com/PJS8frq5Hz;#garden #diy #gardens #gardening;7.46403E+17;y;Awareness
FlatBud;5/21/2016 10:00;0;Did you know? Control powdery mildew with milk. Dilute 1 part milk in 9 parts water and spray on the plants.;;7.3393E+17;y;Awareness
5SAshevilleMkt;5/17/2016 15:50;0;April showers bring powdery mildew ? Unfortunately, yes. With all of the rain we've been having, we're going to... http:// fb.me/7ZhgiK43J;;7.32569E+17;y;self
ticaffi;5/3/2016 7:50;0;Efficacy of Biopesticides and Leaf Removal in Grapevine Powdery Mildew Management by #PMN http:// bit.ly/1SDrqEL;#PMN;7.27375E+17;y;Research
KMAS_7P;6/15/2016 21:08;2;Powdery Mildew in irrigated spring wheat #plant16 @aggrad96 @JennyRaeEllert pic.twitter.com/avXtEsp7Mj;#plant16;7.43158E+17;y;self
deltagardener;5/29/2016 4:48;0;@BlackfriarsGdns its been so dry here that there isn't any puddling on the lawns. Now we have powdery mildew .;;7.36751E+17;y;self
hortagentbeth;5/18/2016 18:05;0;RT @UTPlantDoc : Powdery mildew (Erysiphe pulchra) is visible on area flowering dogwoods (Cornus florida) in Mid TN. pic.twitter.com/9VTzQM61p4;;7.32965E+17;y;news
treevangelist;5/31/2016 20:37;0;oak-pine rust and powdery mildew ... and were predisposed because they were potted with soil in the mix #treechat https:// twitter.com/brlockwood/sta tus/737711326374551552 …;#treechat;7.37715E+17;y;Others
BCWGC;4/7/2016 19:14;0;Powdery Mildew Workshop @Township 7 Winery in Langley April 25, 8 - 12 email info@bcwgc.org or call 250.809.7107 to register;;7.18125E+17;y;Ad
MikeFranks753;4/4/2016 22:29;1;#Cellectis #Calyxt Powdery Mildew Resistant Wheat Cultivar Introduced by @Calyxt_Inc http:// goo.gl/VvHc4x;#Cellectis #Calyxt;7.17087E+17;y;Awareness
Max_Yield;6/21/2016 19:29;1;Think Small to Eliminate Powdery Mildew http:// bit.ly/28S69tj;;7.45308E+17;y;Awareness
DesignGreen_ind;5/20/2016 4:30;0;Control powdery mildew infection on plants with diluted milk spray. http:// ow.ly/MxAh1004MZU pic.twitter.com/Spr7e7wLcr;;7.33485E+17;y;Awareness
SouthStrandNews;5/20/2016 23:13;0;@ClemsonUniv specialist finds powdery mildew on watermelons http:// bit.ly/1TpoHip;;7.33768E+17;y;Awareness
theturfdoctor;4/15/2016 6:47;0;White Grass blades = Powdery Mildew http:// ift.tt/1VoUsgN Visit this link to to view The Turf Doctor's Blog!;;7.20836E+17;y;Awareness
wheat_papers;4/22/2016 22:59;0;Marker Assisted Transfer of Two Powdery Mildew Resistance Genes PmTb7A.1 and PmTb7A.2 from Triticum boeoticum… http:// dlvr.it/L77th3;;7.23617E+17;y;Research
wheat_papers;5/6/2016 22:25;0;Molecular Cytogenetic Identification of a New Wheat-Rye 6R Chromosome Disomic Addition Line with Powdery Mildew … http:// dlvr.it/LFN1VY;;7.28682E+17;y;Research
Redblotchvirus;5/4/2016 0:30;0;Trap & Numerate Powdery Mildew Spores to Aid Mgmt … http://wi neindustrynetwork.us5.list-manage.com/track/click?u= 4514823c73394431c2c9a58f3&id=7c3d06fac6&e=153ad6f381 … @SJVGrapes @grapetweets @NVGrapegrowers @UCCESonoma @LJtheGrape;;7.27626E+17;y;Awareness
viviannastevens;6/29/2016 19:54;0;Stop It Before It Starts: Powdery Mildew http:// ift.tt/293fzo6 #Gardening;#Gardening;7.48213E+17;y;Awareness
VAturf;5/2/2016 15:47;4;Rain & spring temps lead to 1st signs of Powdery Mildew on Va lawns. http:// tinyurl.com/Powdery-Mildew #vaturf #turfdisease pic.twitter.com/qtJgahhSLS;#vaturf #turfdisease;7.27132E+17;y;news
EurekaMag;5/13/2016 7:10;0;#EurekaMag Both stable and unstable QTLs for resistance to powdery mildew are detected in apple after four years of… http:// dlvr.it/LJ5gRj;#EurekaMag;7.30989E+17;y;Research
SyngentaUS;6/3/2016 17:10;0;Prevention is key when it comes to controlling powdery mildew in #grapes : http:// bit.ly/1UujcS5 #Agronomy;#grapes #Agronomy;7.3875E+17;y;Awareness
ILPestSurvey;5/4/2016 21:06;2;Lots to be looking for in wheat...stripe rust, armyworm, and powdery mildew https:// twitter.com/ChadwithBecks/ status/727926399630254085 …;;7.27937E+17;y;Awareness
CertisUK;3/25/2016 9:05;2;Powdery mildew infection tends to develop as crops mature rather than in young crops and developing tissue #StayAlert @hortweek;#StayAlert;7.13276E+17;y;Awareness
GetUOrganized;5/24/2016 13:39;0;Powdery mildew on tomato plants... remedy: spray with a baking soda, vegetable oil, water solution to change the... http:// fb.me/3IPGkvZSe;;7.35073E+17;y;Awareness
GardeningSpring;6/2/2016 0:12;0;How to Get Rid of Powdery Mildew on Zuchinni Plants thumbnail - http:// springgardening.xyz/how-to-get-rid -of-powdery-mildew-on-zuchinni-plants-thumbnail/ … #spring #gardens #gardening pic.twitter.com/bOVoRZ9rjb;#spring #gardens #gardening;7.38131E+17;y;Awareness
MandyCanUDigIt;5/14/2016 19:29;0;Downy mildew, powdery mildew & grey mould - how to prevent & cure. #gardening http:// bit.ly/1PxLBGO pic.twitter.com/Dynt6Y56XI;#gardening;7.31537E+17;y;Awareness
SeedWorldMag;3/22/2016 0:05;0;Powdery Mildew -Resistant Wheat Cultivar Developed http:// ow.ly/ZMhMp;;7.12052E+17;y;Awareness
spanky6973;6/21/2016 6:12;0;What to do About Powdery Mildew - Maximum Yield Indoor Gardening Magazine http:// fb.me/1mNM1RXEo;;7.45107E+17;y;Awareness
GardeningMan1;5/23/2016 7:00;0;5 Natural Ways to Get Rid of Powdery Mildew on Plants - #garden #gardens #gardening http:// gardeningman.xyz/5-natural-ways -to-get-rid-of-powdery-mildew-on-plants/ … pic.twitter.com/Gg1VSBA0sj;#garden #gardens #gardening;7.3461E+17;y;Awareness
AR_Resistance;6/13/2016 20:17;0;@JeffGohogs bad bug problems. Those tiny black beetles, squash borers, etc. powdery mildew . Had tried all kinds of natural remedies...;;7.42421E+17;y;self
MichaelJMaas;4/15/2016 21:36;1;Powdery mildew on a good % of front lawn. Saw 0 last year. Behind on mowing. #DontJudge pic.twitter.com/2L9suLR4l4;#DontJudge;7.2106E+17;y;self
RealSullivanWx;6/28/2016 16:26;0;@NJSnowFan @WeatherNut27 @ryancduff Squash love sun/heat/dry days. As long as it stays relatively dry, it ought to keep powdery mildew down;;7.47798E+17;y;Others
MyGardenTeam;6/1/2016 19:43;0;Powdery Mildew http://www. gardenadvice.co.uk/advisor/garden ing-tips/powdery-mildew/ …;;7.38063E+17;y;Awareness
AusGovNews;4/1/2016 1:49;0;GRDC - Wheat yields improved by timely powdery mildew control http:// bit.ly/1ROi3Ay;;7.15687E+17;y;Awareness
BrysonHaverkamp;4/5/2016 16:46;1;Powdery mildew fairly heavy in this Dickinson County test plot. Some stripe rust but hard to find. pic.twitter.com/lu4wsQYQ2D;;7.17363E+17;y;self
BYFUNL;6/5/2016 2:10;0;What is that white cast on my plants? #NEBEXT ​ Hort Update explains powdery mildew http:// ow.ly/DrAp300uTfY;#NEBEXT;7.39248E+17;y;Awareness
GreenbookData;3/26/2016 23:27;0;Powdery mildew resistant wheat cultivar developed - http:// buff.ly/1SfsMHg pic.twitter.com/eO1PTLFuqj;;7.13855E+17;y;Awareness
Susang6;4/13/2016 12:07;0;2 Organic fungicides that kill Powdery Mildew , I use them in my garden, they work http:// brev.is/8DzC;;7.20192E+17;y;Awareness
UTPlantDoc;6/6/2016 20:39;0;@PNWNurseryIPM Haven't seen powdery mildew , but the plant is so hairy, difficult to examine. Will look again. Thanks! Any aphids?;;7.39889E+17;y;Others
FarmingFutures;3/6/2016 19:41;1;Hybridization of powdery mildew strains gives rise to pathogens on novel agricultural crop species http://www. farmingfutures.org.uk/blog/hybridiza tion-powdery-mildew-strains-gives-rise-pathogens-novel-agricultural-crop-species …;;7.0655E+17;y;Awareness
rgayle0;5/22/2016 9:06;0;@Writer_DG As opposed to Lieutenant Leaf Rust or Ensign Powdery Mildew ?;;7.34279E+17;y;Others
Phytpath_Papers;6/4/2016 12:59;0;Hybridization of powdery mildew strains gives rise to pathogens on novel agricultural crop species. http:// dlvr.it/LTTXJ3;;7.39049E+17;y;Research
JimAnder1979;6/6/2016 13:44;2;#apple scab at highest risk. 48 hour kickback with Aprovia or Inspire Super. #scab & #powdery mildew @syngentacanada pic.twitter.com/mVodppROdi;#apple #scab #powdery;7.39785E+17;y;Awareness
Innspub1;3/14/2016 14:09;1;Resistance to powdery mildew and Cercospora leaf spot of multigerm dihaploid sugar beet http://www. innspub.net/ijaar/resistan ce-to-powdery-mildew-and-cercospora-leaf-spot-of-multigerm-dihaploid-sugar-beet-lines-and-its-inheritance-in-their-hybrids/ … pic.twitter.com/7Bdbz2bawt;;7.09366E+17;y;Research
rchlapecka;4/16/2016 0:11;1;Just like the stripe rust yesterday, powdery mildew loving the cool, wet conditions. pic.twitter.com/HM5dJQqlRq;;7.21099E+17;y;self
OkiefarmerBrent;3/24/2016 0:19;0;@nckohls I couldn't make up my mind. Color closer to powdery mildew so I think you're right. Nothing that another $12/ac won't fix.;;7.12781E+17;y;self
garden_answers;3/11/2016 6:42;0;New blog post from http:// GardenAnswers.com about Powdery Mildew On Apples - http://www. gardenanswers.com/plant-diseases /powdery-mildew-on-apples/ … pic.twitter.com/239zmbg3Qv;;7.08166E+17;y;Awareness
Bayer4CropsUS;3/23/2016 23:30;3;Powdery mildew can cause serious danger to #wheat yield. Consider these Crop Science solutions for your program: http:// bit.ly/1MbRC6x;#wheat;7.12768E+17;y;Awareness
viviannastevens;5/24/2016 22:16;0;"Yellow pear-shaped tomato"" problems = Powdery Mildew ? http:// ift.tt/1qHEgKc #Gardening""";#Gardening;7.35203E+17;y;Awareness
kreylix;6/12/2016 21:13;0;. @vinography Excellent acidity and a nice powdery mildew tannic muscle linger in the finish along with notes of violet. #ImproveATastingNote;#ImproveATastingNote;7.42072E+17;n;
surnainc;3/3/2016 20:50;0;Defeat Powdery Mildew In Your Grow! http:// buff.ly/1LXgBKH #surnablog;#surnablog;7.05481E+17;y;Awareness
AqleemAbbas;4/27/2016 5:03;0;Any management for Powdery mildew ? Powder mildew disease on pepper plant?? http:// fb.me/5lB9UWfp1;;7.25158E+17;y;Awareness
plantdisease;4/11/2016 17:18;3;What a great featured APS image! RT @EmphasisProject : Powdery #mildew of black gram http:// buff.ly/1Sb7Ch9 via @plantdisease #planthealth;#mildew #planthealth;7.19545E+17;y;Awareness
thefreshmancook;4/13/2016 16:29;0;Organic powdery mildew treatment see the recipe at http:// allaboutrosegardening.com http:// pinterest.com/pin/1906999840 1252811/ …;;7.20257E+17;y;Awareness
garden_answers;4/1/2016 0:27;0;New blog post from http:// GardenAnswers.com about Powdery Mildew On Squash - http://www. gardenanswers.com/vegetable-plan ts/powdery-mildew-on-squash/ … pic.twitter.com/dF6GrPEXSS;;7.15667E+17;y;Awareness
ELICITRACTU;3/22/2016 17:27;0;Systemic Resistance to Powdery Mildew in Brassica napus (AACC) and Raphanus alboglabra (RRCC) b... | @scoopit http:// sco.lt/80OfKb;;7.12315E+17;y;Awareness
bendijck;6/15/2016 3:21;0;Classic case of powdery mildew in cereal crop. Watch your fields #fieldscout #fungicide #spray2016 pic.twitter.com/8hWVVguqJz;#fieldscout #fungicide #spray2016;7.4289E+17;y;self
BBOGardening;6/23/2016 18:02;0;Fight Black Spot and Powdery Mildew with Baking Soda Spray http:// buff.ly/28M2Uqf;;7.46011E+17;y;Awareness
ewlarson546;5/27/2016 16:22;0;ROSE SPRAY-helps prevent diseases such as rust, blackspot, and powdery mildew . Mix together: •... http:// fb.me/27mn69FYR;;7.36201E+17;y;Awareness
viviannastevens;6/6/2016 7:17;0;Zucchini bread in the making- btw I see the powdery mildew spraying tomorrow http:// ift.tt/1t0mpzK #Gardening;#Gardening;7.39688E+17;y;Others
KeeleSLC;6/3/2016 11:33;0;A powdery mildew practical and citizen science opportunity from @SAPS_News http:// bit.ly/1t5Ln1j;;7.38665E+17;y;Others
Shawn_CFS;6/2/2016 16:39;1;Some powdery mildew and strip rust findings today pic.twitter.com/hn9v93Bu9g;;7.38379E+17;y;self
House_of_Cobraa;6/21/2016 12:11;0;Powdery Mildew Can Destroy Your Plants & Make You Sick - http:// houseofcobraa.com/2016/06/20/340 20/ … pic.twitter.com/ekudn1wDAD;;7.45198E+17;y;Awareness
UDExtension;3/25/2016 21:31;0;Powdery #Mildew in #wheat #crops #FarmDE #agchat https:// twitter.com/Delmarplantdoc /status/713368094916222977 …;#Mildew #wheat #crops #FarmDE #agchat;7.13463E+17;y;Awareness
MarshaCollier;6/10/2016 19:18;0;@gagasgarden Will go and check! Was just thinking of you! Cloudy mornings here, fighting powdery mildew . Ruined my grapes;;7.41319E+17;y;self
JimAnder1979;6/6/2016 13:44;1;#apple scab at highest risk. 48 hour kickback with Aprovia or Inspire Super. #scab & #powdery mildew @syngentacanada pic.twitter.com/67a64RGsER;#apple #scab #powdery;7.39785E+17;y;news
cobwebdr;6/14/2016 19:15;3;Early signs of Mahonia powdery mildew - another possibility for @GatsbyPlantSci #plant #pathology practical @BS_PP pic.twitter.com/snTTKHHNBE;#plant #pathology;7.42767E+17;y;news
seattleurbnfarm;6/29/2016 3:47;0;Powdery Mildew https://www. bloglovin.com/blog/post/1488 7743/4958927587 … on @bloglovin;;7.4797E+17;y;Awareness
wheat_papers;6/16/2016 13:08;0;Haynaldia villosa NAM-V1 is linked with the powdery mildew resistance gene Pm21 and… http:// dlvr.it/LZXGFm pic.twitter.com/0iMhOox8Wm;;7.434E+17;y;Research
BeautifulGard1;4/12/2016 1:51;0;Growing Zucchini . Remedy for powdery mildew - got it on ... - http:// beautifulgardening.xyz/growing-zucchi ni-remedy-for-powdery-mildew-got-it-on-my-squash-pumpkin-and-zucchini-plants-this-year-1t-baking-soda-12-t-liquid-soap-and-1-gal-water-spray-weekly-preferably-in-am-but-not-wh/ … #gardening #garden #gardens pic.twitter.com/PhaaDTlnjf;#gardening #garden #gardens;7.19674E+17;y;Awareness
jkellyca;3/7/2016 18:50;0;2/2 have this year. Likely means heavier sprays later to control powdery mildew on the grape crop. Increased chance of sulfides in wines.;;7.069E+17;y;Others
drtreefruit;5/17/2016 5:46;6;Apple powdery mildew liked our dry April--so much so it toasted this apple blossom #plantdisease pic.twitter.com/Z14z26ytzS;#plantdisease;7.32417E+17;y;self
KevaiF;6/5/2016 4:34;0;How To Control Powdery Mildew On Your Marijuana Plants http:// fb.me/1aOxv3xBp;;7.39284E+17;y;Awareness
LeanneFreitag;3/9/2016 20:28;2;Cargill Agronomist David Shortall @DavidS_Agri finding powdery mildew in wheat. #spring16 pic.twitter.com/CWdr22UjQX;#spring16;7.07649E+17;y;self
dromius;4/16/2016 13:04;1;Genome-Wide Study of Tomato SlMLO Family & Characteriz. in Response to Powdery Mildew Fungus Oidium neolycopersici http:// journal.frontiersin.org/article/10.338 9/fpls.2016.00380 …;;7.21293E+17;y;Research
garden_answers;3/17/2016 11:57;0;New blog post from http:// GardenAnswers.com about Powdery Mildew On Zucchini - http://www. gardenanswers.com/vegetable-plan ts/powdery-mildew-on-zucchini-9/ … pic.twitter.com/hdkFkSbCvZ;;7.1042E+17;y;Awareness
OkiefarmerBrent;3/24/2016 3:59;1;To correct the record if you didn't see replies from others. My wheat is suffering from Powdery Mildew in Ottawa Co, OK NOT stripe rust.;;7.12836E+17;y;Awareness
TheGrozine;3/4/2016 23:59;0;Dipping young plants is a good way to rid problems like early season powdery mildew from the… https://www. instagram.com/p/BCjHr4AA_gr/;;7.0589E+17;y;Awareness
CompBiolPapers;6/17/2016 12:10;0;Whole Genome Re-Sequencing and Characterization of Powdery Mildew Disease-Associated Allelic Variation in Melon. http:// dlvr.it/LZyXLp;;7.43748E+17;y;Research
orbsloveme11;6/11/2016 7:32;0;I liked a @YouTube video from @JorgeCervantes http:// youtu.be/S7jE7qzfgQs?a Jorge Cervantes: Washing Away Powdery Mildew;;7.41503E+17;y;Awareness
swasgarden;5/19/2016 23:46;0;TIL crape myrtle is susceptible to powdery mildew . This is from a neighbor’s yard. #losa … http:// ift.tt/1TJO26o pic.twitter.com/6ayHaNlzDj;#losa;7.33414E+17;y;self
theCCDM;4/1/2016 4:41;3;"It’s the combination of 2 mutations that results in powdery mildew resistance effects"" http:// news.curtin.edu.au/media-releases /wheat-powdery-mildew-mutations-found-in-eastern-states/ … pic.twitter.com/12KV5HKvej""";;7.15731E+17;y;Awareness
orbsloveme11;6/11/2016 7:32;0;I added a video to a @YouTube playlist http:// youtu.be/S7jE7qzfgQs?a Jorge Cervantes: Washing Away Powdery Mildew;;7.41503E+17;y;Awareness
johnandbobs;3/7/2016 17:44;0;Have questions about the powdery mildew or rust on your plants? Get the answers! http:// bit.ly/1QBTkDj pic.twitter.com/eGJ5WJCfSl;;7.06883E+17;y;Awareness
just_michaelaa;4/10/2016 12:39;0;@TheatreDust @IamjustWendy geraniums don't need to be washed. It gives them powdery mildew . Find another excuse.;;7.19113E+17;y;Others
MandyCanUDigIt;5/21/2016 21:23;0;Powdery mildew on Euphorbia polychroma purpurea: vulnerable in dry weather. #gardening http:// bit.ly/1PxLBGO pic.twitter.com/wcz1pYOy1W;#gardening;7.34102E+17;y;Awareness
TechWoww12;6/21/2016 9:43;0;ROSE SPRAY-helps prevent diseases such as rust, blackspot, and powdery mildew . ... - http://www. techwow.xyz/rose-spray-hel ps-prevent-diseases-such-as-rust-blackspot-and-powdery-mildew-mix-together-%e2%80%a21-tablespoon-baking-soda-%e2%80%a21-teaspoon-mild-dishwashing-detergent-%e2%80%a21-tablespoon-vege/ … #tech pic.twitter.com/ns8N4wa1pc;#tech;7.4516E+17;y;Awareness
ebhiggins1;4/11/2016 1:18;0;Try treating powdery mildew by Mixing equal part milk and water in a spray bottle and spraying once a week until the disease is gone.;;7.19303E+17;y;Awareness
ewlarson546;5/31/2016 16:15;0;Aspirin is the remedy for fungal plant problems, Black spot, powdery mildew , and rust are a terrible... http:// fb.me/7VlOwYMWY;;7.37649E+17;y;Awareness
teemehkin;5/26/2016 15:01;0;"It's all about that luxuriant development"" of powdery mildew for Yarwood. #powderymildew #plantpath""";#powderymildew #plantpath;7.35818E+17;y;Others
Aspectek;3/15/2016 18:07;0;Notice a powdery #mildew on your fruit #trees ? We have the fix #TipTuesday #gardening #horticulture pic.twitter.com/7VWxWC0eeW;#mildew #trees #TipTuesday #gardening #horticulture;7.09788E+17;y;Awareness
jgallagher5645;5/16/2016 23:36;0;Should have written this research paper on powdery mildew #WayMoreKnowledge;#WayMoreKnowledge;7.32324E+17;y;Others
