username;date;retweets;text;hashtags;id;Agritweet;Category
AiroClean420;6/9/2016 21:37;0;Powdery mildew actually refers to several strains of fungi that cause a characteristic white, powdery mold to form. http:// buff.ly/22JD5bh;;7.40991E+17;y;Awareness
lucybrooke5;4/17/2016 14:04;0;@bengoldacre Ivy. Honeysuckle. No roses tho as I think they'd end up with powdery mildew ...;;7.21671E+17;y;Others
rainbowgsatx;5/26/2016 19:00;0;Seeing a fuzzy substance on your plants lately might have you thinking you've got powdery mildew , but take a... http:// fb.me/7Vs2C7Ngu;;7.35878E+17;y;Awareness
whatDNAtest;6/15/2016 0:20;0;Haynaldia villosa NAM-V1 is linked with the powdery mildew resistance gene Pm21 and contributes... http:// bit.ly/1ZPdlZs BMC #Genetics;#Genetics;7.42844E+17;y;Research
Vinsdeparisien;5/7/2016 5:45;0;OidiumCommon fungal disease also known as powdery mildew which attacks vine leaves, shoots and tendrils. After flowering the berries...;;7.28793E+17;y;Awareness
BoisvertLyse;6/2/2016 1:23;2;#Winterwheat in Carrot River SK. Dense canopy, cool night= powdery mildew . Flag leaf emerging-fungicide in 3-5 days pic.twitter.com/RzMqyEvI7j;#Winterwheat;7.38149E+17;y;self
vexedmuddler;4/4/2016 21:54;0;Further attempts to #keepVexedBusyWithoutLaptop included autoclaving All The Things, bleaching a growth chamber infested with powdery mildew;#keepVexedBusyWithoutLaptop;7.17078E+17;n;
ISMPMI;6/21/2016 18:30;0;You're Invited to the International Powdery Mildew Symposium http:// rlm.ag/1LUbmV;;7.45293E+17;y;Ad
GrowMap;5/5/2016 19:35;0;Growing melons on a nylon trellis and White Powdery Mildew http:// vid.staged.com/cj1s #localads #local #humor pic.twitter.com/6Iwjj9glSV;#localads #local #humor;7.28277E+17;y;Awareness
BopalotBarnes;4/2/2016 12:21;0;@MildewStop @YouTube I had powdery mildew on my plants last year. I heard u can treat it with milk.;;7.16209E+17;y;Others
BiolaRaisin;4/29/2016 19:35;0;Applying fungicide & sulfur to stop fungal spores which travel by air & cause powdery mildew damage in the vineyard. pic.twitter.com/LnvNRvOsPE;;7.26103E+17;y;Others
BeginnerHerbs;6/11/2016 15:11;0;Hot & Humid in your garden? You might see powdery mildew ! You can see it on this bee balm Monarda). http:// fb.me/16hjOHMyp;;7.41619E+17;y;Awareness
reumanconsult;5/13/2016 2:05;3;Busy night tonight scouting wheat. Found some powdery mildew along with some other tan spot and others #wheat16 pic.twitter.com/c66DAaoEKE;#wheat16;7.30912E+17;y;self
OkieMGs;6/14/2016 18:07;0;Powdery mildew appearing on your crape myrtle? Prevent it by planting resistant varieties, leaving space for air flow, don't over fertilize.;;7.4275E+17;y;Awareness
wheat_papers;4/14/2016 15:39;0;A disulphide isomerase gene (PDI-V) from Haynaldia villosa contributes to powdery mildew resistance in common wheat. http:// dlvr.it/L3S1G5;;7.20607E+17;y;Research
NaturesTurf;6/15/2016 20:36;0;Powdery Mildew is common on Crape Myrtle Trees and we fight this fungus within our shrub care program. pic.twitter.com/J1XgI8JbgM;;7.4315E+17;y;Awareness
rnomics;5/28/2016 17:11;0;Transcriptomic analysis reveals distinct resistant response by physcion and chrysophanol against cucumber powdery mildew . - PubMed - NCBI …;;7.36576E+17;y;Research
UTPlantDoc;3/25/2016 0:33;6;Powdery mildew of winter annual weeds (Lamium spp.) elicits little sympathy, maybe a few cheers. pic.twitter.com/TW7Oz0kjOQ;;7.13147E+17;y;self
Vinsdeparisien;3/11/2016 3:16;0;OidiumCommon fungal disease also known as powdery mildew which attacks vine leaves, shoots and tendrils. After flowering the berries...;;7.08114E+17;y;Awareness
alpinewines;5/28/2016 11:12;0;If you want to fine less yet avoid cloudy wine, boo hiss mildew! prevent/fight powdery mildew #ICCWS2016 but need not worry about uv damage;#ICCWS2016;7.36485E+17;y;Awareness
HarvestToTable;5/18/2016 18:56;0;Powdery Mildew Defense: http:// wp.me/p3Wfr0-5Lp;;7.32978E+17;y;Awareness
MyGardenTeam;6/19/2016 15:38;0;Powdery Mildew . http://www. gardenadvice.co.uk/advisor/garden ing-tips/powdery-mildew/ …;;7.44525E+17;y;Awareness
GardeningChoice;4/21/2016 2:08;0;Growing Zucchini . Remedy for powdery mildew - got it on ... - http:// gardeningchoice.xyz/growing-zucchi ni-remedy-for-powdery-mildew-got-it-on-my-squash-pumpkin-and-zucchini-plants-this-year-1t-baking-soda-12-t-liquid-soap-and-1-gal-water-spray-weekly-preferably-in-am-but-not-wh/ … #garden #gardening #flowers pic.twitter.com/EmXvZavCzP;#garden #gardening #flowers;7.2294E+17;y;Awareness
mary_swilling;4/16/2016 16:50;0;UV LIGHT EFFECTIVE AGAINST POWDERY MILDEW https://www. postwaves.com/posts/55983177 26 … via @post_waves;;7.2135E+17;y;Awareness
wheatgen_papers;6/22/2016 12:43;0;Powdery mildew resistance in wheat cultivar Mv Hombár is conferred by a new gene PmHo. http:// dlvr.it/Ld0Jxd pic.twitter.com/n5OypsoIUw;;7.45568E+17;y;Research
PetrusGladioli;5/19/2016 9:55;0;Powdery Mildew Decreases the Radial Growth of Oak Trees with Cumulative and Delayed Effects over Years | @scoopit http:// sco.lt/8yfN8T;;7.33204E+17;y;Awareness
blanca_mar2004;5/17/2016 2:10;0;Aspirin is the remedy for fungal plant problems, Black spot, powdery mildew , and rust are a terrible http:// pinterest.com/pin/3436106465 51892159/ …;;7.32363E+17;y;Awareness
pascal_frey;5/25/2016 9:21;7;Powdery mildew (Erysiphe alphitoides) decreases the radial growth of Oak trees http:// journals.plos.org/plosone/articl e?id=10.1371%2Fjournal.pone.0155344 … pic.twitter.com/0tWlJFqU9B;;7.3537E+17;y;Research
PotFrans;6/24/2016 17:58;0;@BASFAgSolutions @BASFDorothee does twinline do anything on powdery mildew ?;;7.46372E+17;y;Others
Susang6;6/12/2016 12:07;0;2 Organic fungicides that kill Powdery Mildew , I use them in my garden, they work http:// brev.is/8DzC;;7.41935E+17;y;Awareness
CameronHild;6/4/2016 19:39;0;Powdery Mildew in #winterwheat starting bottom stem & leaves. Wet. Any concern? @field2fieldag @pjderoc @AgriTrend pic.twitter.com/KwqprPcub8;#winterwheat;7.3915E+17;y;self
garden_answers;4/9/2016 2:58;0;New blog post from http:// GardenAnswers.com about Powdery Mildew - http://www. gardenanswers.com/plant-diseases /powdery-mildew-6/ … pic.twitter.com/oPRbJBDSNC;;7.18604E+17;y;Awareness
iamsimooone;3/7/2016 18:13;0;"@yougrowgirl Hi Gayla, reading your book Grow Great Grub"", love it! Just wondering the measurements for your powdery mildew brew, thanks!!""";;7.06891E+17;y;Others
SchmoopyWoopy;4/7/2016 18:58;0;Making a screaming run down to the garden shop...the damn roses I just got have powdery mildew !!! (that's a very bad thing for roses);;7.18121E+17;y;Others
syngentacanada;6/25/2016 20:25;1;Protect your cereal crops against rusts, tan spot, powdery mildew and septoria. #Quilt #FungicideFYIhttp://ow.ly/VWG9301laPR;#Quilt #FungicideFYIhttp;7.46771E+17;y;Awareness
Sheffieldsseed;5/20/2016 2:35;0;Aspirin is the remedy for fungal plant problems, Black spot, powdery mildew , and rust are a terrible http:// pinterest.com/pin/1142085405 29006855/ …;;7.33456E+17;y;Awareness
eupathdb;4/4/2016 17:17;4;Mathias Nottensteiner talking about ROPIP1 of the barley powdery mildew fungus #ECFG13;#ECFG13;7.17008E+17;y;Others
gardenmentor;6/27/2016 19:49;0;Powdery mildew or not? How to avoid it & what to do if your garden gets it:... http:// fb.me/8gnvJJUTc;;7.47487E+17;y;Awareness
thymesquad;6/19/2016 13:21;0;Tropical Gardening Helpline: Powdery mildew is unattractive, but not usually fatal http:// bit.ly/1UHQz1n #gardening;#gardening;7.4449E+17;y;Awareness
HapSmallholder;6/1/2016 16:13;0;https://www. facebook.com/GrowVeg/posts/ 10154084794086970 … interesting article advocating spraying milk and water mix to prevent powdery mildew .;;7.38011E+17;y;Awareness
CappersFarmer;4/17/2016 21:01;0;Volcano phlox are fabulous, fragrant and resistant to powdery mildew , with bright blossoms. http:// bit.ly/1VqrqgQ http:// ow.ly/i/iww2j;;7.21776E+17;y;Awareness
usagardencare;6/28/2016 14:59;0;Green Clean Cleaner Spider Mite & Powdery Mildew Destroyer http:// landmatus.com/shop/patio-law n-and-garden/green-clean-cleaner-spider-mite-powdery-mildew-destroyer/?utm_source=ReviveOldPost&utm_medium=social&utm_campaign=ReviveOldPost … #patiolawnandgarden;#patiolawnandgarden;7.47776E+17;y;Awareness
michaelkaer;6/15/2016 15:05;0;6 Ways to Cure Powdery Mildew on Cannabis Organically - Mold Resistant Strains http:// fb.me/2NNOQ9hyl;;7.43067E+17;y;Awareness
ConservationTV;3/9/2016 9:03;0;Powdery mildew relief found in your kitchen pantry! http:// zkq.me/Sa4SC;;7.07477E+17;y;Awareness
ChadwithBecks;5/4/2016 20:22;1;Powdery mildew set in pretty quick this last week on #wheat in Douglas Co, IL. pic.twitter.com/imune32qL5;#wheat;7.27926E+17;y;self
LostSocietyRap;4/11/2016 15:03;0;I liked a @YouTube video http:// youtu.be/RATOQznZkUQ?a C4:E1 - When Powdery Mildew Attacks! (3k Flower Room v2016);;7.19511E+17;y;Awareness
hiasilrdne;3/7/2016 21:21;0;#EurekaMag Effects of controlled epidemics of powdery mildew on grain yield of spring barley http:// dlvr.it/KjlZ7p;#EurekaMag;7.06938E+17;y;Research
5SCarrboro;5/17/2016 15:52;0;April showers bring powdery mildew ? Unfortunately, yes. With all of the rain we've been having, we're going to... http:// fb.me/7T7eHbkLL;;7.32569E+17;y;self
EurekaMag;3/6/2016 23:05;8;#EurekaMag Effects of soil water level on the development of adult plant resistance to powdery mildew in barley http:// dlvr.it/KjGzXC;#EurekaMag;7.06602E+17;y;Research
seanfernridge;4/5/2016 22:14;0;The beautiful flowers of Major Wheeler Honeysuckle - a great #nativar , resistant to powdery mildew , http:// pinterest.com/pin/4321345267 26584897/ …;#nativar;7.17445E+17;y;Awareness
GreenFlyFlowers;4/30/2016 17:15;0;@DrHikov @FungusProf Powdery Mildew is Evil!;;7.2643E+17;y;Others
SJVGrapes;3/2/2016 20:07;4;@LJtheGrape speaking on #grapevine powdery mildew management. RU prepared 4 mildew season? http://www. ipm.ucdavis.edu/PMG/r302100311 .html … pic.twitter.com/IehkWGY2hF;#grapevine;7.05107E+17;y;Awareness
RuralRadioNet;5/4/2016 23:17;0;Yellow 8: Grant Co #OK slight freeze damage, powdery mildew , barley yellow dwarf. Been sprayed est 47.3 #wheattour16 pic.twitter.com/OKYeCcnLGe;#OK #wheattour16;7.27971E+17;y;self
Susang6;4/18/2016 8:22;0;Powdery Mildew Treatment - Fungicide https:// shar.es/1jy71D via @sharethis;;7.21947E+17;y;Awareness
JohnGlenStevens;4/20/2016 19:30;0;Water your garden in the early morning to conserve moisture loss and to help avoid powdery mildew and other fungal diseases. #gardening;#gardening;7.2284E+17;y;Awareness
kristendiangelo;5/26/2016 16:14;3;And, my apricot tree has spots...:( Maybe powdery mildew ??? Don't know for sure. Anyone??? pic.twitter.com/Z01tSAjTod;;7.35837E+17;y;Others
USWC_Radio;6/13/2016 9:52;1;Grow Room Infected With Powdery Mildew :/ Help!: Hey everyone, I have a growing with up to 400-500 cuts somet... http:// bit.ly/25WDZDf;;7.42263E+17;n;
AdvancedTurf;6/2/2016 12:00;0;Answer to the ornamental #DiseaseID : Powdery Mildew . Did you know it? Treat it with the products below. pic.twitter.com/d2ymwn0e9V;#DiseaseID;7.38309E+17;y;Awareness
SDSUPlantPath;5/13/2016 19:04;6;Stripe #rust and powdery mildew increasing in winter #wheat in SD. Plan a #fungicide at flag leaf to manage these. pic.twitter.com/tLN2mtgiui;#rust #wheat #fungicide;7.31168E+17;y;news
garden_answers;4/10/2016 23:17;0;New blog post from http:// GardenAnswers.com about Powdery Mildew On Roses - http://www. gardenanswers.com/plant-diseases /powdery-mildew-on-roses-2/ … pic.twitter.com/kaFunAJEtS;;7.19273E+17;y;Awareness
AusCropDiseases;4/15/2016 3:38;2;WA: Presence of fungicide resistance means growers need to be aware of integrated mgt strategies for powdery mildew . https:// twitter.com/theGRDC/status /720535062593208320 …;;7.20788E+17;y;Awareness
dianalward;5/19/2016 0:27;0;Tired of battling diseases like powdery mildew or fusarium wilt in the vegetable garden? There are s http:// pinterest.com/pin/3208821607 4579542/ …;;7.33061E+17;y;Awareness
GardenLifeToday;3/31/2016 10:31;0;Treating peony powdery mildew - mix 1 TB each baking soad, ... - #garden #gardens #gardening http:// gardenlife.xyz/treating-peony -powdery-mildew-mix-1-tb-each-baking-soad-canola-oil-and-dish-soap-with-1-gal-water-spring-on-every-10-14-days/ … pic.twitter.com/rVxf43LLFV;#garden #gardens #gardening;7.15457E+17;y;Awareness
JoannaMWallace;5/5/2016 20:54;7;Powdery mildew in the thicker wheat too. Time for a fungicide. Will help with stem strength too! #ontag pic.twitter.com/I2ndQylm8C;#ontag;7.28297E+17;y;self
MatthewMoscou;6/28/2016 17:44;0;#IBGS2016 Schweizer: Propose that recessive resistance genes to powdery mildew mean that additional targets may exist.;#IBGS2016;7.47818E+17;y;Research
Susang6;5/30/2016 20:33;0;You can put a stop to powdery mildew with these garden tips http:// brev.is/C7zC;;7.37351E+17;y;Awareness
hintomiv;3/19/2016 13:37;0;Garden Checklist: Spring has flowers – and powdery mildew;;7.1117E+17;y;self
Agri_Kate;6/23/2016 22:08;1;Seeing lots of powdery mildew in #wheat today. A good reflection of our current field cond. #scout16 #fromthefield pic.twitter.com/E9Z0WLV1gc;#wheat #scout16 #fromthefield;7.46072E+17;y;self
nicolerobin30;3/31/2016 21:33;0;Our plants are loving the 86 spider mites and powdery mildew spray #norcalplantnutrients #allnatural pic.twitter.com/qyLDkwU1n7;#norcalplantnutrients #allnatural;7.15623E+17;y;self
_introgression;4/30/2016 12:29;1;Genetic analysis of a novel broad-spectrum powdery mildew resistance gene from the wheat-Agropyron cristatum… http:// dlvr.it/LBZKLR;;7.26358E+17;y;Research
GrwFoodNotLawns;4/12/2016 21:08;0;If you just can't seem to win against pests, or diseases such as powdery mildew , this will be a breath of fresh air: http:// fb.me/2ArLkrptU;;7.19966E+17;y;Awareness
Jfriedstrom1;5/3/2016 23:18;0;Looks like you got a powdery mildew issue brotha...;;7.27608E+17;y;self
EurekaMag;4/2/2016 16:13;0;#EurekaMag Light and scanning microscopy of sugar beet powdery mildew http:// dlvr.it/Ky3r6s;#EurekaMag;7.16267E+17;y;Research
Susang6;5/28/2016 12:06;0;2 Organic fungicides that kill Powdery Mildew , I use them in my garden, they work http:// brev.is/8DzC;;7.36499E+17;y;Awareness
6eustacia;6/3/2016 21:39;0;Powdery Mildew On The Hundreds Of Zinnias I Grow! Problem Solved With @BayerAdvanced Insect, Disease & Mite Control! pic.twitter.com/wGsTLW600m;;7.38817E+17;y;self
MoreFunz;5/16/2016 16:23;0;http:// ohioline.osu.edu/ac-fact/0010.h tml … - Powdery Mildew of Wheat. The #morefunz page https:// morefunz.com/science/agricu lture/field-crops/powdery-mildew-of-wheat …;#morefunz;7.32215E+17;n;
ZhuangGeorge;6/15/2016 17:04;0;@nuts4ag @SJVGrapes some studies show it can be used for reduce heat and water stress on grapes. Not sure on powdery mildew .;;7.43097E+17;y;Others
kommerell;4/4/2016 10:15;0;Powdery Mildew Resistant Wheat Cultivar Introduced by Calyxt, Inc. - Small Grains | @scoopit http:// sco.lt/6jq91F;;7.16902E+17;y;Awareness
APS_CLARE;3/22/2016 16:25;0;Review of powdery mildew disease of rubber tree http:// onlinelibrary.wiley.com/resolve/doi?DO I=10.1111/efp.12271 …;;7.12299E+17;y;Research
commodityindia;3/22/2016 14:17;0;Powdery mildew resistant wheat cultivar developed - 03/22/2016 http://www. commodityIndia.com;;7.12267E+17;y;Awareness
GRDCNorth;6/22/2016 4:50;1;Sue Thompson @USQNews at #Chinchilla #GRDCUpdates on fungicide management of powdery mildew in #mungbeans . http:// bit.ly/1t2DlGm @theGRDC;#Chinchilla #GRDCUpdates #mungbeans;7.45449E+17;y;Awareness
sabrosiavit;6/24/2016 0:14;0;Trevor Lupton makes the point that a wetter with S can reduce Powdery Mildew on fruit, but the real story is coverage, coverage, coverage!;;7.46104E+17;y;Others
APS_CLARE;4/2/2016 22:29;0;Distribution and characterization of powdery mildew virulent on hop cultivars possessing R6-based resistance http:// apsjournals.apsnet.org/doi/abs/10.109 4/PDIS-12-15-1449-RE …;;7.16362E+17;y;Research
garden_answers;4/4/2016 8:57;0;New blog post from http:// GardenAnswers.com about Powdery Mildew On Zucchini - http://www. gardenanswers.com/plant-diseases /powdery-mildew-on-zucchini-8/ … pic.twitter.com/he3AGfLlXA;;7.16882E+17;y;Awareness
ramana_brf;3/24/2016 0:28;0;Why you bring caste into powdery.mildew ! A parasite does not work. More like Rahul baba. https:// twitter.com/brumbyOz/statu s/712779735982432257 …;;7.12783E+17;n;
TheorApplGenet;6/20/2016 4:50;1;Identification and genetic mapping of PmAF7DS: powdery mildew resistance gene in bread wheat http:// goo.gl/K2et62 pic.twitter.com/62SBoro2uT;;7.44724E+17;y;Research
CannabisIndy;6/26/2016 22:45;0;"For the people who believe the plant in my other photo is covered in  powdery mildew "" No. It's not. Repeat post, r… http:// ift.tt/28WSLSs""";;7.47169E+17;y;Others
CannabisIndy;6/12/2016 14:53;0;Organic ways to fight powdery mildew (PM) - http:// ift.tt/1U7Ih8D;;7.41977E+17;y;Awareness
CertisUK;6/2/2016 18:55;0;Powdery mildew is starting to appear. To achieve control, alternate between chemicals of different modes of action pic.twitter.com/HY0MfLbsfR;;7.38414E+17;y;Awareness
treevangelist;5/21/2016 4:34;0;@ylwrseoftx looks like powdery mildew (the white stuff on leaves) http:// aggie-horticulture.tamu.edu/newsletters/ho rtupdate/hortupdate_archives/2004/may04/PowderyMildewE.html … what does underside of leaves look like?;;7.33849E+17;y;self
TinSheets;5/17/2016 4:09;0;@RedFoxCellars the bright side is Powdery Mildew spraying time! Oh wait.... #winemaker problems;#winemaker;7.32393E+17;y;self
sshahn1;3/19/2016 2:37;0;It's been a bugger of a year for #powdery #mildew @Tracy_Vo @720perth;#powdery #mildew;7.11004E+17;y;self
MildewStop;3/30/2016 15:18;1;@BopalotBarnes @YouTube Maybe you like this vid as well? Controlling Powdery Mildew with UV-Light! https://www. youtube.com/watch?v=fVrByO Dxi-8 …;;7.15166E+17;y;Awareness
GRDCNorth;3/2/2016 1:15;2;Greg Platz @QldAgriculture Barley disease update: pathotype survey - powdery mildew & NFNB http:// bit.ly/1L3WCiz #GRDCUpdates #Goondiwindi;#GRDCUpdates #Goondiwindi;7.04822E+17;y;Awareness
jpatticake;6/15/2016 22:16;0;@JennitheOdd :( Is it powdery mildew ? I'm growing seminole squash from the Everglades that's immune to mildew bc I can't deal anymore.;;7.43175E+17;y;self
HarvestToTable;5/18/2016 18:56;1;Powdery Mildew Defense http://www. harvesttotable.com/2016/05/powder y-mildew-defense/ … pic.twitter.com/UfzVNcJ4uZ;;7.32978E+17;y;Awareness
smcneil8;5/19/2016 15:09;1;Some powdery mildew found this morning scouting wheat #aggiesonthejob #ontag pic.twitter.com/ji9AEqc1ZB;#aggiesonthejob #ontag;7.33284E+17;y;self
BrysonHaverkamp;3/24/2016 4:04;2;Powdery mildew in NE OK. Found it in fields in SC KS as well earlier this week. https:// twitter.com/okiefarmerbren t/status/712769881179959296 …;;7.12837E+17;y;self
DotySupply;4/13/2016 20:16;0;In the garden: Keep an eye out for whiteflies, spider mites and powdery mildew in and on your plants. Prompt... http:// fb.me/2bwBmiDhM;;7.20315E+17;y;Awareness
FriendsNFCG;5/27/2016 18:51;0;6 steps to get rid of Powdery Mildew on Plants 1. Mix one tablespoon baking soda with one gallon of near-room... http:// fb.me/5Qp839OWU;;7.36238E+17;y;Awareness
hacommoditynews;3/21/2016 22:54;0;Powdery mildew resistant wheat cultivar developed http:// grainmarketnews.com/12763/powdery- mildew-resistant-wheat-cultivar-developed.html … pic.twitter.com/Cj0IjXco4b;;7.12035E+17;y;Awareness
MahmutTor;3/4/2016 14:35;0;ADFs function as Susceptibility genes in Arabidopsis to an Adapted Powdery Mildew Fungus http://www. plantphysiol.org/content/170/3/ 1420.full …;;7.05749E+17;y;Research
Bayer4CropsUS;3/16/2016 21:30;4;Powdery mildew can cause serious danger to #wheat yield. Consider these Crop Science solutions for your program: http:// bit.ly/1MbRC6x;#wheat;7.10201E+17;y;Awareness
LorenWernette;4/19/2016 17:49;0;Powdery mildew found on winter wheat in central Michigan. #Priaxor #basf pic.twitter.com/TWiVqrTS44;#Priaxor #basf;7.22452E+17;y;news
EurekaMag;4/13/2016 0:28;0;#EurekaMag The effect of fungal density on fungicide dose-response curves in barley powdery mildew (Erysiphe… http:// dlvr.it/L2gPSt;#EurekaMag;7.20016E+17;y;Research
Scien_net;6/21/2016 12:42;0;#Scien Spring barley variety mixtures as a means of powdery mildew control http:// ift.tt/28KevjR;#Scien;7.45205E+17;y;Awareness
EurekaMag;3/8/2016 22:34;8;#EurekaMag Effect of powdery mildew infection of sugar beet on the content of electron carriers in chloroplasts http:// dlvr.it/KkJJhG;#EurekaMag;7.07319E+17;y;Research
Sheffieldsseed;3/13/2016 23:15;0;Powdery Mildew Fungus On Trees – How To Treat Powdery Mildew On Trees https:// shar.es/1Ym1cT via @gardenknowhow;;7.09141E+17;y;Awareness
PeterRoberts_WA;4/20/2016 6:50;1;New video on wheat powdery mildew 's emergence in Mingenew over the past 3 years & the research focus from @CCDMnews http:// bit.ly/1Q8fW9O;;7.22648E+17;y;Awareness
ChrisWolfeNH;6/22/2016 6:12;0;Powdery mildew is unattractive, but not usually fatal http:// bit.ly/28JMVqi;;7.45469E+17;y;Awareness
UTPlantDoc;3/17/2016 21:21;1;"@HawkinsPartners Powdery mildew is an issue on Princeton elm; suspect elm phloem necrosis was found in a nursery in recent years.";;7.10562E+17;y;self
GreenThumbGirls;6/5/2016 21:14;3;@Witches_4_Weed True. Low temps & high humidity can lead to powdery mildew on plants outside. My lilac always gets hit. Usually in Fall.;;7.39536E+17;y;self
GARNetweets;4/5/2016 17:16;0;#sls16 Mary Wildermuth http:// nature.berkeley.edu/wildermuthlab/ Wildermuth_Lab_website/Introduction.html … on the intimate interaction between powdery mildew and plants… not as nice as it sounds!;#sls16;7.1737E+17;y;Research
cooking_news;6/26/2016 12:30;0;Gary Church: Homemade recipes that will prevent powdery mildew http:// ow.ly/SCOh501MedO;;7.47014E+17;y;Awareness
wheat_papers;5/14/2016 18:16;0;Molecular cloning, functional verification, and evolution of TmPm3, the powdery mildew … http:// dlvr.it/LJkTfz pic.twitter.com/bCjCPGZ7hz;;7.31518E+17;y;Research
MarissaHeisel;5/25/2016 17:02;0;Powdery Mildew can be a BIG problem for gardeners, so I'm giving away a great way to fight back naturally! WIN HERE: http:// ow.ly/PuuC300u7wd;;7.35486E+17;y;Awareness
wheat_papers;5/19/2016 10:28;1;Mapping of Powdery Mildew Resistance Gene pmCH89 in a Putative Wheat-Thinopyrum intermedium Introgression Line. http:// dlvr.it/LLgJq4;;7.33213E+17;y;Research
DesignGreen_ind;5/7/2016 4:35;0;Control powdery mildew infection on plants with diluted milk spray. http:// ow.ly/3xMt6Q pic.twitter.com/Spr7e7wLcr;;7.28775E+17;y;Awareness
theGRDC;6/8/2016 4:02;1;Key points on foliar #fungicide strategies for managing #wheat powdery mildew http:// bit.ly/1XzOpre @AusCropDiseases @GRDCUpdateWest;#fungicide #wheat;7.40363E+17;y;Awareness
powderymildews;3/3/2016 21:31;1;"IS-MPMI Powdery Mildew 1-day mtg (Sat. July 16, 2016; Double Tree Hotel, Portland OR). More information to follow.";;7.05491E+17;y;Ad
BornToOrganize;5/5/2016 20:14;0;Great, organic tips: #gardening Controlling or Eliminating Powdery Mildew - http:// go.shr.lc/1HTEbcw via @shareaholic;#gardening;7.28287E+17;y;Awareness
arijameiers;6/15/2016 19:59;0;ASPIRIN is the remedy for fungal plant problems, Black spot, powdery mildew , and rust are a terrible http:// pinterest.com/pin/5573205226 19995904/ …;;7.43141E+17;y;Awareness
EricaHol;6/20/2016 23:46;1;Starting to find powdery mildew in some cereal fields. Every field is different. #AbAg pic.twitter.com/Bq7NEotfh5;#AbAg;7.4501E+17;y;self
cluebot;5/17/2016 6:25;0;Fungi confirmed not fun guys. Found powdery mildew on my sage plant. D:;;7.32427E+17;y;self
AiroClean420;5/12/2016 20:50;0;Learn how to get rid of powdery mildew in 5 steps to keep your growing environment fungus-free. http:// buff.ly/1T7nAG9;;7.30832E+17;y;Awareness
FVCoop;4/11/2016 19:06;1;Soil Temp. 49° Wheat is at the joint stage. We are seeing tan spot, powdery mildew and stripe rust #FVCoop;#FVCoop;7.19572E+17;y;self
gaia_surf;5/8/2016 4:43;0;@juliawb Not downy mildew or powdery mildew ?;;7.2914E+17;y;Others
ewlarson546;5/31/2016 16:14;0;Aspirin is the remedy for fungal plant problems, Black spot, powdery mildew , and rust are a terrible http:// pinterest.com/pin/3460031838 53631972/ …;;7.37648E+17;y;Awareness
karenschlegel;6/5/2016 23:51;0;@newstigger I had powdery mildew on my courgettes last year... This year will only be watering the soil in the hope it doesn't happen again!;;7.39575E+17;y;Others
JOURNALIJAR;5/24/2016 9:36;0;Field screening of linseed genotypes for resistance to powdery mildew (Oidium lini Skoric) in the north central plateau zone of Odisha. -;;7.35012E+17;y;Research
wheat_papers;3/5/2016 23:25;1;Identification and genetic mapping of PmAF7DS a powdery mildew resistance gene in bread… http:// dlvr.it/Khs1dR pic.twitter.com/33dC4UT0k7;;7.06244E+17;y;Research
pjderoc;6/4/2016 19:58;0;@CameronHild @field2fieldag @AgriTrend Powdery mildew loves wet, humid conditions. Stage of crop? Are u planning a T2 or T3 fungicide app?;;7.39154E+17;y;Others
estebanics;6/11/2016 0:36;0;powdery mildew , the black plague of cannabis;;7.41399E+17;y;Others
Nicole_WardUK;5/9/2016 12:00;0;Our hemp experiment continues. Young hemp plants are being inoculated with powdery mildew . #plantdisease #UKAg ... http:// fb.me/5ZeU0tfxG;#plantdisease #UKAg;7.29612E+17;y;Awareness
GARNetweets;4/5/2016 17:30;0;#SLS16 MW linking the ploidy of host cells and infection of powdery mildew http:// apsjournals.apsnet.org/doi/abs/10.109 4/MPMI-10-12-0254-R …;#SLS16;7.17374E+17;y;Research
Susang6;4/28/2016 12:07;0;2 Organic fungicides that kill Powdery Mildew , I use them in my garden, they work http:// brev.is/8DzC;;7.25627E+17;y;Awareness
Susang6;4/20/2016 20:32;0;You can put a stop to powdery mildew with these garden tips http:// brev.is/C7zC;;7.22856E+17;y;Awareness
HowBoutDemApplz;6/22/2016 0:39;0;"Wikipedia confirms that #JonagoldApples are a clonally-propoagated cultivar"" with a ""high susceptibility to powdery mildew ."" BURNED!!""";#JonagoldApples;7.45386E+17;y;Awareness
